,Unnamed: 0,title,score,created,Sentiment
0,0,"New visa proposal to help move more foreigners to the US to ""create"" the next Google?  Get real.",1,2010-01-01,0.4019
1,1,Langkah Setting Google Public DNS,1,2010-01-01,0.0
2,2,Google and India Test the Limits of Liberty ,1,2010-01-02,0.5267
3,3,Google phone debut expected this week!,1,2010-01-04,0.0
4,4,"Chrome vs Safari, Google eats apple!",1,2010-01-04,0.0
5,5,Buy Valium Online From EasyBus? EasyBus gets hacked on Google.,0,2010-01-04,-0.4019
6,6,Icelandic president refuses to sign bill approved by congress about paying back IceSave account holders in Britain and Holland. The bill will now be subject to a national vote.,45,2010-01-05,0.4215
7,7,Iranian diplomat in Norway resigns in protest of the treatment of demonstrators (google translate),12,2010-01-05,-0.5106
8,8,"Google Superphone ""Nexus One"" is official",2,2010-01-05,0.0
9,9,"Wired story about suicide bombing killing CIA drone pilots appears to have been censored; not just on Wired, but reddit and Google too",2,2010-01-05,-0.6956
10,10,"Sport w sieci | taniec-dembowa.pl zaprasza do promowania stron, promocja stron w google",1,2010-01-06,0.0
11,11,"Urokliwy spacer w?r?d zielonych drzew i l?ni?ce t?umiki | taniec-dembowa.pl zaprasza do promowania stron, promocja stron w google",1,2010-01-06,0.0
12,12,Google is a very useful and powerful search engine but do You know how much information that You give away when You make use of it?,19,2010-01-07,0.4816
13,13,"NATURA W WALCE Z DACHEM | fform.pl zaprasza do promowania stron, promocja stron w google",1,2010-01-06,0.0
14,14,Google is getting into the energy business,1,2010-01-07,0.2732
15,15,"France considers tax for Google, Yahoo and Facebook",2,2010-01-08,0.0
16,16,Frrance proposes ad tax on Google,0,2010-01-07,0.0
17,17,"Nexus One Problems, Google Nexus One Complaints",1,2010-01-09,-0.6597
18,18,"Because of the cold weather - the city of Bergen, Norway is currently one of the most poluted cities of Europe. (Google translate)",1,2010-01-11,0.0
19,19,google nexus one samrtphone,1,2010-01-11,0.0
20,20,Google Nexus One: Oh Look Another iPhone Killer! | iPhone News Updated,1,2010-01-11,-0.68
21,21,"Google ""no longer willing to continue censoring our 
results"" on its Chinese search engine.",344,2010-01-12,-0.296
22,22,"Annoyed about your bottle of water not being allowed on a plane? To this woman, it was a bottle of diabetes transplant cells.",19,2010-01-12,-0.3818
23,23,"Google fed up Chinese hacking human rights advocates, may leave China",18,2010-01-12,-0.0516
24,24,Let's be clear: Google's search engine share in China rose over 4% last quarter at the expense of Baidu; Google is not running because they are losing in China!,18,2010-01-13,0.3595
25,25,"Google says it will no longer agree to censor its search engine in China and threatens to pull out, following cyber attack.",9,2010-01-12,-0.8126
26,26,Google Locks Down Gmail with Secure HTTP,8,2010-01-13,0.34
27,27,Researchers identify command servers behind Google attack,164,2010-01-14,-0.4767
28,28,Google agrees to take down Encyclopedia Dramatica link to page about Aboriginals.,60,2010-01-14,0.2023
29,29,"Chinese plead with Google not to quit - Web users 
risk wrath of state with floral tribute outside 
internet giant's Beijing HQ",8,2010-01-13,-0.2732
30,30,"Researchers confirm that the Chinese goverment was behind the attack on Google. ""the government of China has been engaged for months in a massive campaign of industrial espionage against US companies.""",660,2010-01-15,-0.1027
31,31,"WSJ Clears up confusion over Google and China, including profit margins, .com access etc - via 'A Googler' @twitter",2,2010-01-15,0.25
32,32,"Google china: Google China Attacks Presage Battle With US. to 
Shape Internet, is google will loss their job with chinese..?",1,2010-01-15,-0.7783
33,33,Alibaba says Yahoo 'reckless' on Google stance,12,2010-01-16,0.0
34,34,Google Users in China Fear Losing Important Tool - NYTimes.com,1,2010-01-16,-0.6124
35,35,Beautiful hacker from China named Xiao Tian forced to leave Google in China,1,2010-01-16,0.1779
36,36,Google Rethinking its Challenge to China,3,2010-01-16,0.0772
37,37,"Be afraid, China, the Google dragon stirs | One of the more overworked phrases in the modern geopolitical lexicon is “the clash of civilisations”. ",3,2010-01-17,0.0
38,38,Google Nexus One Release,1,2010-01-17,0.0
39,39,Google Pledge of No Censoring Spurs Tiananmen Searches in China,4,2010-01-18,-0.296
40,40,Google helping Haitians to get in touch with lost friends and family ,1,2010-01-17,0.4588
41,41,BBC World Service - Business - Yahoo pulled into row between Google and China,1,2010-01-18,0.0
42,42,Google postpones mobile phone launch in China,29,2010-01-19,-0.2732
43,43,"At least two Beijing, China, bureaus of news organizations have had their Google e-mail accounts attacked, with e-mails forwarded to a mysterious address, according to the Foreign Correspondents' Club of China.",5,2010-01-18,-0.4588
44,44,Google Under Attack: The High Cost of Doing Business in China ,5,2010-01-19,-0.4767
45,45,Chinese media hit at ‘White House’s Google’,2,2010-01-20,0.0
46,46,Security researcher IDs China link in Google hack,1,2010-01-20,0.34
47,47,China says Google no exception to the law,0,2010-01-19,-0.296
48,48,Chinese papers: U.S. agenda behind Google row,2,2010-01-21,0.0
49,49,"Port-au-Prince, Haiti - Google Maps - Collapsed National Palace and surrounding areas (UPDATED SATELLITE IMAGERY SINCE EARTHQUAKE)",1,2010-01-21,-0.2732
50,50,China plays down Google spat before Clinton speech,1,2010-01-21,0.25
51,51,China vs. Google: Beijing fights back,12,2010-01-22,-0.4019
52,52,How much money has been donated to the Haiti relief effort?,2,2010-01-22,0.4767
53,53,"Google and China row: Internet censorship is modern Berlin Wall, laims Clinton",1,2010-01-21,0.0
54,54,Google Traffic Booster,1,2010-01-23,0.0
55,55,Google Founders To Sell 10 Million Shares,1,2010-01-23,0.296
56,56,Satellite Maps of Haiti Quake from Bing and Google ,1,2010-01-23,0.0
57,57,"Google co-founders Larry Page and Sergey Brin are selling 10 million of their shares, raising $5.5bn (£3.4bn) at today's prices. Their 59% voting rights will be reduced to 48%",1,2010-01-24,0.296
58,58,"China widened its attack against U.S. criticisms of Internet censorship on Monday, raising the stakes in a dispute that has put Google in the middle of a political quarrel between the two global powers.",3,2010-01-25,-0.7717
59,59,U.S. enables Chinese hacking of Google,2,2010-01-26,0.0
60,60,Google maps has high-resolution post-earthquake satellite imagery of Haiti; here's the national palace.,1,2010-01-26,0.0
61,61,Apple dumping Google for Bing,1,2010-01-26,-0.3182
62,62,The amount of power Google has just amazes me!,0,2010-01-26,0.5411
63,63,Is google back in China? Wait... Goojje?,11,2010-01-28,0.0
64,64,Are the Chinese Google and YouTube clones any good?,5,2010-01-29,0.4404
65,65,Is Google Fooling India? ,1,2010-01-29,-0.4019
66,66,"Fake YouTube, Google websites surface in China",0,2010-01-28,-0.4767
67,67,"En China no se preocupan por Google, ahora tienen Goojje.",1,2010-01-30,-0.296
68,68,The deep cultural background to China's confrontation with Google,0,2010-01-30,-0.3182
69,69,Buy Google Stocks Straight from Larry Page and Sergey Brin !! Google Founders Share their Google Shares !,1,2010-01-31,0.7332
70,70,The Chinese government's stance on the Google fiasco,1,2010-01-31,-0.5106
71,71,IPL Google Deal - IPL's 2010 season will be broadcast live on YouTube!,1,2010-02-01,0.0
72,72,Naked man pursues Google,12,2010-02-02,0.0
73,73,Google has officially added multitouch to Nexus One - GSM PRESS,1,2010-02-03,0.0
74,74,"""Islam is"" auto-fill is back on Google search",1,2010-02-03,0.0
75,75,Russia dumped nuclear waste in the Baltic sea during the 90's,1,2010-02-03,-0.6705
76,76,Standford University Extends Its Partnership With Google Books,2,2010-02-04,0.128
77,77,Google tablet: immagini e anticipazioni,1,2010-02-04,0.0
78,78,Your Google searches may now be monitored by the NSA,0,2010-02-04,0.0
79,79,Google And NSA,1,2010-02-04,0.0
80,80,Romania accidentally sends troops and aid to Tahiti (google translated),1,2010-02-05,-0.34
81,81,Google Chromium kalah start vs Apple Ipad Komputer Lifestyle On The Net ?,1,2010-02-04,0.0
82,82,Steve Jobs: Google wants to kill the iPhone,1,2010-02-06,-0.6908
83,83,Stadien der FIFA WM 2010 in Südafrika auf einer Google Maps Karte,1,2010-02-07,0.0
84,84,Google Runs Parisian Love Ad On Super Bowl,1,2010-02-08,0.8442
85,85,Google prepares Facebook assault,1,2010-02-09,-0.5859
86,86,"Doodle 4 Google - ""If I Could Do Anything, I Would...""",1,2010-02-09,0.0
87,87,Iran Says It Will Permanently Shut Down Google Email Services in the Country,382,2010-02-10,0.0
88,88,With Glowing Hearts The Olympics Kills The Arts (Before and After [pic] inside),363,2010-02-10,-0.5423
89,89,The government crackdown has begun: Iranian users can't access Gmail: Google,2,2010-02-10,0.0
90,90,Google trying hard to do no evil to Australians.,4,2010-02-10,-0.7906
91,91,Australian government currently in talks with Google to put in place the same filtering system as China. This includes all information available on Youtube as well as Google. Heres to hoping that they'll stand up to Conroy like they did to China.,4,2010-02-11,0.7506
92,92,Google entering into Broadband business,1,2010-02-10,0.0
93,93,"Pakistan, Iran, and... Australia? Let's censor Google!",2,2010-02-12,-0.5093
94,94,Google preparing instant translator for Nexus One,1,2010-02-12,0.0
95,95,"500,000 Americans To Get 1 Gbps Connections From Google",1,2010-02-12,0.0
96,96,Google to Launch an Online App Store,1,2010-02-13,0.0
97,97,Google No Longer Supporting IE6,1,2010-02-13,0.1779
98,98,Google 1st daiting web site on its way - Google Crush,1,2010-02-12,-0.1531
99,99,Why Google Buzz is going to be popular in India? ,1,2010-02-14,0.4215
100,100,"Dear Worldnews, I submit to you photos/videos/stories of a Google-mapped trip along the longest railroad in the world: the Trans-Siberian Railroad.",11,2010-02-16,0.3818
101,101,"Many people are somewhat familiar with Google Adsense, Yahoo, Bidvertiser, Chitika, Adbrite…etc. However, most of them actually don’t know what they are and how their system is working. ",1,2010-02-17,0.0
102,102,When you google the Goldstone report (UN report on the Israeli military campaign in Gaza in Jan 09) three of the top five results are smear attempts trying to discredit it. WE CAN CHANGE THIS REDDIT!!,0,2010-02-18,-0.3147
103,103,FREE Google Buzz Icon,1,2010-02-19,0.6166
104,104,"The German Digital Library wants to make millions of books, films, images and audio recordings accessible online. More than 30,000 libraries, museums and archives are expected to contribute their digitized cultural artifacts. The idea, in part, is to compete with Google Books. But will it work?",27,2010-02-20,0.0
105,105,Probe traces Google hack to Chinese Schools,1,2010-02-19,0.0
106,106,"Google to sell electricity, becomes more than a internet search company",1,2010-02-20,0.0
107,107,"Google to sell electricity, becomes more than a internet search company",1,2010-02-20,0.0
108,108,Germany’s federal data protection commissioner seeks to “limit and control the power” of 'quasi-monopoly' Google. “A company increasingly controls the virtual world. We’ve never seen such a thing in the real world.”,2,2010-02-23,0.0
109,109,Germany’s federal data protection commissioner Peter Schaar seeks to “limit and control the power” of 'quasi-monopoly' Google. “A company increasingly controls the virtual world. We’ve never seen such a thing in the real world.”,1,2010-02-23,0.0
110,110,"Italian thugs upload youtube video showing them beating up an autistic kid. Youtube takes video down within hours. 4 google employees charged, 3 found guilty. WTF?!",3027,2010-02-24,-0.784
111,111,Google under investigation for alleged breach of EU competition rules. ,7,2010-02-24,0.0
112,112,"Fascism in Finland: The government takes child from Russian-Finnish family because he mentioned that he wanted to move to Russia at school. Here's the kicker, the kid has Russian citizenship. (Google translate link)",5,2010-02-24,0.0
113,113,A good explanation of why the Google legal representatives in Italy were prosecuted,8,2010-02-25,0.2023
114,114,"EU Commission Investigates: 
How Anti-Competitive Is Google?",8,2010-02-25,0.0
115,115,Italian court has convicted three current and former Google executives on privacy violations : NPR,4,2010-02-25,-0.5267
116,116,Pacific Tsunami - What about the Pitcairn Islands?,1,2010-02-27,0.0
117,117,Google Launches Chile Earthquake Person Finder,1,2010-02-27,0.0
118,118,"Murdoch ""ready to sue"" Google",1,2010-03-01,0.3612
119,119,Wayne Dell Manuel Is First Google Map Maker Winner,1,2010-03-02,0.5859
120,120,Topeka Is Now Google?,1,2010-03-02,0.0
121,121,Update: 5 Flavors of Google Buzz Icon released,0,2010-03-02,0.0
122,122,New Google Chrome Beta learned To Traslate Webpage Automatically with Enhanced Privacy Settings,2,2010-03-03,0.0
123,123,"Topeka Kansas renames itself Google, Kansas",1,2010-03-03,0.0
124,124,Google se hace con la patente de publicidad geolocalizada ,1,2010-03-03,0.0
125,125,Free Google business listing advertising,1,2010-03-04,0.5106
126,126,Microsoft to stay its China course despite Google spat,0,2010-03-05,0.0
127,127,Google indexará en tiempo real mediante Push.,1,2010-03-06,0.0
128,128,LIFE and Google bring us 10 million historic images,14,2010-03-09,0.0
129,129,Google wants to U.S. to challenge China in the WTO,3,2010-03-09,0.0772
130,130,Phone Nigeria iPhone - Google CEO Says Company Still Supports IPhone,1,2010-03-09,0.3612
131,131,Google Android platform commands 7.1% U.S. Smartphone market share in Jan 2010,1,2010-03-10,0.296
132,132,"Taking on the Internet Giants - 
Germany Applies Brakes to Google & Co.",2,2010-03-11,0.0
133,133,China to Google: Oh it's on now!,1,2010-03-12,0.0
134,134,Google Big talk no action! ,1,2010-03-12,-0.3595
135,135,Google ‘99.9 Percent’ Sure to Shut Down in China (Update1) - BusinessWeek,50,2010-03-13,0.3182
136,136,"Google 99.9 pct sure to shut China search engine: report
| Reuters",4,2010-03-13,0.3182
137,137,Google denies 'exit China' rumor,1,2010-03-13,-0.4215
138,138,Google is putting it's money where it's mouth is! ,1,2010-03-15,0.0
139,139,"Google Says China Talks Continue, But Pullout Signs Grow",1,2010-03-15,0.0
140,140,Google to China: No censorship ,22,2010-03-16,-0.296
141,141,"All the information about google earth, view maps, buildings, new features, how to use, news, related articles, videos, and more.",1,2010-03-16,0.0
142,142,Microsoft lanza una campaña contra Google y Openoffice en YouTube - Noticias dyweb.com.ar,0,2010-03-15,0.0
143,143,"China without Google: 'a lose-lose scenario', BEIJING – China without Google — a prospect that looks increasingly likely — could mean no more maps on mobile phones. A free music service that has helped to fight piracy might be in jeopardy. China's fl",1,2010-03-17,-0.6692
144,144,Google It:  Facebook Bigger Now,1,2010-03-16,0.0
145,145,"Google phone now works on iPhone's wireless system, Google Inc. has upgraded its Nexus One phone so it works on the same high-speed wireless network as Apple Inc.'s iPhone, putting the increasingly antagonistic rivals on an even more direct collision",1,2010-03-17,-0.6682
146,146,Australian web censors threaten to block Encyclopedia Dramatica - they've already forced Google to remove it from their search results.,13,2010-03-17,-0.8658
147,147,Google TV,0,2010-03-17,0.0
148,148,google leaves china? no biggie,1,2010-03-19,-0.296
149,149,Google removes Street View pictures of SAS Headquarters,6,2010-03-20,0.0
150,150,China state media accuses Google of political agenda,0,2010-03-21,-0.34
151,151,Chinese netizens' open letter to the Chinese Government and Google,4,2010-03-22,0.0
152,152,Google Reroutes Site From Chinese Mainland to Hong Kong to Bypass Censors ,4,2010-03-22,-0.296
153,153,RIP Google.cn: Google Closes Its Search Operation in China,1,2010-03-22,0.0
154,154,"More Good News Today! Australia's Internet Filter Slammed by Microsoft, Yahoo, Google, Others in Gov't Report (new!)",681,2010-03-23,0.5827
155,155,"Searching questions - 
Google defies China's censors and risks being blocked. Its woes send a chilling message",8,2010-03-22,-0.8126
156,156,BBC News - Chinese netizens divided over Google move,4,2010-03-23,0.0
157,157,Google fined for uncensored dirty jokes,31,2010-03-23,-0.2263
158,158,China newspaper accuses Google of helping U.S. intelligence,9,2010-03-24,0.4404
159,159,Brazil fines Google for not censoring dirty jokes,3,2010-03-23,0.1695
160,160,'Dell and Go Daddy threaten to follow Google out of China'. Well done China!,259,2010-03-25,-0.2003
161,161,"China - ""Google is not God""",1,2010-03-25,-0.2057
162,162,You WILL Listen! Google moves to Hong Kong,1,2010-03-25,0.0
163,163,Google booted from China's number two carrier,15,2010-03-25,0.0772
164,164,China issues media rules for stories on Google,3,2010-03-26,0.0
165,165,China Attempts To Set Censorship Rules For Media (aka DO NOT go in favor of Google),1,2010-03-26,-0.3089
166,166,Australian government to try and pass internet filter within weeks. Senator Conroy tries to lambaste Google and fails. Poll within - you know what to do Reddit.,106,2010-03-29,-0.4215
167,167,China's government appeared to block almost all searches by Chinese users on Google sites Tuesday,3,2010-03-30,-0.4404
168,168,Google and the US State Dept. vs. Senator who sponsored the Australian Web Filter:  The Battle of Words Gets Hot!,2,2010-03-29,-0.4389
169,169,"That's it - I can't take it anymore. I've switched my home page from Google News back to Yahoo News. I'm sick and tired of getting ready to click a link to a news story, only to discover it's from Fox ""news"", or a teaser from the WSJ.",1,2010-03-30,-0.6908
170,170,"U.S. agencies don't need a court-ordered warrant (or 
even hack into Google) to get personal online data... 
simple subpoenas will suffice.",0,2010-03-31,0.0
171,171,Google continues internet censorship outside of China,2,2010-04-01,0.0
172,172,Google Topeka: Kansas City Changing into Google City,1,2010-04-01,0.0
173,173,Google Topeka,1,2010-04-01,0.0
174,174,iPad Apps hitting Google Trend,1,2010-04-02,0.0
175,175,Topeka Google Logo,1,2010-04-02,0.0
176,176,"Topeka Google Logo, Behind the Topeka Google logo Scene",1,2010-04-02,0.0
177,177,"In post-Google China, censorship is unfazed",11,2010-04-03,0.0
178,178,"If Google Indexing Goes Real-Time, What Will it Mean for Ranking?",1,2010-04-04,0.0
179,179,Google VS China,1,2010-04-04,0.0
180,180,Google & Mcafee: Vietnamese government is spying and blocking sites on tens of thousands of computers by installing malware,2,2010-04-06,-0.3818
181,181,"I'll stop Google taking our news for nothing, says defiant Miserable Old Git",35,2010-04-07,0.2718
182,182,For shame google!,1,2010-04-07,-0.5255
183,183,Visual Artists to Sue Google over lack of compensation,1,2010-04-08,-0.3182
184,184,"Google Earth helps discover rare hominid ancestor in South Africa: Today, scientists announced a new hominid fossil discovery in the Cradle of Humankind World Heritage Site in South Africa.  dating to between 1.78 and 1.95 million years.",1,2010-04-08,0.3818
185,185,Google Street View driver escapes axe attack,1,2010-04-09,-0.4588
186,186,About the Polish presidents' plane crash from a Pole.,107,2010-04-10,-0.4019
187,187,Google Includes Speed Factor - Is Your Website Ready?,1,2010-04-11,0.3612
188,188,Google adds a touch of Microsoft to applications,1,2010-04-13,0.0
189,189,Man slams Google Street View over garage break-ins,0,2010-04-13,0.0
190,190,An Italian judge explained in a court document why he found three Google executives guilty of violating privacy laws there.,0,2010-04-12,-0.743
191,191,Google vs China: the endgame,2,2010-04-13,0.0
192,192,Another volcano eruption in Iceland. ,1,2010-04-14,0.0
193,193,Thinking in the WORLD CUP? me too... well I found a very cool website implemented for social networking about soccer. If you love Spain you will love this website. Use your google translator if you need help with something... I hope you like it guys,0,2010-04-15,0.9647
194,194,Google Launches People Finder to Help Victims of Quake in China,0,2010-04-14,0.1027
195,195,"""75% chance that 'Monster volcano' awakens"" - Dagbladet.no via google translate",36,2010-04-16,0.25
196,196,How I Ranked in #1 Page of GOOGLE Without Any Content?,1,2010-04-15,0.0
197,197,"An improving economy and a return of large advertisers enabled Google to get off to a ""very positive"" start of the year.  -- Or was it The Murdoch Effect?",0,2010-04-15,0.7713
198,198,Google New Welcome Screen ?OPEns Up Digg.COM ?,0,2010-04-17,0.5204
199,199,"La stampante entra nella ""nuvola"" di Google",1,2010-04-18,0.0
200,200,"List of banned news in China, orders from the Ministry of Truth, updated daily [Google Translate]",12,2010-04-19,-0.1779
201,201,"Who has the most successful foreign policy in the world? Answer: Google. You might argue that Google is not a country, but if it were it would be the world's 87th biggest economically, just behind Ethiopia. And it certainly has a foreign policy and a clear mission - ""Don't Be Evil""",0,2010-04-19,0.9204
202,202,Google now publicly displaying government requests to remove data from their sites.,77,2010-04-20,0.0
203,203,Google now has a page up showing government takedown & data requests by country (with map!),1,2010-04-20,0.0
204,204,Trojan as Fake Google Chrome Extension - Malware City Blogs,1,2010-04-20,-0.4767
205,205,"Brazil, US, UK lead number of requests to Google for user data and censorship",30,2010-04-21,0.0772
206,206,Google Shows Government Information and Takedown Requests,11,2010-04-21,0.0
207,207,The arrival of Google Buzz last month represents another twist in the already confusing social media landscape.,1,2010-04-21,-0.2263
208,208,"Google 'not interested' in privacy, say information tsars",13,2010-04-22,-0.3089
209,209,Google in Hot Water for Mapping European Homes' Wireless Networks With Street View Car,1,2010-04-23,0.0
210,210,"Google fined for ""paedophile"" libel against priest (Brazil)",26,2010-04-25,0.0
211,211,Muhammad cartoon controversy protest in London in 2006--more provocateurs?,8,2010-04-26,-0.25
212,212,Man found his wife on Google Street View 43 TIMES. ,0,2010-04-27,0.0
213,213,Google Translator Mesin Penerjemah Online,1,2010-04-28,0.0
214,214,Image overlay of the oil spill in the Gulf of Mexico | Google Earth Blog,1,2010-04-29,0.0
215,215,A German scientist has developed one of the first translation programs suitable for everyday use. Sheer computing power gives the Google software surprisingly good results -- perhaps the best yet seen created by a machine.,33,2010-04-30,0.8834
216,216,Google Warns of Fake Anti-virus,1,2010-04-30,-0.5423
217,217,Tentang Tembolok Google Chace,1,2010-05-01,0.0
218,218,Google invests in Next Era Energy wind farm located in North Dakota,1,2010-05-04,0.2732
219,219,Why Google sued a tiny blues music label,1,2010-05-07,0.0
220,220,Aero + Light weight + Safety : Electric Cars from Google,1,2010-05-07,0.4215
221,221,Google took the energy farm: 40  million $,1,2010-05-07,0.2732
222,222,Israel threatens to bomb Aid ships heading to Gaza (Google Translate),1,2010-05-08,-0.7003
223,223,How to put your site on the Google first page,1,2010-05-10,0.0
224,224,The mayor wants the garden gnomes dead (google translate),1,2010-05-14,-0.6486
225,225,"Burqua or not, don't try to get your democratic rights in Europe while not  showing your face.",0,2010-05-13,0.0
226,226,Google has admitted that for the past three years it has wrongly collected information people have sent over unencrypted wi-fi networks.,87,2010-05-14,0.1027
227,227,Google Says It Mistakenly Collected Wi-Fi data including web usage data from its StreetView vans,5,2010-05-15,-0.296
228,228,Google found snooping on WiFi,1,2010-05-16,0.0
229,229,"Google ""accidentally"" taps into and records information from private networks",0,2010-05-16,0.0
230,230,Google Adwords Misuse / Another attack on Google from China,1,2010-05-17,-0.4767
231,231,Germany Gives Google Deadline on Data Use,0,2010-05-18,0.0
232,232,Germany Launches Criminal Investigation of Google ,2,2010-05-20,-0.5267
233,233,German Prosecutors investigating Google,0,2010-05-20,0.0
234,234,Hamburg Prosecutors Investigating Google over Data Capture,0,2010-05-20,0.0
235,235,Google Celebrates Pacman – The Best Google Doodle Ever :) ~ PRO HACK,1,2010-05-21,0.8979
236,236,"30° anniversario di PAC-MAN, si continua a giocare online su Google anche oggi!",1,2010-05-21,0.0
237,237,Google has released Android 2.2. What new features does it have?,1,2010-05-23,0.0
238,238,"Google teams with Sony, Intel To Merge Internet and TV - Coming This Fall ",0,2010-05-23,0.0
239,239,Norwegian press gives the real story about what's happening with the gulf oil cleanup... We really aren't getting the whole story here.  (Use Chrome or Google page translation),38,2010-05-24,0.0
240,240,eHarmony Hotness: Spicy according to Google  | Damego,1,2010-05-26,0.0
241,241,"Il gioco Pac-Man nella home page di Google, ha""rubato"" quasi 5 milioni di ore alla produttivita' globale.",1,2010-05-26,0.0
242,242,Doodle for Google: l'ecologia ispira il vincitore del concorso per bambini di Google,1,2010-05-26,0.0
243,243,Countries Launch Investigations Into Google Wifi Collecting,2,2010-05-28,0.0
244,244,Google: We don't do Windows.,0,2010-05-31,0.0
245,245,First interview with Swedish Member Of Parliament who was on the Gaza flotilla. With Google translation.,1,2010-06-02,0.0
246,246,"Kim Jong-il from above (not his atomic mushroom hairdo, but his palaces as seen on Google Earth)",0,2010-06-02,0.0
247,247,Google has mapped every WiFi network in Britain  ,0,2010-06-02,0.0
