,Unnamed: 0,title,score,created,Sentiment
3550,3550,Google Hangouts Now Lets You Make Free One- Minute International Calls,8,2014-10-29,0.5106
3551,3551,Former Google engineer Munawad Salman released after counselling. He had tried to join ISIS,1,2014-10-29,0.296
3552,3552,Welcome to Facebook Log In Sign up or Learn More Google Custom Search Engine Settings,1,2014-10-30,0.4588
3553,3553,PPC Marketing - Brand Promotion through Google Adwords,1,2014-10-30,0.0
3554,3554,"Spain's New ""Google Tax"" Could Be Bad for Everyone",2,2014-10-31,-0.5423
3555,3555,Google desenvolve pulseira para detectar câncer - BBC Brasil,0,2014-10-31,0.0
3556,3556,"Pay rise for 60,000 workers after surge in firms signing up to living wage | Rate to be increased on Monday while list of living wage employers passes 1,000, including Google, Barclays and ITV",276,2014-11-02,0.1779
3557,3557,Google Penalty Recovery Case Study – How We Lifted An Unnatural Link Penalty For E-commerce Client in 5 steps!,1,2014-11-03,-0.7424
3558,3558,"Google finds CDC data, not you, is better at tracking flu",0,2014-11-03,-0.6131
3559,3559,Motorola Droid Turbo vs. Google Nexus 6 ~ Tech Mechanism,1,2014-11-04,0.0
3560,3560,Google is Developing Cancer and Heart Attack Detector,1,2014-11-04,-0.8176
3561,3561,"""Germany's biggest news publisher Axel Springer has scrapped a move to block Google from running snippets of articles from its newspapers, saying that the experiment had caused traffic to its sites to plunge.""",20,2014-11-05,-0.4404
3562,3562,Tech Giant Google Installs Bitcoin ATM in London Campus,20,2014-11-05,0.0
3563,3563,"Google, Amazon and Apple less transparent than Gazprom, says report",1,2014-11-05,0.1779
3564,3564,Google has introduced International Voice Calls from Hangouts in India - Gadget Slash,1,2014-11-07,-0.2732
3565,3565,Google Analytics to Increase Users Traffic for the WebsitesGoogle Analytics to Increase Users Traffic for the Websites,1,2014-11-07,0.5574
3566,3566,Following Germany’s Lead Spain Passes Misguided “Google Tax” Anti-Piracy Law | New law likely to backfire on Spanish publishers.,1,2014-11-08,0.0
3567,3567,Google secret projects that you probably didn't know about!,1,2014-11-08,0.0
3568,3568,Elon Musk and Google want to develop satellites for global internet access.,2473,2014-11-08,0.0772
3569,3569,The 25th Anniversary of the Fall of the Berlin Wall Google Doodle,1,2014-11-09,0.0
3570,3570,"Google donates $10M to fight Ebola, launches public fundraising campaign",74,2014-11-10,-0.3818
3571,3571,"Google donating $10 million to fight Ebola, launches donation matching campaign",5,2014-11-10,-0.3818
3572,3572,Best google android app,1,2014-11-10,0.6369
3573,3573,"Google to give $2 for every $1 you donate for fighting the Ebola crisis, until $7.5 million are raised.",59,2014-11-10,-0.765
3574,3574,"Google Launches Ebola Donation Campaign, Matches Donations 2:1",19,2014-11-10,0.0
3575,3575,Google donating $2 to fight Ebola for every $1 you donate.,18,2014-11-11,-0.3818
3576,3576,"Google to lease former Nasa airfield: Google latest ""moonshot"" is an apt one - it is investing in a Nasa-owned airfield to expand research into space exploration and robotics.",381,2014-11-11,0.4939
3577,3577,Google signs 60-year lease to do research at NASA's Moffett airfield,8,2014-11-11,0.0
3578,3578,Google DFP is down worldwide,1,2014-11-12,0.0
3579,3579,"Google Is Driving A Bus Across Bangladesh To Help 500,000 Students Learn About The Internet",7,2014-11-13,0.4019
3580,3580,Google wants US Privacy Act extended to Europe,3,2014-11-13,0.0
3581,3581,Google Nexus 6 price in USA,1,2014-11-13,0.0
3582,3582,"Content Writing Services, Hire Content Writers Ahmedabad, Google Penalty Recovery SEO Services, Content Writing Company Ahmedabad",1,2014-11-15,-0.4588
3583,3583,How Google Panda Influence Search Engine Optimizing?,1,2014-11-15,0.4588
3584,3584,"Google, Oceana Link Up in Battle Against Illegal Fishing",1,2014-11-15,-0.7351
3585,3585,"Google faces daily 1,000 euro fine in France if ‘right to forget’ article is not taken down",8,2014-11-16,0.2023
3586,3586,Google Releases Messenger for Android - Cyber Kendra,1,2014-11-16,0.0
3587,3587,Have Reddit users discovered a shipwreck off Boston's coast? Google Earth image appears to show vessel lying under water,5,2014-11-16,-0.5267
3588,3588,Google Play Music Now Has an Amazing Visualizer,1,2014-11-17,0.7351
3589,3589,Why the Cops Hate the New Apple and Google Phones,1,2014-11-18,-0.5719
3590,3590,Google to test-fly balloons which transmit internet over Australia,12,2014-11-19,0.0
3591,3591,Firing Range: Google Open Source Tool for Testing Web App Security Scanners - Cyber Kendra,1,2014-11-18,0.0
3592,3592,google webmaster setup tutorial,1,2014-11-19,0.0
3593,3593,Google Internet balloon crashes on farm in South Africa,2284,2014-11-20,0.0
3594,3594,Google News Will Now Pick Out News Stories It Thinks You Should Read.,7,2014-11-20,0.0
3595,3595,Google Internet balloon crashes on farm in South Africa,2,2014-11-20,0.0
3596,3596,European Parliament expected to push Google to break itself up.,387,2014-11-21,0.0
3597,3597,European Parliament reportedly wants Google to be broken up,102,2014-11-21,-0.4767
3598,3598,European parliament preparing to call for Google break-up,40,2014-11-21,0.0
3599,3599,"Google is changing the internet by offering people to pay a monthly fee between $1-3 to replace all their ads on participating websites like The Onion, wikiHow and Imgur with ""thank you"" messages. Everytime you visit them, part of your fee will directly go towards supporting them.",42,2014-11-22,0.7579
3600,3600,Europe’s parliament “poised to call for a break-up of Google”. “Unbundling” of search from other services considered in nonbinding resolution.,5,2014-11-21,0.0
3601,3601,"Google is chancing the internet by now offering people to pay a monthly fee between $1-3 per website to replace all there ads on those websites with ""thank you"" messages. Currently participating websites include The Onion, wikiHow and Imgur.",2,2014-11-22,0.2732
3602,3602,"Volcano eruption in Fogo island, Cape Verde, stared this morning, is already one of the largest ever recorded on the island. [Google translation]",2,2014-11-23,0.0
3603,3603,Google plans to monitor our bodies with nanoparticles. (from The Wall Street Journal),1,2014-11-22,0.0
3604,3604,Google Launches Service to Remove Ads from Websites,1,2014-11-23,0.0
3605,3605,European Parliament may propose plan to break up Google,53,2014-11-23,0.0
3606,3606,EU lawmakers to vote on Google break-up motion on Thursday,2,2014-11-24,0.0
3607,3607,Homophobic 'Ass Hunters' Game Removed From Google Play After 1000s Of Downloads -- Disgusting. The dev should be jailed.,0,2014-11-24,-0.8271
3608,3608,"Breaking up Google is just one possible antritrust option, EU lawmakers say",1,2014-11-25,0.0
3609,3609,Google Updates Its Search Engine On Smartphone And Tablet To Show New Product Details,1,2014-11-25,0.0
3610,3610,Google Release New Tool for Online Security - Cyber Kendra,1,2014-11-25,0.34
3611,3611,"EU Wants Google ‘Right to be Forgotten’ Deletions to Apply Everywhere - European Union court decided that people should be able to get search results deleted, but ruling just applies within Europe for now",734,2014-11-26,0.0
3612,3612,US lawmakers ask Europe not to break up Google | Ars Technica,111,2014-11-26,0.0
3613,3613,Google told to expand right to be forgotten,13,2014-11-26,0.1027
3614,3614,EU parliament votes for break-up of Google | EU lawmakers have voted in a favor of a resolution that would force Internet companies to separate search engines from commercial services.,25,2014-11-27,0.4019
3615,3615,Europe to vote on Google break-up,18,2014-11-27,0.0
3616,3616,"Google should be broken up, say European MPs",4,2014-11-27,-0.4767
3617,3617,"Google should be broken up, say European MPs",6,2014-11-27,-0.4767
3618,3618,"""European Union lawmakers overwhelmingly backed a motion on Thursday urging anti-trust regulators to break up Google""",5,2014-11-28,-0.1027
3619,3619,EU lawmakers have supported a motion urging anti-trust regulators to break up Google,2,2014-11-28,0.3182
3620,3620,"Gay marriage approved in Finland through citizens' legal initiative, a bio of activists who pushed it through [in Finnish, Google translate]",0,2014-11-29,0.5106
3621,3621,European Parliament Voted To Break Up Google,442,2014-11-30,0.0
3622,3622,EU Asks Russia's Yandex for Evidence in Potential Google Antitrust Case,2,2014-12-01,0.0
3623,3623,"Facebook, Google, And Twitter’s War For App Install Ads",1,2014-12-01,-0.5994
3624,3624,How to Create Your Own Theme on Google Chrome,1,2014-12-01,0.2732
3625,3625,Google co-founder Sergey Brin's wife is launching her DNA testing service in the UK amid privacy concerns,8,2014-12-02,0.0
3626,3626,The Spanish Civil War and Google Street View,2,2014-12-02,-0.5994
3627,3627,"£125 test for conditions from cancer to Alzheimer's - Saliva test, developed by Google-backed company which claims it can predict risk of everything from cancer to baldness, goes on sale in Britain",1,2014-12-02,-0.8979
3628,3628,"U.K. Introduces the “Google Tax”: The government took aim at tech companies and other international firms, proposing a 25% tax on profits on “economic activity” that is shifted overseas",387,2014-12-03,0.4404
3629,3629,"How do Apple, Google and Amazon avoid UK tax?",3,2014-12-03,-0.128
3630,3630,Google offer Android Development Kit Offline in DVD - Cyber Kendra,1,2014-12-03,-0.128
3631,3631,UK to implement 25 percent “Google tax” - Goal is to stop multinationals from dodging taxes on UK profits.,24,2014-12-03,0.0772
3632,3632,Google celebrates the anniversary of the birth of Anna Freud,1,2014-12-04,0.5719
3633,3633,"Google ""Translates"" Pictures Into Words Using Vector Space Mathematics",1,2014-12-04,0.0
3634,3634,Coupons Store-Daily Deals - Android Apps on Google Play,1,2014-12-06,0.34
3635,3635,Google Sniper3.0 Review,1,2014-12-06,0.0
3636,3636,Fears over commercialisation with child-focused Google,2,2014-12-07,-0.4215
3637,3637,The Google search engine is a powerful tool for finding information online,1,2014-12-07,0.4215
3638,3638,Fears for commercialisation of children as Google targets under-13s,0,2014-12-07,-0.4215
3639,3639,"Indonesia sparked the selfie trend, Google says",6,2014-12-09,0.0
3640,3640,Russian-Uzbeki oligarch Alisher Usmanov buyer of James Watson's Nobel Prize. Promises to return it. [Google Translated],5,2014-12-09,0.7096
3641,3641,30+ vulnerabilities found in Google App Engine - Cyber Kendra,1,2014-12-09,-0.1531
3642,3642,Latest top ten google adsense earner,1,2014-12-10,0.2023
3643,3643,Malala Yousafzai -A Google Trends Partner,1,2014-12-10,0.0
3644,3644,"Leaked email reveals secret anti-piracy meeting between Google, Sony, and the Department of Homeland Security",9,2014-12-11,0.0258
3645,3645,Google to shut Spanish news service - Online search giant Google is shutting down its Google News service in Spain before a new intellectual property law is introduced.,6,2014-12-11,0.5106
3646,3646,Google News to shut down in Spain,2,2014-12-11,0.0
3647,3647,Google Pulls Out Of Russia,33,2014-12-12,0.0
3648,3648,"""media lobby behind Spain’s new intellectual property law, which caused Google to announce late on Wednesday night that it was to close Google News in Spain, has now said it wants the Spanish government and European competition authorities to intervene to stop Google shutting down the service.""",19,2014-12-12,0.296
3649,3649,Google shuts Russian office following Putin's internet crackdown,8,2014-12-12,0.0
3650,3650,Surprise: Spanish Newspapers Beg Government And EU To Stop Google News Shutting Down,8,2014-12-12,-0.0258
3651,3651,Google moves engineers out of Russia,7,2014-12-13,0.0
3652,3652,"Lo que nos vamos a reír, Ley de Propiedad Intelectual y Google",1,2014-12-13,0.0
3653,3653,Spanish Newspaper Publishers Asks EU To Stop Google News Closure After Making A Law Requiring Google To Pay News Sites For Linking To Them,46,2014-12-14,-0.3818
3654,3654,Schmidt: Google Now Best Way to Evade NSA,5,2014-12-14,0.6369
3655,3655,Google News to start excluding all spanish media from service,72,2014-12-15,0.0
3656,3656,Take A Look At These Details Regarding Google Earth,1,2014-12-14,0.0
3657,3657,:O Google Take Engineers From Russia,1,2014-12-15,-0.2808
3658,3658,Publishers in Spain Ask Government to Force Google News to Return & Force Google to Pay,70,2014-12-16,-0.1027
3659,3659,"Julian Assange Unleashed: Hillary Clinton Is A Threat, Google Is A Monopoly And Should Be Broken Up, BoA Data Taken By Ex-Employee",13,2014-12-16,-0.7579
3660,3660,A New Addition To The Google SERPs,1,2014-12-15,0.0
3661,3661,Google is worth more than the entire Russian stock market,1,2014-12-17,0.2263
3662,3662,Russia's entire stock market is now worth less than google.,0,2014-12-17,0.2263
3663,3663,Google is now bigger than Mother Russia’s entire market,672,2014-12-18,0.0
3664,3664,Google is now worth more than entire Russian stock market,157,2014-12-18,0.2263
3665,3665,The entire Finnish police force fired their service weapons a combined of 6 times during last year [via Google Translate],42,2014-12-18,-0.7579
3666,3666,S. Korea's Nuclear reactor drawings hacked&leaked [Google Translate],5,2014-12-18,0.0
3667,3667,How to Rank on Google - SEO Ranking on Google Search Engine #1 Spot,1,2014-12-20,0.0
3668,3668,Google Chrome Apps For Designers,1,2014-12-20,0.0
3669,3669,What happens when you don't have access to Google Translate.,0,2014-12-20,0.0
3670,3670,Google Seizes on Sony Hacked Docs to Attack MPAA,318,2014-12-20,-0.7003
3671,3671,Cara Dan Tutorial Mendaftar Google Adsense Di Blogger,1,2014-12-21,0.0
3672,3672,Google has now ‘forgotten’ more than a quarter-million URLs agreeing to about 40 percent of the requested URL removals that it has received after EU's Court of Justice issued ruling that allowed EU citizens to have search results unlinked from their names online.,818,2014-12-23,0.7003
3673,3673,"Sony Leaked Emails: Amy Pascal Calls Adam Sandler An A**hole, Sony Tries To Take Down Google",32,2014-12-23,-0.3182
3674,3674,Why Google driverless car in News?,1,2014-12-23,0.0
3675,3675,2014 search trend by Google,2,2014-12-24,0.0
3676,3676,"""The Interview"" now available on Google Play and Youtube.",2,2014-12-24,0.34
3677,3677,Official Google Blog: “The Interview” now available on Google Play and YouTube Movies,1,2014-12-24,0.34
3678,3678,"ThePirateBay homepage now has a cartoon drawing of Kim Jong Un with the flag and a hyperlink (Google search for B40706D7FA0AAEF00274CD1A461B38DBEE317491 - hash for ""The Interview"" torrent)",1,2014-12-25,0.0
3679,3679,"Sony made 'The Interview' available on YouTube, Google Play - Cyber Kendra",1,2014-12-25,0.34
3680,3680,"""The Interview"" now available on Google Play and YouTube Movies",1,2014-12-25,0.34
3681,3681,All about Google Mobile-Friendly Label Roll Out,1,2014-12-26,0.0
3682,3682,"Sony Streams ‘The Interview’ on YouTube, Google Play and Xbox",1,2014-12-26,0.34
3683,3683,"Google Reveals Content Governments Asked Be Removed in Latest Transparency Report: ""Overall, Google received 3,105 requests from world governments between July 2013 and December 2013 to wipe 14,367 pieces of content.""",740,2014-12-27,0.0
3684,3684,Google Fiber: 1 GBPS Internet Speed Coming To India - Cyber Kendra,1,2014-12-27,0.0
3685,3685,"Not satisfied with Gmail, China seems to be blocking Google Search, too",11,2014-12-29,-0.6036
3686,3686,"A beggar must pay back $ 25,000 for welfare - Google Traduction",5,2014-12-29,-0.1027
3687,3687,"China is blocking access to Google’s popular Gmail service, according to data from Google and analysis from Dyn Research",1,2014-12-28,0.0516
3688,3688,Transformation from Google Places to Google Local,1,2014-12-30,0.0
3689,3689,"WikiLeaks claims employee’s Google mail, metadata seized by US government [Updated]",650,2014-12-31,0.0
3690,3690,Google Trends 2014 (Global),1,2015-01-01,0.0
3691,3691,"'No Google, This is Not Kim Jong-un's Sister': Hilarious Search Engine Gaffe Sparks Laughter Online",1,2015-01-02,0.5719
3692,3692,Google Android Auto Car Systems | latest world technology,1,2015-01-02,0.0
3693,3693,Google publishes Windows vulnerability despite not any fix from Microsoft,1,2015-01-02,-0.2263
3694,3694,Windows 8.1 Vulnerability Reported By Google : Microsoft Unable To Fix,1,2015-01-02,-0.2263
3695,3695,Zero-day Vulnerability in Windows 8.1 Disclosed by Google - Cyber Kendra,1,2015-01-04,-0.2263
3696,3696,Google Panda 4.1 Update: Something to Look Forward to,1,2015-01-04,0.0
3697,3697,"Google Asked to Remove 345 Million ""Pirate"" Links in 2014",3,2015-01-05,0.0
3698,3698,google AdSense,1,2015-01-04,0.0
3699,3699,Google Promotes Alex Noudelman's Cyberbullies,1,2015-01-05,0.34
3700,3700,Man wanted for child rape in US arrested on Gold Coast after boss’s Google search,9,2015-01-06,-0.8316
3701,3701,Three 16-year-old girls were able to cut germination time in half and increase dry-mass crop yields 74% by introducing nitrogen-fixing bacteria to non-leguminous crops like oats and barley. The experiment won them the 2014 Google Science Fair.,0,2015-01-06,0.8271
3702,3702,Sony Just Solved The Biggest Problem With Google Glass,1,2015-01-07,-0.1531
3703,3703,Google vs. Verizon AT&T: Wireless service could impact data caps,1,2015-01-07,0.0
3704,3704,"Google Is Donating $300,000 To Charlie Hebdo",4219,2015-01-08,0.0
3705,3705,"Google gives Charlie Hebdo $300,000 to print one million copies (their usual circulation is 30,000)",314,2015-01-08,0.0
3706,3706,Google France Displays Je Suis Charlie Poster Over Terrorist Attack Killing Charlie Hebdo,8,2015-01-08,-0.9217
3707,3707,"Muhammad cartoons pixelated - The land of freedom censored themselves - Many German media showed the controversial Muhammad cartoons of the satirical newspaper ""Charlie Hebdo"" after the attack in Paris. The American media do not dare that. (google translation)",5,2015-01-08,-0.0772
3708,3708,Charlie Hebdo: Muslim students refused to stand for a minute of silence in honor of the victims (Google Translate from French),5,2015-01-11,-0.0772
3709,3709,"What Chrome’s new Install to Homescreen feature means for apps-"" Merger of Chrome OS and Android"" - Google Groups",1,2015-01-11,0.0
3710,3710,"Reza Aslan: Anyone Who Asks Why Muslims Aren't Denouncing Attacks ""Doesn't Own Google""",0,2015-01-11,0.3412
3711,3711,Microsoft condemns Google for revealing Security hole in Windows 8,13,2015-01-12,-0.2263
3712,3712,Google will soon unveil a new system for real-time voice translation,2,2015-01-12,0.0
3713,3713,Google Under Fire For Quietly Killing Critical Android Security Updates For Nearly One Billion,40,2015-01-13,-0.7717
3714,3714,Hamas accuses Israel of being behind Paris attacks to stimulate the Jews to emigrate; immigrants will become a target of Palestinian resistance [Google Translate],20,2015-01-13,-0.5267
3715,3715,"Anti-Islamist PEGIDA Movement Expands Across Europe | Supporters of the movement have put together a Google map with the names and social media information of every known PEGIDA branch, spanning from Spain and the UK all the way east to Bulgaria.",2,2015-01-13,0.5106
3716,3716,French convictions for condoning terrorism (Google Translate),2,2015-01-14,-0.6808
3717,3717,Google leaves 60 percent of Android phones under Threats - Cyber Kendra,1,2015-01-14,-0.4215
3718,3718,Utilizing Google Inbox: This seems like the way future of email,1,2015-01-14,0.3612
3719,3719,"Max Mosley sues Google to remove pictures of him in ""sick nazi orgy.""",5,2015-01-15,-0.5106
3720,3720,Google released Android Studio 1.0,1,2015-01-15,0.0
3721,3721,Google Totally Remade Algorithm Captcha,1,2015-01-15,0.0
3722,3722,"Google ends sales of Google Glass eyewear, but continues research on the subject",5,2015-01-16,0.0
3723,3723,Google Discloses Third Zero-day Vulnerability in Windows - Cyber Kendra,1,2015-01-16,-0.2263
3724,3724,Google Stops Selling Google Glass,1,2015-01-16,-0.1531
3725,3725,Google Sees Self-Driving Car on Road Within Five Years,2,2015-01-17,0.0
3726,3726,Pakistan tops list of most porn-searching countries: Google,1,2015-01-18,0.5106
3727,3727,Google Is About To Make A Major Investment In Elon Musk's SpaceX,481,2015-01-19,0.0
3728,3728,"Google might pour money into SpaceX, really wants satellite Internet",268,2015-01-19,0.0
3729,3729,Google reportedly in satellite investment talks with SpaceX,23,2015-01-19,0.0
3730,3730,"Google, Fidelity put $1 billion in Tesla founder Musk's SpaceX",99,2015-01-20,0.0
3731,3731,Report: Google in talks to invest $1 billion in SpaceX,29,2015-01-20,0.0
3732,3732,"Musk’s SpaceX Sells 10% Stake to Google, Fidelity for $1 Billion",24,2015-01-20,0.0
3733,3733,Google Play App Store surpassed by the number of applications,1,2015-01-21,0.4019
3734,3734,Apple Marketing Chief Didn't Think Google Glass Had a Chance,0,2015-01-21,0.25
3735,3735,"Google saved an estimated 887 Million Dollars by paying Adblock+ to whitelist them from the browser extension. PageFairs blogs states ""These ads may be a small inconvenience, but blocking ads will eventually lead to websites being forced to adopt costly measures we really don’t want.""",38,2015-01-22,-0.7783
3736,3736,"WSJ: Google to Sell Wireless Service in Deals With Sprint, T-Mobile",2,2015-01-21,0.0
3737,3737,"Google Joins Apple, Others Cutting Off Crimea, Blocks AdWords, AdSense, Google Play",90,2015-01-23,0.0
3738,3738,How the CIA made Google,6,2015-01-23,0.0
3739,3739,Google Mobile Office was supported fingerprint Touch ID,1,2015-01-22,0.3182
3740,3740,Google wants to become a mobile operator,1,2015-01-23,0.0
3741,3741,WikiLeaks demands answers after Google hands staff emails to US government,4929,2015-01-25,0.0
3742,3742,Google Now Introducing in Image Recognition Technology - Future Technology,1,2015-01-25,0.0
3743,3743,WikiLeaks threatens legal action against Google and US after email revelations,68,2015-01-26,-0.2732
3744,3744,Unseen Video of Forrest Hayes' Death 'High-End Escort Inject Father-of-five Google Exec With Lethal Heroin Overdose',47,2015-01-26,-0.7964
3745,3745,Google Blocks Payments And Services Within Crimea Due To U.S. And EU Imposed Sanctions,4,2015-01-26,-0.296
3746,3746,France wants to make Google and Facebook accountable for hate speech,356,2015-01-27,-0.5719
3747,3747,Russian lawyer sues Google for reading his emails,4,2015-01-27,0.0
3748,3748,"Google, Yahoo banned from showing sex determination ads in India.",4,2015-01-28,-0.0772
3749,3749,"France shows its commitment to free speech by pushing to call Twitter, Facebook, and Google terrorism ""accomplices""",3,2015-01-28,0.0772
3750,3750,Mexico says may sanction Google over data protection breach.,1,2015-01-28,0.0
3751,3751,"After winning a million-dollar prize from Google this week, a team of Indian engineers are now a step closer to their goal of becoming the world’s first private-sector group to land on the moon",1378,2015-01-29,0.7717
3752,3752,Gag order prevented Google from disclosing WikiLeaks probe for 3 years: Search giant says its policy always contests secrecy orders tacked to data requests,4,2015-01-29,-0.3182
3753,3753,Google Offering 24 Hours Of Inbox Invites for All - Cyber Kendra,1,2015-01-29,0.0
3754,3754,the google search that took down Ross Ulbricht (silk road),2,2015-01-30,0.0
3755,3755,Google feels Facebook competition in the advertising business,1,2015-01-30,0.0
3756,3756,Google Settles With UK’s Information Commissioner And Will Change Its Privacy Policy,1,2015-01-30,0.0
3757,3757,Google has opened free access to Google Earth Pro,1,2015-01-31,0.5106
3758,3758,How Do I Traffic From Google Plus To My Blogs,1,2015-01-31,0.0
3759,3759,ZAPRASZAM WSZYSTKICH I POLECAM WPISY OGÓLNE MORALNE I ZDROWE I DOBRE I BIEŻĄCE I WSZYSTKIE WPISY I INFORMACJE MOJE NA FACEBOOKU I GOOGLE + I GMAILU I TWITTERZE O ILE TWITTER MAM NA RAZIE ZABLOKOWANY TOMASZ FRANCISZEK OLESZKIEWICZ,0,2015-01-31,0.0
3760,3760,"Google changes UK privacy policy, but avoids hefty fine",1,2015-01-31,0.0387
3761,3761,Big Change In Google Privacy Policy,1,2015-02-01,0.0
3762,3762,SpaceX and Google form joint partnership to bring Internet access to the world,469,2015-02-02,0.0
3763,3763,"Google, Microsoft, and Amazon are paying to get around AdBlock",153,2015-02-02,0.1779
3764,3764,Google is making human skin as part of research into 'wristband that can detect cancer',5,2015-02-03,-0.6597
3765,3765,Google is making human skin as part of research into 'wristband that can detect cancer',1,2015-02-03,-0.6597
3766,3766,What is “Google web designer”?,1,2015-02-03,0.0
3767,3767,Earn From Google,1,2015-02-04,0.0
3768,3768,Twitter Strikes Search Deal With Google to Surface Tweets,4,2015-02-05,-0.3612
3769,3769,The Japanese government plans to enforce a workaholic paid leave. [Needs Google translate],2,2015-02-04,-0.0516
3770,3770,wants to see your Tweets in Google search results?,1,2015-02-05,0.0
3771,3771,"Google is key to our getting more personalized, trustworthy news – Quartz",0,2015-02-06,0.5965
3772,3772,Google Advisory Council: Right To Be Forgotten Should Not Go Beyond Europe,2,2015-02-07,-0.2263
3773,3773,Twitter and Google joining forces matters in the social media landscape,1,2015-02-07,0.0258
3774,3774,Google hires Arabic speakers to prevent ISIS from using YouTube for their propaganda.,1,2015-02-08,-0.2263
3775,3775,Larry Page Interview Where’s Google going next? VIDEO,2,2015-02-09,0.0
3776,3776,Google Has to Remove Autocomplete for Users Seeking to Join Islamic State in Spain and UK,2,2015-02-09,0.296
3777,3777,Cohort Analysis Beta Testing with Google Analytics,1,2015-02-09,0.0
3778,3778,Norwegian government moves to finally remove blasphemy law (Google translate),12,2015-02-10,0.0
3779,3779,Google Is A Reliable Doctor,1,2015-02-10,0.0
3780,3780,Eight Google Chrome extensions to boost your privacy and productivity,0,2015-02-10,0.4019
