,Unnamed: 0,title,score,created,Sentiment
1998,1998,Google lights up a candle to honour the Delhi braveheart,1,2012-12-31,0.5719
1999,1999,Two arrests after acid attack | Die Welt (Google Translate),1,2012-12-30,-0.872
2000,2000,APNewsBreak: Google exec chairman to visit NKorea,3,2013-01-02,0.0
2001,2001,Google Chairman Eric Schmidt to visit North Korea,1,2013-01-02,0.0
2002,2002,"Requirements to Become a Google employee, must Mastering Microsoft Excel ~ MataTelingaKu.BlogSpot.Com",1,2013-01-02,0.4588
2003,2003,Google boss Eric Schmidt plans to visit North Korea,21,2013-01-03,0.0
2004,2004,"The State Department said on Thursday the time was not right for Google Inc Executive Chairman Eric Schmidt and former diplomat Bill Richardson to visit North Korea, which drew international criticism for a rocket launch last month.",5,2013-01-03,-0.4404
2005,2005,Google Exec Chairman to Visit North Korea,4,2013-01-03,0.0
2006,2006,"
Google concedes defeat in China censorship battle. 

US company quietly drops warning message that Chinese users saw when searching for politically sensitive phrases
",124,2013-01-04,-0.7906
2007,2007,What does Google want with North Korea? ,11,2013-01-04,0.0772
2008,2008,Why is Google chief Eric Schmidt visiting North Korea? Probably to make contact with the country's surprisingly robust tech scene.,2,2013-01-04,0.5574
2009,2009,Report: Google Executive to Visit North Korea,1,2013-01-05,0.0
2010,2010,Better Google Rankings,1,2013-01-05,0.4404
2011,2011,Is a missing fashion guy really a top Google news story this morning? Does anyone care?,1,2013-01-05,0.5351
2012,2012,Google URL Shortener ,1,2013-01-06,0.0
2013,2013,"Google chief Eric Schmidt begins mysterious North Korea visit, amid criticism from the White House",311,2013-01-07,-0.4404
2014,2014,Google Executive Chairman Arrives in North Korea - YouTube,4,2013-01-07,0.0
2015,2015,UN and Google beginning 'Humanitarian Mission' to North Korean,2,2013-01-06,0.0
2016,2016,Students at North Korea's premier university have showed Google's executive chairman how they look for information online: they Google it.,230,2013-01-08,0.0
2017,2017,France orders internet providers to stop blocking Google ads,7,2013-01-07,-0.5859
2018,2018,"France to debate charging Google, other content providers for traffic — RT",4,2013-01-08,0.0
2019,2019,"Facebook and Google may be forced to ask permission to use personal data: Users must be able to consciously agree to data processing – or reject it, says EU proposal for tougher consumer protection",165,2013-01-09,-0.3612
2020,2020,What Did Google Earth Spot in the Chinese Desert? Even an Ex-CIA Analyst Isn’t Sure.,1,2013-01-09,0.3182
2021,2021,Ex-CIA Analyst Finds Mysterious Chinese Complex on Google Earth,2042,2013-01-10,0.0
2022,2022,What Did Google Earth Spot in the Chinese Desert? Even an Ex-CIA Analyst Isn’t Sure.,3,2013-01-10,0.3182
2023,2023,Google executive chairman travels to North Korea to urge them to open web access. ,2,2013-01-10,0.0
2024,2024,“Mysterious Chinese Complex on Google Earth” turned out to be a giant archaeological site of Khan Noida ancient city ruins,167,2013-01-11,-0.4404
2025,2025,New EU law would make it illegal for sites like Google and Reddit from freely quoting German news articles unless they choose to pay royalty fees for each use,24,2013-01-11,0.1027
2026,2026,10 Google Analytics Strategies to Profit From it!,1,2013-01-11,0.4926
2027,2027,North Korea Treats Google Chairman Eric Schmidt Like a Rock Star,3,2013-01-12,0.3612
2028,2028,Did Google run over a donkey in Botswana? ,0,2013-01-15,0.0
2029,2029,Google Maps deny killing donkeys ,0,2013-01-15,-0.7783
2030,2030,"Google ordered to identify bloggers for ""defamation.""",6,2013-01-15,0.0
2031,2031,3D Street View Land of Google Maps,1,2013-01-16,0.0
2032,2032,Facebook Graph Search: Zuckerberg reveals origin of Google privacy rift,1,2013-01-16,0.0
2033,2033,Google to build £1bn UK headquarters at London's King's Cross,380,2013-01-17,0.0
2034,2034,Google clarifies over Botswana's donkey 'killing',5,2013-01-17,0.2263
2035,2035,French Telecom Co. Orange forces Google to pay them because people use Google websites on Orange phones...,3,2013-01-17,-0.1027
2036,2036,Sophie Schmidt's (Ex-Google CEO Eric Schmidt's daughter) photo and text impressions of their recent visit to North Korea.,144,2013-01-19,0.2263
2037,2037,Google Denies Killing Donkey With Maps Car,7,2013-01-20,-0.802
2038,2038,Улучшить Ваш SEO с Webmaster tools Google,1,2013-01-19,0.0
2039,2039,"Facebook doing 'really bad job,' Google CEO says",1,2013-01-20,-0.5849
2040,2040,Google Earth puts North Korea labour camps on the map - RTÉ News,2955,2013-01-21,0.0
2041,2041,Google restricted Turkish users from accessing 63% of the YouTube videos.,7,2013-01-21,-0.3818
2042,2042,Google captures snapshot of city's recovery from earthquake,5,2013-01-21,0.0
2043,2043,9 reasons Why you can’t trick Google,1,2013-01-22,-0.0516
2044,2044,"Google, Facebook, Amazon may be subject to French taxes",1,2013-01-22,0.1779
2045,2045,The First 2013 Google Panda update is here,11,2013-01-23,0.0
2046,2046,North Korean labor camps spotted via Google Earth,3,2013-01-22,0.0
2047,2047,"Google Earth Is Key To Revealing North Korea's Prison Camp System, Activists Say",2,2013-01-23,-0.5106
2048,2048,"Google says government requests for personal user data rose again in the second half of 2012, up more than 70 percent since 2009.",3,2013-01-23,0.0
2049,2049,Google Panda Update #24 – Released,1,2013-01-24,0.0
2050,2050,Steady rise in Government data requests: Google,1,2013-01-23,0.0
2051,2051,Google Earth exposes North Korean prison camps.,2,2013-01-25,-0.5859
2052,2052,"Google Finds 86,000 Unprotected Printers In the Internet",1,2013-01-25,-0.3612
2053,2053,"""What happens when you mix 11 budding startups with Google executives, Stanford professors, a Nobel Peace Laureate and 600 college students and put them on a ship to circumnavigate the world?""",0,2013-01-25,0.5423
2054,2054,A complete guide to attracting new clients and growing your law practice through SEO and Social Media marketing. Your law firm on the first page of Google. ,1,2013-01-26,0.5859
2055,2055,Google faces legal action over alleged secret iPhone tracking: 10 million UK iPhone users could have grounds to sue Google after it sidestepped Apple security settings to monitor web habits,160,2013-01-27,0.4404
2056,2056,facebook y google,1,2013-01-27,0.0
2057,2057,Anonymous threatens revenge over death of Aaron Swartz [google translate],1,2013-01-27,-0.872
2058,2058,Jasa SEO Google,1,2013-01-28,0.0
2059,2059,10m UK Apple Users Could Claim Against Google for Secret Snooping,1,2013-01-28,0.0
2060,2060,Google unveils detailed map of North Korea,2942,2013-01-28,0.0
2061,2061,"Google adds detail to North Korea map: New map of secretive state includes positions of roads, parks, monuments to Kim dynasty and labour camp",5,2013-01-29,0.0
2062,2062,BBC News - Google expands North Korea map coverage,2,2013-01-29,0.1027
2063,2063,"Google unveils detailed North Korea map, with gulags",2,2013-01-29,0.0
2064,2064,"FISAAA grants US sweeping powers to collect data of non-americans with US Cloud providers like Google for purely political purposes, no matter where the cloud is based. This will happen in total secrecy.",2,2013-01-30,0.2585
2065,2065,Google puts North Korea on the map,1,2013-01-30,0.0
2066,2066,Google Expected to Change Entire Password Strategy,1,2013-01-31,0.0
2067,2067,"22. July Oslo killer, Anders Behring Breivik wants to charge the prison he's held at with ""torture"" due to lack of outdoors time and being searched while in jail. Reported both jail and minister of justice to the police. (Unfortunately bad Google Translate).",1,2013-01-31,-0.875
2068,2068,"google play & IOS white label program| event guid app| golocalapps
",1,2013-01-31,0.34
2069,2069,Google moves closer to resolving EU antitrust investigation,1,2013-02-01,0.3818
2070,2070,Mali: airstrikes took place north of Kidal - Le - Monde (via Google Translate),1,2013-02-01,0.0
2071,2071,Money in Google Adsense,1,2013-01-31,0.0
2072,2072,"Google Caves in French Newspaper Fight - The search giant has been  fighting with the  French press about revenue it makes by posting adverts alongside links to their articles. France threatened to tax that revenue, & Google replied that it might stop indexing the stories altogether.",5,2013-02-02,-0.8519
2073,2073,North Korean Prison Camps Revealed On Google Maps,1,2013-02-02,-0.5106
2074,2074,15 Google Chrome Extensions for Web Designers and Developers,1,2013-02-02,0.0
2075,2075,"Germany is the most forward-looking country,  show Google Trends data",0,2013-02-03,0.0
2076,2076,Google Doodle pays hommage to the Canadian penny. It is the last day that the penny will be in use,193,2013-02-04,0.0
2077,2077,Google boss Schmidt labels China an 'IT menace',75,2013-02-04,-0.4939
2078,2078,"Google searches expose racial bias, says study of names",22,2013-02-04,-0.25
2079,2079,Google Pays For Peace In Europe,1,2013-02-05,0.5423
2080,2080,After people of Croatia raise 600K dollars for treatment of little girl Nora and only a day before going to America. The Children Hospital of Philadelphia raise the price to 800K dollars. - Google Translate.,2871,2013-02-06,0.0
2081,2081,Google buys online retail tracker for $125 M,1,2013-02-06,0.0
2082,2082,First Google Page Rank Update of 2013,1,2013-02-05,0.0
2083,2083,Google Chromebook Pixel Revealed In Leaked Video,1,2013-02-07,-0.3182
2084,2084,Hire PPC Experts for Google Adwords,1,2013-02-07,0.0
2085,2085,"Germany knocks Britain off top spot to become world's most forward-thinking country in Google searches (and Pakistan finishes last)
",1,2013-02-08,0.2023
2086,2086,Guarantee Google Page 1 Rank within weeks,1,2013-02-08,0.25
2087,2087,Google e Yahoo si alleano nella pubblicità online Adsense | Pubblicità Marketing Web,1,2013-02-09,0.0
2088,2088,Google Integrates Third-Party Web Apps More Deeply Into Google Drive,1,2013-02-09,0.0
2089,2089,Google Chairman to Sell $2.5 Billion in Stock,1,2013-02-08,0.0
2090,2090,Analysis of 45 billion Google searches finds Germany most forward-looking | News,26,2013-02-10,0.0
2091,2091,"Google Chrome Is Blocking a Bunch of Major Sites for Malware, Even YouTube",1,2013-02-09,-0.3818
2092,2092,"Discover How to Obtain Clients With FB, Google+ & by means of E-mail Marketing",1,2013-02-10,0.0
2093,2093,Myanmar government denies hacking journalist email accounts after Google warnings,9,2013-02-11,-0.6124
2094,2094,"Raytheon is building a ""Google for spies"" that can track your social media behavior",2,2013-02-11,0.0
2095,2095,"Raytheon's Riot program mines social network data like a 'Google for spies', drawing ire from civil rights groups",1,2013-02-10,-0.2732
2096,2096,Google Maps reveals identity of North Korean test facilty,355,2013-02-12,0.0
2097,2097,"Chris Dorner's Standoff Cabin, google maps",5,2013-02-12,0.0
2098,2098,"Google SEO Service
",2,2013-02-12,0.0
2099,2099,Massive Google security flaw puts users' details on display for all to find,11,2013-02-13,0.34
2100,2100,Chernobyl sarcophagus is beginning to collapse (Google Translate Russian to English) ,1,2013-02-13,-0.4939
2101,2101,U.S. companies: Amazon estimated to be more trustworthy than Apple and Google,1,2013-02-13,0.6801
2102,2102,President Obama: Live Fireside Hangout via Google+,1,2013-02-14,0.0
2103,2103,"René Jiménez - Google+
",1,2013-02-14,0.0
2104,2104,Follow-up: bride kidnapped from mental clinic in Moscow shows up in local police department (google translate),1,2013-02-14,0.0
2105,2105,Have You Been Hit By The Latest Google Update?,2,2013-02-15,0.0
2106,2106,Has google pulled its doodle because of the events in Russia?,1,2013-02-15,0.0
2107,2107,Asteroid 2012 DA14 Google Doodle Removed After Russian Meteor Shower Injuries,1,2013-02-15,0.0
2108,2108,A Google retail store? Why it's not as crazy as it sounds,1,2013-02-16,0.2584
2109,2109,Google mapped Chelyabinsk?! Meteors much or just a coincidence?!!,1,2013-02-15,0.0
2110,2110,"Google asks journalists to tone down story of ""massive"" Google Play security flaw",25,2013-02-17,0.5859
2111,2111,Google may go retail by end of the year,0,2013-02-16,0.0
2112,2112,"EU agencies to sanction Google over privacy violations.  European data protection agencies to ""coordinate their coercive actions which should be implemented before the summer.""",7,2013-02-18,-0.5267
2113,2113,How Google Plus Can Help The Real Estate Industry,1,2013-02-18,0.4019
2114,2114,"Google Store, coming soon in the end of 2013",1,2013-02-18,0.0
2115,2115,"
You have the right to Google for a lawyer in Canada: 'After a 19-yr old struggled to find a lawyer using the telephone, an Alberta court has ruled that police must provide an accused with Internet access to exercise their right to counsel.'
",3356,2013-02-19,-0.5574
2116,2116,Google looks to cut funds to  illegal download websites ,6,2013-02-19,-0.6908
2117,2117,Europe to move against Google over privacy rules,3,2013-02-18,0.0
2118,2118,European Regulators to Crack Down on Google over Privacy Policy,3,2013-02-20,0.0
2119,2119,Win Google Nexus 7 tablet with SwiftKey App,1,2013-02-20,0.5859
2120,2120,"Google has released a Video about   ""Google Glass"" | RtoZ.org",1,2013-02-20,0.0
2121,2121,"Facebook, Google co-founders join forces to extend human life",1,2013-02-21,0.4404
2122,2122,"Raytheon's ""Google for spies"" may not be legal",1,2013-02-21,-0.0951
2123,2123,Google SEO Service,1,2013-02-21,0.0
2124,2124,"Startup by former Google employees, RedBus.in Continues To Dominate online bus booking In India, But That’s Not What Makes Them Special",3,2013-02-22,0.296
2125,2125,Google to sell Internet glasses to contest winners,2,2013-02-21,0.4767
2126,2126,"Google Launches $1,299 Chromebook Pixel, a Touch Screen Laptop against Apple Macbook",1,2013-02-22,0.0
2127,2127,Google expansion is latest employee perk designed to spark innovation,1,2013-02-23,0.5423
2128,2128,"Google adword, nuove funzionalità avanzate | Pubblicità Marketing Web",1,2013-02-23,0.0
2129,2129,Google SEO Service,1,2013-02-23,0.0
2130,2130,"""If you're looking for the best death camp, look no further!"" - Bukchang Gulag, NK Google Plus Review.",1,2013-02-23,-0.2942
2131,2131,Issue 51754 - android - oscar 2013 live stream online free coverage - Android - An Open Handset Alliance Project - Google Project Hosting,1,2013-02-24,0.5106
2132,2132,German anti-Google bill sets unwelcome precedent.,1,2013-02-25,-0.4019
2133,2133,Make Money With Google AdSense,1,2013-02-25,0.0
2134,2134,3 Tips To Increase The Google Ranking,1,2013-02-25,0.3182
2135,2135,"The first smartphone-powered nanosatellite has entered orbit, and it runs on a Google Nexus One. Six other satellites went up in the same rocket.",1,2013-02-25,0.0
2136,2136,"The first smartphone-powered nanosatellite has entered orbit, and it runs on an Google Nexus One. Six other satellites went up in the same rocket.",1,2013-02-25,0.0
2137,2137,Make Money With Google AdSense,1,2013-02-26,0.0
2138,2138,"Google not expected to check every upload, says Italian court",31,2013-02-27,0.0
2139,2139,Join Google Mapathon 2013 Event in India,1,2013-02-27,0.296
2140,2140,Google responds to Yahoo's ban on working from home with a new policy of it's own.....,1,2013-02-27,-0.5574
2141,2141,Google eliminates 'die' search suggestion for autism,3,2013-02-28,0.0
2142,2142,Big Brother and Google technologies,1,2013-02-27,0.0
2143,2143,Google boss Sergey Brin: using a smartphone is 'emasculating',1,2013-02-28,0.0
2144,2144,"1st SOPA, Now Your Privacy: Facebook, Google Flex Lobbying Muscle in Europe - 
The Goliaths of the tech industry already destroyed SOPA--now they're attempting to take down privacy laws in Europe. 




  ",8,2013-03-01,-0.5423
2145,2145,"Google is fighting an EU court case that could lead to one of the greatest changes to EU privacy rules in decades, by either strengthening the rules or negating them altogether.
",4,2013-03-01,0.7096
2146,2146,Google loses again; will pay up in Germany,2,2013-03-01,-0.4019
2147,2147,Google Glasses is Not Good For Eyes,1,2013-03-02,-0.3412
2148,2148,Seo pressor review  - what you need to know to rank first in google,1,2013-03-03,0.0
2149,2149,Miriam Makeba’s 81st birthday celebrated by Google Doodle,1,2013-03-03,0.5719
2150,2150,"I love that Google is celebrating Miriam Makeba, and most people don't even know who she is... ",1,2013-03-04,0.836
2151,2151,Magic submitter review - what you need to know about first place in google.,1,2013-03-04,0.0
2152,2152,Senuke Inferno Reviews  - what you need to know about ranking first in google,1,2013-03-04,0.0
2153,2153,Campaigners demand Google stop whale and ivory ads on Google Japan,265,2013-03-05,-0.4019
2154,2154,"Google fuels ivory trade in Asia, environmental group says ",8,2013-03-05,0.0
2155,2155,Group says Google shopping ads fuel ivory trade,5,2013-03-05,0.0
2156,2156,Google begins to document post-tsunami Fukushima,5,2013-03-06,0.0
2157,2157,"Google+ Rolls Out Major New Visual Updates
",1,2013-03-06,0.0
2158,2158,Google Play Offers A Week of Special Deals and Discounts to Celebrate Its First Birthday,1,2013-03-06,0.8316
2159,2159,"European Union fines Microsoft for $732 million, Google may be to blame",1,2013-03-06,-0.34
2160,2160,"FBI 'secretly spying' on Google users, company reveals",1,2013-03-07,0.0
2161,2161,Top 15 Most Popular topics searched on Internet-Google,1,2013-03-07,0.5984
2162,2162,Helped Google with some pre-emptive Changes to their Map of southeast Asia,1,2013-03-08,0.0
2163,2163,Top 10 Reasons Why Google Glass Will Fail (Project Glass),0,2013-03-07,-0.4019
2164,2164,Google shows an Interactive animated Doodle for 61st Birthday of Douglas Adams,6,2013-03-11,0.0
2165,2165,Google Chief to Visit Burma,6,2013-03-11,0.0
2166,2166,Google marks Douglas Adams' 61st birthday with Doodle,1,2013-03-11,0.0
2167,2167,Bar already banning Google Glasses over privacy concerns (prior to actual release),1,2013-03-12,0.0
2168,2168,Google has agreed to pay a $7m (£4.6m) fine for collecting people's personal data without authorisation as part of its Street View service.,1,2013-03-12,0.3612
2169,2169,Seattle dive bar becomes first to ban Google Glass,0,2013-03-12,-0.5574
2170,2170,Google Concedes That Drive-by Prying Violated Privacy,5,2013-03-13,-0.5267
2171,2171,"Google keyword advertising is waste of money, says eBay report ",2,2013-03-13,-0.4215
2172,2172,Google paying bonuses totalling &#36;15 million to 4 top executives,1,2013-03-13,0.6597
2173,2173,"Google Reader’s demise is awful for Iranians, who use it to avoid government censorship",143,2013-03-14,-0.6369
2174,2174,"Google Reader’s demise is awful for Iranians, who use it to avoid censorship",7,2013-03-14,-0.6369
2175,2175,Google Reader to be shut down on July 1,1,2013-03-14,0.0
2176,2176,"If Google were a hacker, it'd be going to prison",0,2013-03-15,-0.5106
2177,2177,"Google Inc Executive Chairman Eric Schmidt, who visited North Korea in January, will become the first high-profile tech company executive to visit Myanmar in the wake of reforms that prompted Western nations to ease sanctions following decades of military dictatorship.",26,2013-03-16,0.3612
2178,2178,Google celebrates St.Patrick’s Day with an Animated Doodle,1,2013-03-16,0.5719
2179,2179,Google will Help for Hacked Sites from Now,1,2013-03-17,0.0
2180,2180,Latest technology news: Google to scrap the Technology News & All Gadgets Reviews | Smartphones & Iphone Apps feed finder,1,2013-03-18,0.0
2181,2181,"Holi Funny Images, Pictures, Photos Orkut, Facebook, Google",1,2013-03-18,0.4404
2182,2182,Russian watchdog slams Google over suicide videos,2,2013-03-18,-0.6705
2183,2183,Google announcement: GIF searching is here.,1,2013-03-19,0.0
2184,2184,"Intel prepares for TV debut; to compete with Apple, Google, Amazon",1,2013-03-19,0.1779
2185,2185,google adds animated gif search,1,2013-03-19,0.0
2186,2186,"Narendra Modi to address Google summit, only Chief Minister invited",0,2013-03-19,0.0
2187,2187,Google reader is going away?!!,1,2013-03-21,0.0
2188,2188,Increase your Google Positions with Fast Website Hosting Plans,1,2013-03-21,0.3182
2189,2189,Apple takes A juicy bite out of Google? THAT'S WHAT I'M TALKING ABOUT!,1,2013-03-21,0.0
2190,2190," Google Adsense Training
",1,2013-03-22,0.0
2191,2191,670 pound polar bear shot dead on Norwegian island of Svalvard by cottage dwellers as it was halfway through breaking into the cottage (google  translated from Norwegian),6,2013-03-24,-0.6808
2192,2192,SEOPressor 5 What you need to know to reach and maintain the number one spot in Google!,453,2013-03-24,0.1759
2193,2193,Google Launches TV White Spaces Trial In South Africa,3,2013-03-25,0.0
2194,2194,LG reportedly working on a product similar to Google Glass,1,2013-03-25,0.0
2195,2195,"Google forces new word - ""ogooglebar"" - out of the Swedish language - Pressures Language Council",164,2013-03-26,-0.3182
2196,2196,Sweden axes new word after Google intervenes,28,2013-03-26,0.0
2197,2197,Google Discovers Students in Vietnam Could Pass Its Interview Process,7,2013-03-25,0.0
2198,2198,"Google Street View sends cameras into Namie, an abandoned town in Fukushima where once 21,000 people lived",35,2013-03-27,-0.4588
2199,2199,Google shot itself in the foot: Swedish Academy,16,2013-03-27,0.0
2200,2200,Google street view of ghost town left by Fukushima,8,2013-03-27,-0.3182
2201,2201,Google reveals views of Japan nuclear ghost town,6,2013-03-28,-0.3182
2202,2202,Fukushima town revealed in Google Street View two years after tsunami,6,2013-03-28,0.0
2203,2203,Google Street View Captures Ghost Town in Fukushima’s Evacuation Zone,6,2013-03-28,-0.3182
2204,2204,"From the Stone Age to the Digital Age in One Big Leap -  Deep in the Amazon, an isolated Brazilian tribe almost vanished when it 1st had contact with the modern world. Now the Surui is working with Google to do things like report on illegal logging in the forest.",490,2013-03-29,-0.4019
2205,2205,Post-earthquake Fukushima added to Google Street View,11,2013-03-29,0.0
2206,2206,"Google Releases Street View Images From Fukushima Ghost Town: ""Street View images show a city frozen in time""",3,2013-03-29,-0.3182
2207,2207,"Google Street View images of the unfortunate town of Namie-machi, Japan, which was devastated by the March 2011 Tōhoku earthquake and the tsunami it caused, then rendered uninhabitable by the Fukushima Daichi nuclear meltdown.",18,2013-03-30,-0.7906
2208,2208,Cesar Chavez Google doodle on Easter Sunday outrages Christian conservatives online,165,2013-03-31,-0.5106
2209,2209,Google celebrates Easter by honoring Cesar Chávez.,22,2013-03-31,0.7906
2210,2210,Google Treasure Maps,1,2013-03-31,0.296
2211,2211,Russia Begins Selective Web Censorship - Google Fights Back,22,2013-04-01,-0.4019
2212,2212,Introducing... Google Nose,1,2013-03-31,0.0
2213,2213,Google Updates und das Text Spinning,1,2013-04-01,0.0
2214,2214,Google facing legal threat from six European countries over privacy,5,2013-04-02,-0.4404
2215,2215,Google doodles naturalist Maria Sibylla Merian's 366th birthday,1,2013-04-02,0.0
2216,2216,Baidu Reportedly Working on Google Glass-Like ‘Baidu Eye’,1,2013-04-02,0.0
2217,2217,Google faces EU action over privacy policy,5,2013-04-03,0.0
2218,2218,"EU countries take steps against Google and its privacy policy: Six European countries decided today to take steps against Internet giant Google, in an effort to force it to comply with European Union privacy rules, said France’s Cnil data protection agency.",2,2013-04-02,0.0
2219,2219,"Baidu Eye Is China's Answer to Google Glass, Company Confirms",1,2013-04-03,0.0
2220,2220,USE OF GOOGLE MASTER TOOLS,1,2013-04-04,0.0
2221,2221,China's Baidu developing digital eyewear similar to Google Glass,1,2013-04-03,0.0
2222,2222,"@bluereadysearch Google Forks WebKit And Launches Blink, A New Rendering Engine That Will ... - TechCrunch",1,2013-04-04,0.0
2223,2223,Indian Police investigating Google “Mapathon” - National mapping agency raises security concerns - we don't want Google to map localities and have entire data stored in USA!,3,2013-04-05,0.3549
2224,2224,(40) pengusir tikus elektrik - Google+,1,2013-04-05,0.0
2225,2225,konsultan seo - Google+,1,2013-04-04,0.0
2226,2226,Options Trader Posts Insider Info Google Earnings Play- Reuters,1,2013-04-06,0.34
2227,2227,Stock Option Trader Insider Info Google Earnings Play -Forbes,1,2013-04-07,0.34
2228,2228,Mayer Flaks - Google+,1,2013-04-08,0.0
2229,2229,"The Scandinavian Star ferry fire that killed 159 people was arson, say investigators. (Google Translation)",1,2013-04-08,-0.7845
2230,2230,Option Trader Insider Info Google Earnings Play -Reuters,1,2013-04-08,0.34
2231,2231,Google Launches the Global Human Trafficking Hotline Network,1,2013-04-09,0.0
2232,2232,Google Street View in the house.,1,2013-04-09,0.0
2233,2233,"Check your spam bin for today's CLG Newsletter, as NSA buddy Google relegated it to the spam bin",1,2013-04-09,-0.6124
2234,2234,"Google launches global human trafficking helpline & data network - Commits $3M (£2M) to build an international helpline network fueled by data. Human trafficking enslaves 21M people, with 2.5M forced into labor. Most are ages 18-24 & 43% are forced into the sex trade.",1394,2013-04-10,-0.8176
2235,2235,Iran plans 'Islamic Google Earth' launch,21,2013-04-10,0.0
2236,2236,"Russian parliament moves ahead with an anti-blasphemy law. Insulting ""religious feelings of believers"" punishable by up to 3 years imprisonment. Desecration of places of worship by up to 5. [google translated article]",19,2013-04-09,-0.5994
2237,2237,"Iran’s New Fake Inventions: Time Machine, ‘Islamic Google Earth’",5,2013-04-11,-0.4767
2238,2238,"Apple, Google Not Interested in Settlement, Judge Says - accuses Samsung, Apple of using the courts 'as a business strategy'",4,2013-04-11,-0.5659
