,title,score,created
0,Microsoft Office 2007 Service Pack 2 on Torrent Network | Tempting Magazine,0,2010-01-02
1,Italy class-action suit planned against Microsoft seeking compensation for Windows software pre-installed on computers for people who did not want it.,28,2010-01-05
2,"Microsoft Hardware - Microsoft Mouse and Microsoft Keyboard
",0,2010-01-06
3,"Google Wants To Stop Censoring In China: Yahoo, Microsoft Please Follow Suit",1,2010-01-13
4,"HP, Microsoft Team Up to Tackle the Cloud",1,2010-01-14
5,Use Voice Command In Microsoft Office Programs | Technology Blog | Blackberry | Smartphones | Laptop | Digital Camera | SEO,1,2010-01-14
6,Microsoft admits Explorer used in Google China hack,1,2010-01-15
7,Microsoft admits Explorer used in Google China hack,0,2010-01-15
8,France joins Germany warning against Microsoft Explorer: Find an alternative to protect security,0,2010-01-18
9,"""Cyber World War"" Threat from China: Yahoo has expressed support with Google. If Microsoft also joins the alliance with Google, it would be like the alliance of US, UK and Russia against the Hitler’s regime",0,2010-01-18
10,"
SYSPRO joins Microsoft Technology Adoption Program",1,2010-01-19
11,How much money has been donated to the Haiti relief effort?,2,2010-01-22
12,"Expert finds vulnerabilities in Microsoft browser, well, whatdoyaknow! ",2,2010-01-23
13,Microsoft Founder Bill Gates doesn't think Ugandan anti-gay bill is not that big a deal,1,2010-01-25
14,Nigeria and Microsoft use celebrity power to fight 419 scams,1,2010-02-04
15,Latest Mobiles Information » Blog Archive » Microsoft Unveils Windows Phone 7 Series With Xbox Live and Zune Integration,1,2010-02-16
16,Microsoft launches Windows Phone 7 Series for mobiles ,0,2010-02-16
17,"Microsoft, Yahoo search and advertising deal gets approved in U.S. and E.U. | GeekyHeart",1,2010-02-21
18,Is Microsoft Behind Google's Italy Woes?,1,2010-03-03
19,A country in Europe is Trusting Microsoft for personal Data?!,0,2010-03-03
20,Microsoft exec pitches Internet usage tax to pay for cybersecurity programs,2,2010-03-03
21,Microsoft to stay its China course despite Google spat,0,2010-03-05
22,Microsoft launches Web-based OS in India ,1,2010-03-09
23,"Mexican tycoon Carlos Slim is the new richest person in the world, knocking Microsoft founder Bill Gates into second spot, Forbes said. It is only the second time since 1995 that Gates has lost the crown, said the magazine.",1,2010-03-11
24,Impact of Microsoft Technologies on web Applications,1,2010-03-13
25,Microsoft has released the latest allegations,1,2010-03-15
26,Microsoft lanza una campaña contra Google y Openoffice en YouTube - Noticias dyweb.com.ar,0,2010-03-15
27,Web Based Microsoft Office 2010 Soon To Be Launched!!,0,2010-03-15
28,"Microsoft Launched IE 9's Demo version and it will support HTML 5 and CSS 3 , Finally designers will breath peacefully ",1,2010-03-17
29,Microsoft Outlook Productivity Book,1,2010-03-19
30,"More Good News Today! Australia's Internet Filter Slammed by Microsoft, Yahoo, Google, Others in Gov't Report (new!)",681,2010-03-23
31,Toshiba is in talks with a company backed by Microsoft Chairman Bill Gates to jointly develop advanced nuclear reactors,0,2010-03-23
32,Microsoft + Open Source = ? . Redmond Giant to Embrace open source,1,2010-04-01
33,"The ""father of the personal computer"" who kick-
started the careers of Microsoft founders Bill Gates 
and Paul Allen has died at the age of 68.",3,2010-04-02
34,Microsoft e la telefonia: ecco il ‘Progetto Pink’.,1,2010-04-07
35,"Microsoft allegedly outsourcing child labor in China: ""We are like prisoners... We do not have a life, only work.""",97,2010-04-13
36,Google adds a touch of Microsoft to applications,1,2010-04-13
37,The only story about China on Reddit's front page has something to do with Microsoft factories.  You'd think this hadn't even happened. ,0,2010-04-14
38,Microsoft Mouse-Maker Accused Of Running Sweatshop In China - News Story,1,2010-04-15
39,"'We are like prisoners. It seems like we live only to work'--An overseas company that conducts business with Microsoft is accused of hiring underpaid teenagers to work in grueling conditions, often for 12 hours at a time, to make computer-related products in their factory in China.",0,2010-04-14
40,"The image Microsoft doesn't want you to see: Too tired to stay awake, the Chinese workers earning just 34p an hour",32,2010-04-18
41,Creating the Microsoft RMS integration link for your retail store at best prices.,1,2010-04-23
42,Investors Of Microsoft Still Shrug Even At The Profit Of 35 Pct,1,2010-04-23
43,Israel independence day.,1,2010-04-27
44,Microsoft Launches Social Networking Phones [LIVE],1,2010-05-04
45,Microsoft Plans Worldwide Launch Of Project Natal In October | News And Reviews Of The Latest Tech,1,2010-05-11
46,1 Million Xbox 360 Sold,1,2010-05-10
47,Microsoft chief Bill Gates visits Amethi with Rahul Gandhi,1,2010-05-11
48,Rahul Gandhi opens constituency Gates for Microsoft chief,1,2010-05-12
49,Free Games for Xbox 360 Natal,1,2010-05-12
50,Microsoft Office 2010 for Windows - New Version | TipsBase,1,2010-05-13
51,9-year-old Marko Calasan plots his fifth Microsoft certification,1,2010-05-17
52,It's Official: Apple is now more valuable than Microsoft,4,2010-05-26
53,Apple exceeds Microsoft in market capitalization ,1,2010-05-26
54,"History is Made! For the first time, Apple Inc. surpasses Microsoft to become the world's most valuable technology company",1,2010-05-26
55,New king of tech: Apple overtakes Microsoft,1,2010-05-27
56,"After many years of monopoly, Microsoft is finally overtaken by Apple in market capitalization. Not that one is any better than the other, though.",0,2010-05-26
57,"UK Children as young as four ""to be fingerprinted to borrow school books from library"" with a system developed by Microsoft",70,2010-05-28
58,"Microsoft: Is Steve Ballmer In or Out?
",1,2010-06-10
59,Hackers target Microsoft Windows XP support system,1,2010-07-02
60,"Google, Microsoft aiding Obama policies? ",1,2010-07-09
61,One of the Russian spy worked at Microsoft,1,2010-07-14
62,Russian spy working at Microsoft,1,2010-07-14
63,Russian Spy Worked at Microsoft,1,2010-07-14
64,Microsoft Gets Sued and Accidentally Leaks Windows 8 Details,1,2010-07-16
65,Licenze ARM a Microsoft: nel futuro un processore made in Redmond?,0,2010-07-23
66,Microsoft Responds to IE8 Privacy Allegations,2,2010-08-03
67,Microsoft does not understand the iPad,1,2010-08-05
68,"Microsoft cofounder sues IT heavyweights A company owned by Microsoft co-founder Paul Allen has blasted Apple, Facebook, Google, YouTube, Yahoo and others with a patent infringement lawsuit filed in a US court.",1,2010-08-29
69,Russia Uses Microsoft To Suppress Dissent — One of the authorities’ new tactics for quelling dissent in Russia is confiscating computers under the pretext of searching for pirated Microsoft software.,27,2010-09-12
70,Russia Uses Microsoft to Suppress Dissent,15,2010-09-12
71,Russia Uses Microsoft to Suppress Dissent,3,2010-09-12
72,"Russian cops use excuse of pirated Microsoft products to raid dissidents, newspapers, and environmental groups claiming that the investigations come at MS's request. MS lawyers have cooperated with the newspaper raids, whose editors say that the they would not have happened without MS's complicity.",407,2010-09-13
73,Russia uses Microsoft to suppress their dissenters,1,2010-09-13
74,Microsoft Antipiracy Efforts In Russia Out Of Control,1,2010-09-13
75,Microsoft grants licenses to nonprofits and journalists outside of the US.,1,2010-09-13
76,Microsoft extends software licenses to NGOs stopping Russia's crackdown.,1,2010-09-14
77,Microsoft and their products,1,2010-09-21
78,Microsoft Supporting Iron Ruby on Windows phone 7,1,2010-09-23
79,"Microsoft hopes to bury iPhone, Android",1,2010-10-02
80,"Microsoft Office & Windows Activation Key On Sales! Fast Shipping!
",1,2010-10-06
81,The Latest 5 HTC WP7 Phones Launched by Microsoft,1,2010-10-12
82,"To apologize, Microsoft is giving away its software to NGOs in ",1,2010-10-16
83,Microsoft Moves to Help Nonprofits Avoid Piracy-Linked Crackdowns,1,2010-10-17
84,"Microsoft expands efforts to help nonprofit, advocacy groups avoid software piracy-related crackdown by Governments. MS will provide free software licenses 500,000 advocacy groups, independent media outlets and other NGOs in countries with tightly controlled governments, including Russia and China",0,2010-10-17
85,Russia uses Microsoft to suppress dissent from environmental group,3,2010-11-08
86,Software industry leader Microsoft ranked as high as 22 billion U.S. dollars in cash,1,2010-12-06
87,Well thats just great Microsoft...,3,2010-12-09
88,Privacy and Security Fanatic: Leaked Cables: Chinese Hackers Used Microsoft Source Code To Attack Google & US Government,1,2010-12-08
89,Microsoft offered 15 billion dollars to Facebook,1,2010-12-13
90,Microsoft planning new Windows tablet OS,1,2010-12-22
91,France Wants To Extend Private Copying Levy To Tablets... But Not If They Run Microsoft Windows,5,2010-12-28
92,"Microsoft Supposedly Showing Off Its Answer To Apple TV And Google TV At CES (MSFT, GOOG, AAPL)",1,2011-01-04
93,"Vladimir Putin signed a 20-page executive order requiring all public institutions in Russia to replace proprietary software, developed by companies like Microsoft and Adobe, with free open-source alternatives by 2015.",465,2011-01-08
94,US Justice Dept national security chief to join firm run by former Microsoft chief strategist,1,2011-01-14
95,Microsoft doing its part to make the world a little safer. ,1,2011-01-18
96,New Microsoft Solutions for Business Intelligence,1,2011-01-24
97,Italy sues Microsoft for box-bundling bungling,11,2011-01-24
98,Microsoft Pulls Workers Out Of Egypt,4,2011-01-31
99,Is Microsoft Bing Copying Google Search Results Directly ? | Stuff Sneak,1,2011-02-02
100,"An independent probe into fraud allegations at the $28 billion global health fund supported by Microsoft founder Bill Gates and his wife Melinda will be announced later this week
",0,2011-02-02
101,Google vs Microsoft Mudslinging of network giants,1,2011-02-03
102,Discover the secret  Microsoft engineers would not want you to know about xbox 360,1,2011-02-07
103,Microsoft and Nokia announced a Global Alliance a year and a half ago when Elop was at Microsoft.  It was an utter failure.  Elop will try again as Nokia CEO and bets are that the same people with the same strategy will yield yet another failure.,8,2011-02-11
104,Little wonder governments are moving to Linux; when governments place their security in the Microsoft operating system they lose.  Just ask Iran.,1,2011-02-13
105,Nokia e Microsoft anunciam aliança para produção de celulares Windows Phone 7 ,1,2011-02-17
106,Microsoft invests in Russia Skolkovo,1,2011-03-04
107,"Silverlight Development, Microsoft Silverlight Design, Silverlight programming ",1,2011-03-04
108,(Nokia + Microsoft) vs Andoid vs Apple,0,2011-03-04
109,Microsoft Will Pay Nokia $1 Billion For Phone Deal,1,2011-03-07
110,Appalled by Microsoft and @bing trading retweets for humanitarian aid to Japan? Let's get #fuckbing trending. ,1,2011-03-12
111,Microsoft Tightens-Up On Web Browsing,1,2011-03-15
112,"R.I.P. Microsoft Zune, 2006-2011",0,2011-03-15
113,"Microsoft is one of the 110 most ethical companies in the world. Google, Apple didn't make the cut.",0,2011-03-17
114,Microsoft Vietnam and FPT partner in cloud computing technologies,1,2011-03-18
115,Microsoft & Apple take advantage of Japan disaster,0,2011-03-18
116,Microsoft Dynamics CRM,1,2011-03-22
117,"Microsoft Wins 'Most Ethical' Award--Google, Facebook, Apple Don't Make The List ",3,2011-03-23
118,Microsoft Wants To Make It Illegal To Buy From An Overseas Company That Uses Unauthorized Software,34,2011-03-25
119,"A hacker in Iran appears to be behind an Internet attack that almost left Google, Microsoft, Mozilla, Skype, and Yahoo vulnerable",1,2011-03-24
120,"Microsoft Compromises Users’ Privacy: No HTTPS in Arab Countries, Iran",51,2011-03-26
121,Did Microsoft leave Hotmail open for Dictators?,4,2011-03-26
122,What justification can there be for Microsoft to make Hotmail *less* secure?,2,2011-03-25
123,Microsoft Pilots Xbox Kinect For Interactive Education In South African School,1,2011-03-29
124,Microsoft Going After Google,4,2011-03-31
125,Microsoft files suit against Google over competition laws. ARE YOU SHITTING ME?,2,2011-03-31
126,"Apple iPad craze might not last, say Microsoft and Dell",16,2011-04-01
127,Breaking News: Microsoft will merge with Apple = Microapple,0,2011-03-31
128,Training Options for Tutorials on Microsoft Project 2010,1,2011-04-07
129,"Nokia will lay off up to 6,000 next week - Microsoft partnership more ""takeover"" than deal",56,2011-04-13
130,microsoft points,0,2011-04-13
131,Open letter to Mr. Bill Gates of Microsoft Corporation,1,2011-04-16
132,Apple Now More Profitable Than Microsoft Too,1,2011-04-29
133,Apple beating Microsoft for first time in 20 years in quarterly revenue.,1,2011-04-29
134,Microsoft closing in on $7 billion deal to buy Skype.  ,457,2011-05-09
135,Microsoft buys Skype for a cool $8.5 billion ,3,2011-05-10
136,Microsoft close to deal to buy Skype: source - Tech News - IBNLive,1,2011-05-10
137,Microsoft Acquires Skype for $8.5 Billion,1,2011-05-10
138,Microsoft buying Nokia?,1,2011-05-16
139,Professional 2007 Gives Many Training Options for Microsoft Office Accounting,1,2011-05-15
140,Microsoft is going to buy nokia,1,2011-05-16
141,Rumour mill: Microsoft buying Nokia?,1,2011-05-18
142,Breaking: Google buys Microsoft for $50 billion,1,2011-05-19
143,Apple Now Worth More Than Microsoft & Intel Combined,1,2011-06-06
144,"Apple=Microsoft+Intel
",1,2011-06-06
145,Supreme Court Upholds $290 Million Infringement Award Against Microsoft,1,2011-06-09
146,"Microsoft, Facebook, RIM, and others write to the FCC in support of AT&T T-Mobile merger -- Engadget",1,2011-06-10
147,Microsoft Upgrades Mobile Bing more searches for Microsoft.,0,2011-06-14
148,"Microsoft Outlook vs Lotus Notes
",1,2011-06-16
149,"Last Thursday, the FTC approved Microsoft's purchase of Skype; this morning, Microsoft fired 8 Skype execs. ",4,2011-06-20
150,Rumor: Ballmer will leave Microsoft after Windows 8,1,2011-06-22
151,Microsoft tells FSB to listen in on Skype,1,2011-06-25
152,Facebook overtakes Microsoft in UK: UKOM/Nielsen ,1,2011-06-27
153,"Thank you,Microsoft support",0,2011-06-29
154,"Microsoft admits Patriot Act can access EU-based cloud data: MD of Microsoft UK, says that cloud data - regardless of where it is in the world - is not protected against the US Patriot Act",1274,2011-07-03
155,"Microsoft admits Patriot Act can access EU-based cloud data: MD of Microsoft UK, admits that cloud data - regardless of where it is in the world - is not protected against the US Patriot Act",1,2011-07-03
156,Microsoft to Partner With China’s Leading Search Engine,3,2011-07-04
157,"Microsoft partners with China's leading search engine Baidu: 
Deal to give Bing access to the world's LARGEST online population - likely a blow to Google",7,2011-07-05
158,Microsoft ERP,1,2011-07-05
159,"Microsoft manages to secure a deal with Baidu, search engine in China. ",1,2011-07-04
160,EU Upset by Microsoft Warning About US Access to EU Cloud: Members of European Parliament demand to know what lawmakers intend to do about the conflict between the EU's Data Protection Directive and the US Patriot Act,21,2011-07-07
161,Electronic Frontier Foundation to Microsoft and Cisco: Stop choosing to become little tech helpers to China's repressive regime and instead choose to be a force for good,119,2011-07-08
162,"Microsoft reveals that US authorities have the right to access any cloud stored data, even if that data resides within the EU",1,2011-07-08
163,"Google Acquired 11 Companies in 2011, Microsoft Made Biggest Transaction",1,2011-07-11
164,microsoft imagine cup brings geeks together to do amazing things,1,2011-07-12
165,ArticlesWorld – Free Article Directory» Hosting Microsoft Exchange Server,1,2011-07-12
166,Microsoft Exchange Server -- How Do You Want It Hosted?,1,2011-07-14
167,Hosting Microsoft Exchange Server,1,2011-07-14
168,Microsoft cuelga por error un proyecto secreto,1,2011-07-16
169,Tulalip – A Microsoft Social Media Contender?,1,2011-07-17
170,"Abuses in Tech Industry in China Exposed - Names involved include Dell, Salcomp, IBM, Ericsson, Philips, Microsoft, Apple, HP, & Nokia",0,2011-07-17
171,Microsoft Will Pay You To Use An iPhone | iPhone News Updated,1,2011-07-19
172,Microsoft tycoon Bill Gates to reinvent toilets.,3,2011-07-19
173,Microsoft 'Tulalip' Might Be A Hybrid Search/Social Networking Service,1,2011-07-20
174,Nokia To Reveal Its First Windows Phone on August 17 With Microsoft,5,2011-08-03
175,BBC News - UK student wins Microsoft Excel World Championship,1,2011-08-04
176,Fifteen-Year-Old UK Student Wins Microsoft Excel World Championship,0,2011-08-04
177,This Day in Tech: Microsoft plans to press Android patent case | Business Tech - CNET News,1,2011-08-20
178,"Sex claims and the 'wild ways' of Microsoft bosses laid bare - A culture of ""excessive drunkeness"" and lewd behaviour among senior staff at Microsoft in Britain has apparently been laid bare in a £10 million High Court battle between its UK chief and his former second in command.",7,2011-09-01
179,"Iranian Government Helped Hackers Issue Bogus Security Certificates for the CIA, Google, Microsoft and Twitter",19,2011-09-05
180,"Dutch CA DigiNotar also issued rogue SSL certificates to the CIA, MI6, and Mossad for sites such as Facebook, Yahoo!, Microsoft, Skype, Twitter, Tor, Wordpress and many others",1,2011-09-05
181,Microsoft helped the Tunisian government spy on the Tunisian population,1,2011-09-05
182,"Iran suspected in Dutch hacking -  Hackers who broke into a Dutch web security firm have issued hundreds of bogus security certificates for spy agency websites including the CIA as well as for Internet giants like Google, Microsoft & Twitter",5,2011-09-05
183,Wikileaks: Microsoft aided former Tunisian regime in exchange for dropping its policy favouring open source software,3,2011-09-06
184,Wikileaks: Microsoft aided former Tunisian regime in exchange for dropping its policy favouring open source software,1,2011-09-06
185,Exchange 2010 From Microsoft - Cloud-Ready Even For Your Greatest Corporation NewVeracityNow.com,1,2011-09-09
186,Microsoft accused Dilma Russeff (president of Brasil) of be against US and pressured the government of Vietnam to change its laws,1,2011-09-17
187,"Microsoft Windows 8 Features - Windows 8 Features, Microsoft Windows 8 Fatures, Windows 8 updates, Windows 8 download",0,2011-09-18
188,"Microsoft announced that Windows 8 will support ARM microprocessors in addition to the traditional x86 & AMD ., The main point is the extremely redesigned user interface. and Windows 8 has short boot times
",1,2011-09-20
189,"Pirate Party - Children of Marx and Microsoft - They demand transparency and direct democracy, and almost one in ten voters in Berlin gave them their vote. The Pirate Party is no longer just a party for Net-nerds in hoodies, but represents demands from across society. ",685,2011-09-25
190,"Microsoft, Red Cross and UN busted in global news fixing scandal",1,2011-09-29
191,Microsoft Mouse Driver & Software Download Support,1,2011-10-02
192,'Underpaid' Microsoft CEO Steve Ballmer gets 2 per cent salary hike - Tech News - IBNLive,1,2011-10-04
193,More Microsoft Vulnerabilities,2,2011-10-07
194,BlackBerry outage brings down some Microsoft Cloud Users,1,2011-10-10
195,"The Deadly Microsoft Embrace: The Tamil Nadu state government is adding costly Microsoft software to laptops meant for poor students. It could cost Rs 10,200 Crore and no Wi-fi/webcams for the students",0,2011-10-11
196,Microsoft closes Skype deal,1,2011-10-14
197,"Boycott Israel - Uninstall Microsoft Security Essentials NOW (and to be safe, just uninstall Windows too)",1,2011-10-15
198,Microsoft HoloDeck - Direct 3D Interactions with a Situated See-Through Display,0,2011-10-19
199,2011 microsoft corporation games for the pc free desktop images free downloads pc microsoft student computer deals children pc games,1,2011-10-19
200,Microsoft looking to bid for Yahoo once again,1,2011-10-19
201,BBC News - Duqu infection linked to Microsoft Word exploit,1,2011-11-02
202,"Bill Gates VS Steve Jobs, Microsoft VS Apple Infographics",0,2011-11-02
203,ePals Enables SchoolSafe Access to Third-Party Applications Starting With Microsoft Office Web Apps and Google Docs,1,2011-11-11
204,The Microsoft Zune 120GB! | TechK2.CoM,1,2011-11-12
205,Microsoft Technologies,1,2011-11-16
206,"Microsoft 70-178 Exam - Microsoft Project 2010, Managing Projects",1,2011-11-21
207,Microsoft office SharePoint services,1,2011-11-23
208,Microsoft Exchange Consultant,1,2011-11-23
209,Microsoft to introduce Kinect Sensor for PC and Business - BLOG - AVClubhouse.com,1,2011-11-23
210,Microsoft Store Promo Codes ,1,2011-11-26
211,Details Concerning Microsoft Training San Diego,1,2011-11-27
212,microsoft office 2010-microsoft office 2007-microsoft office 2010 product key,1,2011-11-30
213,"Google, Microsoft, Yahoo, ISPs, All Served With Streaming Site Blocking Demand: Some organizations representing the movie, cinema and TV industries have gone to court in France in an attempt to force Google, Microsoft, Yahoo and the country’s ISPs to block several streaming sites",203,2011-12-01
214,Microsoft launched a major offensive strike.,1,2011-12-07
215,Microsoft co-founder Bill Gates confirmed he is in discussions with China to jointly develop a new and safer kind of nuclear reactor,150,2011-12-07
216,Some Info On Microsoft Training San Diego,1,2011-12-10
217,Every Data About Microsoft Mcse San Diego,1,2011-12-10
218,"Techmnia: A Natale sfida gli amici con le nuove console Microsoft, Nintendo e Sony",1,2011-12-13
219,Microsoft MCTS Certification Preparation,1,2011-12-14
220,Microsoft Certification Preparation,1,2011-12-14
221,"Bill Gates: No, I’m Not Returning To Microsoft",1,2011-12-15
222,"Bill Gates speaks out in Sydney...On Microsoft, Steve Jobs, and the weather",0,2011-12-15
223,claims study | Microsoft - CNET News,1,2011-12-16
224,Some Info On Microsoft Training San Diego,1,2011-12-19
225,Microsoft has introduced a Bluetooth Mobile... - Florence - FriendFeed,1,2011-12-19
226,Microsoft Office will be released on the iPad in... - Florence - FriendFeed,1,2011-12-21
227,Google Helping Mozilla Firefox To Spite Microsoft ?,1,2011-12-21
228,"Microsoft: CES 2012 will be our last - Dec. 21, 2011",1,2011-12-22
229,"""Orthodox Christian but extremely secular"" dude is suing Facebook, Google, Microsoft and Yahoo for defaming Jesus. ",1,2011-12-23
230,"Microsoft patents lawful intercept on Skype - ""Aspects of the subject matter described herein relate to silently recording communications. [...] Modification may include, for example, adding, changing, and/or deleting data within the data.""",1,2011-12-24
231,CHRISTMAS Offer Microsoft MB5-858 material in only $99,1,2011-12-26
232,Microsoft MB7-515 Practice Materials | MB7-515 Exam Questions | $99 Microsoft Bundle,1,2011-12-29
233,"Computer programming prodigy Arfa Karim Randhawa, a 16-year-old girl from Pakistan who seven years ago became the youngest Microsoft Certified Professional in the world, is on life support after suffering an epileptic attack",0,2011-12-30
234,"Child genius 16 year-old Aarifa Karim Randhawa who back in 2005 became the youngest Microsoft Certified Professional in the world, at age 9. Is in critical condition with little chance of recovery. ",1,2011-12-31
235,Some Info On Microsoft Training San Diego,1,2011-12-31
236,"India has ordered 22 social networking sites -- including Facebook, Google, Yahoo, and Microsoft -- to remove all ""anti-religious"" or ""anti-social"" content in the next 45 days",168,2011-12-31
237,Most young employee of Microsoft now on death-bed | One platform has different Gateway,1,2012-01-01
238,Microsoft exec admits Windows Phone was response to Apple's iPhone,1,2012-01-07
239,Hundreds Threaten Suicide At Microsoft Supplier Plant In China,10,2012-01-11
240,Microsoft is paying for doctors to consult with doctors of the seriously ill Aarifa Karim - the youngest Microsoft Certified Professional.,1,2012-01-11
241,Founder of Microsoft Bill Gates contact the Arfa's Parents for Her treatment ~ :: MixtureMug - We Share!,1,2012-01-12
242,Microsoft probes mass suicide threat at China plant - ,0,2012-01-12
243,World's youngest Microsoft Certified Professional Died Today :(,2,2012-01-14
244,Worlds youngest Microsoft certified professional: Aarifa Karim loses race for her life ,2,2012-01-14
245,World's Youngest Microsoft certified professional Arfa Karim passes away,1,2012-01-14
246,"Arfa Karim Randhawa, the computer programming prodigy who became the world’s youngest Microsoft Certified Professional at 9 years old, has passed away at the age of 16",2,2012-01-14
247,"Content Censorship Can Block Microsoft, Google, Facebook, Yahoo in India",1,2012-01-15
248,"World's youngest Microsoft Certified Professional dies 
in Pakistan",1,2012-01-15
249,Youngest Microsoft Certified Professional Dies,1,2012-01-16
250,World’s Youngest Microsoft certified professional Arfa Karim passes away at 16,1,2012-01-16
251,A teenager who aged nine became the world's youngest Microsoft Certified Professional has died.,1,2012-01-19
252,"Microsoft announces Q2 earnings: record $20.89 billion in revenue, $6.62 billion net income",1,2012-01-20
253,Entire Details on Microsoft training San Diego,1,2012-01-23
254,Fly Away go behind the scenes at the Microsoft Game Studios,1,2012-01-24
255,Microsoft MB7-841 Preparation Materials,1,2012-02-02
256,Microsoft MB7-838 Exam Notes,1,2012-02-03
257,Microsoft Gold Partner - Agiline,1,2012-02-07
258,Microsoft Invests In 24/7 For Customer Service Software,1,2012-02-14
