,title,score,created
178,Huawei supplants Apple as the second largest smartphone seller,121,2018-08-01
179,"Original Bramley apple tree has fungal infection: The tree, thought to be the first to give rise to bramley apples, is dying of a fungal infection. The tree is 207 years old and it is located in Nottinghamshire, England.",117,2016-07-25
180,Apple removes all Iranian apps from its App Store,117,2017-08-28
181,"Apple owns $52.6 billion in US Treasury: If Apple were a foreign country, CEO Tim Cook might have considerable political clout in the United States.",118,2017-08-03
182,Dubious Apple Watch link to Jamal Khashoggi 'killing',114,2018-10-14
183,Chinese workers who assemble the iPhone are literally lining up to quit a major Apple supplier thanks to falling sales,119,2019-03-01
184,Chinese President Xi Jinping has again sought to rally support for “cyber sovereignty” in a message to China’s annual World Internet Conference on Sunday: Apple chief executive Tim Cook and Google boss Sundar Pichai attend conference as China tightens grip over cyberspace.,114,2017-12-03
185,"Some victims of the San Bernardino attack will file a legal brief in support of the US government's attempt to force Apple to unlock the encrypted iPhone belonging to one of the shooters, a lawyer representing the victims says.",113,2016-02-21
186,Ireland to finally start reclaiming Apple back taxes,109,2017-12-04
187,Viral 'Pen-Pineapple-Apple-Pen' singer will serenade Trump in Tokyo,106,2017-10-31
188,"Man Arrested, Put In DNA Database For Allegedly Dropping Apple Core",106,2008-05-09
189,Chinese factory workers make vehement appeals to i-pad giant APPLE for providing medical compensation for poison affected workers who worked in making touchscreens for i-phone.,107,2011-08-30
190,Four major tech companies including Apple and Google have agreed to pay a total of $324 million to settle a lawsuit accusing them of conspiring to hold down salaries in Silicon Vall,104,2014-04-24
191,"Apple co-founder Steve Wozniak likes Australia's national broadband network so much, he’s applying for citizenship",106,2012-09-25
192,Paradise Papers: Apple's secret tax bolthole revealed,105,2017-11-06
193,"The Chinese government has intensified a co-ordinated public campaign against Apple, slamming the company as “dishonest”, “greedy” and “incomparably arrogant” and threatening regulatory action if the US company does not improve its after-sales service policies.",98,2013-03-28
194,"iPhones pose suicide risk to teenagers, Apple investors warn: In an open letter to Apple, published on Saturday, Barry Rosenstein and Anne Sheehan cited studies linking the use of iPhones and other devices to increased suicide rates among teens.",97,2018-01-08
195,"Belarus Sold Russia Five Times More Apples Than It Officially Harvested: Russian law enforcement agencies have blamed the discrepancy in 2015’s figures on forged documents used to smuggle sanctioned, European produce over the Russian-Belarusian border",98,2016-09-30
196,"China could ban the iPhone and iPad as Apple ""loses"" Siri patent case",88,2014-08-09
197,Apple increases App Store prices by 25% following Brexit vote,95,2017-01-17
198,"More than 225,000 Apple iPhone accounts hacked",90,2015-09-01
199,Apple pays $15 Billion to Ireland in landmark case. The European Union scaps ECJ lawsuit.,90,2018-09-18
200,Ireland to appeal EU's record $14 billion tax order on Apple,87,2016-12-18
201,"Austria has vowed to tax tech giants, following France's new levy on the so-called GAFA companies: Google, Apple, Facebook and Amazon. The EU has been trying to implement a bloc-wide policy on the matter.",88,2018-12-29
202,"Are Walmart's Chinese Factories as Bad as Apple's? - 
A fiction-free investigation finds that in many cases, the company's auditors are asleep on the job",84,2012-03-21
203,WikiLeaks publishes CIA hacking tactics for Apple products,85,2017-03-23
204,"The View of Apple from China -- ""If people saw what kind of life workers lived before they found a job at Foxconn, they would come to an opposite conclusion of this story: that Apple is such a philanthropist.""",84,2012-01-27
205,Apple thanks Saudi computer scientist for detecting security flaw,82,2019-02-02
206,"Poland – one of the world’s biggest apple exporters – could face significant negative consequences as a result of Russia’s recent ban on the import of European goods, including Polish apples.",81,2014-08-14
207,"Apple plans to boost its green credentials in China: new generators will be built in the north, east and south of China, producing enough energy to power 265,000 Chinese homes",83,2015-10-25
208,Apple farmers lure owls back to orchards in assault on mice: Farmers in Japan’s main apple-producing region are encouraging the wild owls they once turned off back to their orchards as saviors in their battle against tree-killing rodents.,80,2017-12-16
209,"Apple supplier Foxconn defends labor practices in wake of protest. Criticism of Foxconn started when a string of worker suicides at its facilities drew widespread attention. Labor protection groups uncovered labor abuses at the factories, including long working hours and the hiring of underage labor",79,2015-06-27
210,Apple hauled before parliamentary committee to explain battery scandal - Canada,74,2018-03-01
211,"Apple removes Iranian apps from App Store, cites U.S. sanctions",77,2017-08-24
212,Apple files $1 billion lawsuit against major iPhone partner,79,2017-01-21
213,A security researcher claims that Apple is collecting a lot of personal data without user knowledge. Apple denies these allegations.,79,2014-07-24
214,Russia demands Apple pull Telegram for iPhone from App Store,75,2018-05-28
215,Watchdog report says Apple's rush to produce a cheaper handset led to widespread abuses of workers in China.,70,2013-07-30
216,"Apple Watch worn by Saudi journalist may have transmitted evidence of his death, Turkish paper reports",77,2018-10-13
217,Apple: 'We don’t want to debate climate change. We want to stop it.',70,2015-04-20
218,FOSS Patents: UK judge who issued extreme ruling for Samsung against Apple hired by... Samsung!,71,2013-02-28
219,Apple plans $100 billion stock buyback,73,2018-05-02
220,A 16-Year-Old from Australia Hacked Apple Servers,69,2018-08-18
221,"Apple, Google Criticized For Carrying App That Lets Saudi Men Track Their Wives",77,2019-02-13
222,"Amazon, Apple, Others Hit with GDPR Complaints, €18.8B Maximum Penalties",69,2019-01-19
223,Stockholm says no to Apple 'town square' in its oldest park,68,2018-11-01
224,Dutch court hands another victory to Samsung in global Apple patent war,66,2012-06-21
225,Apple's iPhone Workers Must Strip For Tattoo Checks And Wear Only Approved Hairstyles,63,2013-07-29
226,Paradise Papers' disclose offshore deals with Apple,66,2017-11-07
227,South Korean group files complaint against Apple CEO over iPhone slowdown,68,2018-01-18
228,Trump calls on Apple to move production from China to US,63,2018-09-08
229,Apple leads race to become world's first $1tn company,61,2018-01-03
230,"Armed robbers hit Apple store in Paris, reportedly steal $1.3 million in goods",59,2013-01-01
231,"Apple downgraded by HSBC, saying the iPhone maker is 'facing the reality of market saturation'",67,2018-12-04
232,A court in China has rejected Apple's lawsuit accusing a Chinese technology company of infringing its iPad trademark.,61,2011-12-06
233,"Apple encryption case risks influencing Russia and China, privacy experts say. Analysts and lawmakers warn, ramifications ‘could snowball around the world’",64,2016-02-17
234,Anger as Apple axes China anti-firewall app,58,2013-10-03
235,"Number of Canadian government employees fired for misconduct, incompetence sees sharp increase - New management system, technology reportedly catching more bad apples",61,2018-07-16
236,Apple loses trademark fight over 'iPhone' name in China,55,2016-05-05
237,"Apple says it has 'absolutely no evidence' of China spy chip claims, says it's not under gag order",58,2018-10-04
238,Apple has now broken all of Google’s internal iOS apps,60,2019-01-31
