,title,score,created
1078,How to build dynamic chart on Microsoft dynamics CRM Online page using Chart JS and Javascript?,1,2015-05-30
1079,"Microsoft will release Windows 10 on July 29th, 2015",92,2015-06-01
1080,Microsoft Reveals Windows 10 Global Launch Date,3,2015-06-01
1081,Windows 10 Launch Date Revealed by Microsoft,1,2015-06-01
1082,Windows 10: apps and features killed off as Microsoft reveals limits of new operating system,22,2015-06-02
1083,EARN MONEY FROM MICROSOFT NEW PROGRAM,1,2015-06-02
1084,Microsoft says Windows 10 available on July 29 and Windows 10 Demo - Technical Preview [Video],1,2015-06-02
1085,"Microsoft's new service ""Microsoft Wifi'",1,2015-06-03
1086,"Microsoft + InterKnowlogy​ bring the citizens & political parties in the state of Iowa the tech, data, & business intelligence to help make the caucus reporting efficient, accurate, & secure.",1,2015-06-09
1087,Administer Change and Growth with Microsoft Dynamics AX,1,2015-06-09
1088,World's Best Software Company Microsoft Launches 1TB Xbox One Comfort,0,2015-06-09
1089,'No back doors here': Microsoft opens site to let governments check out its source code | Microsoft has opened its second Transparency Center in the heart of Europe.,44,2015-06-09
1090,Join webinar for Microsoft dynamics crm,1,2015-06-16
1091,Microsoft Ties Up With Indian eCommerce Major Snapdeal To Launch Their Branded Online Store,0,2015-06-17
1092,Microsoft puts the final nail in Nokia’s coffin,3,2015-06-18
1093,Anti-US Govt Surveillance Website by Microsoft Hacked,1,2015-06-18
1094,Ultimate Microsoft BI Functionality On An Organically Developed Architecture,1,2015-06-18
1095,Russian Government moving to ditch Microsoft Windows and considering replacing it with Linux distro ReactOS,8,2015-06-19
1096,"Zye Technologies | Zye Technologies | Computer Technical Support | Microsoft Certified | Zye Technologies @ 1-844-471-0786Zye Technologies, Quick Support - Call Now : 1-(844)-471-0786",1,2015-06-19
1097,"Microsoft Funds University of Washington, Tsinghua Tech Program: Microsoft give $40 million to help fund a graduate-school program, seeking to foster research in new technologies. Global Innovation Exchange will be located in the Seattle",3,2015-06-20
1098,Measuring Candidate Expertise with Microsoft Word Proficiency Test,1,2015-06-22
1099,What are the steps for optimizing Microsoft Dynamics CRM Development?,1,2015-06-25
1100,Satya Nadella's new mission for Microsoft: help people 'achieve more',1,2015-06-26
1101,Microsoft Business Intelligence Software Development,1,2015-06-27
1102,Microsoft Administrator,1,2015-07-04
1103,"Microsoft hangs up on Nokia business, to cut 7,800 jobs",486,2015-07-08
1104,Do you know how many Nokia employees are left in Microsoft?,1,2015-07-08
1105,"Microsoft to Cut 7,800 Jobs as It Restructures Phone Business",0,2015-07-08
1106,Will Microsoft Stop Making Lumia Smartphones Soon?,1,2015-07-13
1107,Microsoft Dynamics CRM Customization Services Enhancing Growth Of Businesses - How?,1,2015-07-15
1108,Microsoft unveils new GigJam collaboration software,1,2015-07-15
1109,Microsoft expects to have one billion devices based on Windows 10 by 2018,3,2015-07-17
1110,"Facebook set to acquire Pebbles, another Israeli high-tech firm - With the purchase of an Israeli firm pioneering the field of virtual reality, Facebook will follow Apple, Intel & Microsoft who are already operating VR R&D capabilities in Israel.",1,2015-07-18
1111,Finnish town of Salo plunges further into recession after Microsoft kills Nokia unit,26,2015-07-19
1112,Report: Microsoft Pays $320mil to Acquire Israeli Tech Security Adallom - Calcalist reports software giant closes its largest Israeli acquisition that will serve as basis of Microsoft’s upcoming cyber center in Israel.,1,2015-07-20
1113,"Microsoft takes a stand against revenge porn, announces it will remove links, access.",7,2015-07-23
1114,Microsoft Bing Accepting Revenge Porn Removal Requests,1,2015-07-23
1115,How Microsoft BI Developers Mix and Match The Things To Implement Business Intelligence?,1,2015-07-23
1116,Inquiry management system in Microsoft dynamics CRM,1,2015-07-24
1117,"Apple, Microsoft, Google and other US firms to commit $140bn to address climate change",1420,2015-07-27
1118,"China's State Council is officially lifting its 15-year old ban on the sale of game consoles, giving Microsoft, Sony and Nintendo more access to one of the world's largest video game markets.",3,2015-07-27
1119,"“We will access, disclose and preserve personal data, including your content (such as the content of your emails, other private communications or files in private folders), when we have a good faith belief that doing so is necessary to”. - Microsoft",3150,2015-07-29
1120,Microsoft Office 2013 Professional Plus SP1 VL (x86 - x64) Cracked,1,2015-07-29
1121,Windows 10: Microsoft faces criticism over privacy,1,2015-07-31
1122,Windows 10: Microsoft faces criticism over privacy,479,2015-07-31
1123,New Round Of Funding Boosts Uber Valuation To $51B; Microsoft Among Investors,1,2015-07-31
1124,Grown Up Your Business With Microsoft Dynamics CRM,1,2015-08-03
1125,Tips To Implements In User Adoption For Your Microsoft Dynamics CRM,1,2015-08-08
1126,A team led by Microsoft co-founder Paul Allen has recovered a bell from the HMS Hood which was once the largest warship in the world and the Royal Navy’s symbolic flagship. The Hood was sunk by the German ship Bismarck.,16,2015-08-10
1127,"China's Tsinghua hopes to partner with Facebook, Microsoft",5,2015-08-12
1128,Microsoft Ensures To Fix Windows 10 Store Apps Errors,1,2015-08-13
1129,Windows 10 phones home to Microsoft even if you change privacy settings,24,2015-08-13
1130,"Consumer groups have slammed Microsoft for its policy of forced updates for Windows 10, which is hitting customers in remote locations with massive bill shocks by blowing out their data caps.",41,2015-08-17
1131,"Windows Server 2016 Preview, Surface Pro 4 Rumors: Microsoft Roundup - InformationWeek",0,2015-08-22
1132,Microsoft tests SharePoint 2016 and enterprise cloud hybrid search,1,2015-08-25
1133,How to Download Microsoft Cortana for Android Devices?,1,2015-08-25
1134,Microsoft is turning the iPhone’s camera into a 3D scanner,1,2015-08-25
1135,Microsoft beams Internet into Africa using TV 'white spaces',1,2015-08-28
1136,"Google, Microsoft e Netflix se unem para criar novo formato de vídeo",1,2015-09-02
1137,Microsoft e Amazon se juntam a Disney em filmes na nuvem,1,2015-09-08
1138,"Microsoft, Apple, General Electric and Ford Motor say their products might have conflict minerals — tantalum, tungsten, tin or gold mined in war-torn regions across Africa",1,2015-09-08
1139,Microsoft battles US over warrant for drugs case emails,2,2015-09-09
1140,Microsoft has confirmed that Windows 10 is being downloaded to computers whether or not users have opted in.,596,2015-09-10
1141,Amazing Microsoft hololens,0,2015-09-13
1142,Microsoft Outlook Technical Support Phone Number 1-800-251-4919,1,2015-09-15
1143,Microsoft Office Technical Support Phone Number 1-800-251-4919,1,2015-09-15
1144,Microsoft signs agreement with NATO to bolster government cybersecurity,1,2015-09-16
1145,"""If your business is not the internet, then you business will be out of business."" Bill Gates,founder of Microsoft .",1,2015-09-16
1146,"China President Xi to tour Boeing, Microsoft on US visit",3,2015-09-16
1147,Microsoft outlook technical support phone number,1,2015-09-16
1148,"Sage, Microsoft Partner On Global Future Technology Development",1,2015-09-17
1149,Here’s what Microsoft gave the teenager who was arrested for bringing a homemade clock to school,1,2015-09-19
1150,"Forget High School: Ahmed Can Take His Clock To Space Camp - Latest Update: Gifts and Scholarships from Microsoft, NASA",3,2015-09-20
1151,Clock boy Ahmed is hero now! Microsoft gives him new gadgets. That's really cool for arrested.,1,2015-09-20
1152,Microsoft Surprised Ahmed Mohamed With A Big Box Of Gifts,1,2015-09-20
1153,What's going on with Skype and Amazon? Microsoft?,2,2015-09-21
1154,Skype: Microsoft messenger and video chat app currently not working across the globe.,1,2015-09-21
1155,"Skype Hacked & also Amazon, Microsoft messenger and video chat app NOT working properly",1,2015-09-21
1156,Laptop - Shop Business Microsoft,1,2015-09-23
1157,"Big Announcements for India by Google, Facebook, Microsoft",1,2015-09-28
1158,Watch! Microsoft CEO Satya Nadella Wiping Hands After Greeting Indian Prime Minister,1,2015-09-29
1159,"Ford, Toyota, Nissan, Microsoft 'Shamed' as Piracy Sponsors",2,2015-10-01
1160,microsoft office 2016 release date 22-septepber-2015,1,2015-10-01
1161,"Google & Microsoft Dismiss Patent Lawsuits, Ending a 5 Year Legal Battle",1,2015-10-01
1162,"Google & Microsoft Dismiss Patent Lawsuits, Ending 5 Year Legal Battle.",1,2015-10-02
1163,"oDesk update Microsoft Word Test Questions with Answer ~ Online Earning best sites, tips, tricks, right way of online earning",1,2015-10-05
1164,"Google & Microsoft Dismiss Patent Lawsuits, Ending a 5 Year Legal Battle",1,2015-10-04
1165,"oDesk update Microsoft Excel Test Questions with Answer ~ Online Earning best sites, tips, tricks, right way of online earning",1,2015-10-05
1166,Microsoft unveils its first ever laptop,8,2015-10-06
1167,Microsoft is preparing to respond to the new rival Apple iPad Pro. | world wide technology,1,2015-10-06
1168,"Microsoft launches the Microsoft HoloLens Development Edition, available for pre-order.",3,2015-10-07
1169,Microsoft: Forcing us to share data will harm US-EU relations,2,2015-10-08
1170,How To Show Form Level Notification On Any Microsoft Dynamics CRM Page,1,2015-10-09
1171,New Snowden revelations confirm Microsoft Tells the NSA about encryption backdoors in Windows and other proprietary software.,59,2015-10-11
1172,Microsoft Set to Announce Huge New Round of Layoffs,1,2015-10-12
1173,Hands-on review: Microsoft Lumia 950 XL - 51754 details PriceMatch.pk,1,2015-10-13
1174,Bill Gates calls fossil fuel divestment a 'false solution' - Founder of Microsoft and the Gates foundation also accuses environmentalists of making misleading claims about the comparative price of solar.,167,2015-10-14
1175,"Microsoft Office 2013 Activation Key, Microsoft office crack",1,2015-10-14
1176,"You don't need to move away from Microsoft DB technologies to gain flexibility, scalability, and dynamic operations",1,2015-10-14
1177,Microsoft no longer lets you opt-out of a Windows 10 upgrade (x-post r/technology),3,2015-10-15
1178,Skype for all: Microsoft lets users send direct links to chat with anyone via Skype,20,2015-10-16
1179,Dual layer Hybrid Rugged Heavy Duty Shockproof Case For Microsoft Lumia 950XL - Hot pink 38074,1,2015-10-19
1180,"Steve Ballmer define la inversión que ""salvó"" a Apple en 1997 como lo más disparatado que Microsoft ha hecho nunca",1,2015-10-23
1181,Two establishment Jews (Harvard and Microsoft) endorse boycott of Israel and ‘single state’ in Washington Post,0,2015-10-24
1182,"Microsoft is making a smartphone accessory you won’t want to live without | A Bangla-English Blog with Latest News, Technology News and Tips-Tricks.",1,2015-10-26
1183,"Microsoft Windows 10 Professional: বাজারে ‘উইন্ডোজ ১০ প্রফেশনাল’ | A Bangla-English Blog with Latest News, Technology News and Tips-Tricks.",1,2015-10-26
1184,Microsoft OST to PST Converter,1,2015-10-27
1185,Pakistani student Ozair Belal stands 2nd in Microsoft Student Partner Insider Program ranking globally. | Cyrace.com,0,2015-10-28
1186,"U.S. Tech Giants May Blur National Security Boundaries in China Deals | A growing number of companies like IBM, Cisco Systems and Microsoft have partnerships with Chinese companies with ties to the military, and experts are questioning those links.",7,2015-10-31
1187,Memorial Program Template Microsoft Word Floral Download Easy,1,2015-11-05
1188,Microsoft Acquires Israeli Cyber Security Firm,1,2015-11-09
1189,Microsoft headquarters in Germany evacuated over bomb threat,17,2015-11-10
1190,"1,800 evacuated after bomb threat at Munich area Microsoft HQ",3,2015-11-10
1191,Microsoft will host data in Germany to hide it from US spies,5,2015-11-11
1192,Microsoft plots data centers in Germany to stifle U.S. surveillance,6,2015-11-12
1193,Microsoft Appeases EU With German Data Centers,3,2015-11-12
1194,Microsoft is building data centres in Germany that the US government can’t touch,1,2015-11-12
1195,"Microsoft announces Halo 5: Guardians, coming in 2015 | Current News | Bangla Newspaper | English Newspaper | Hot News",1,2015-11-20
1196,"Teen accused of hacking US Army, Microsoft computers 'fled easily'",2,2015-11-26
1197,Microsoft contemplating free version of Windows 8.1 for Windows 7 users | Current News | Bangla Newspaper | English Newspaper | Hot News,1,2015-11-27
1198,Windows 10 Users Considering Class Action Lawsuit Against Microsoft for Poor System Performance,5,2015-11-30
1199,"Founders of Microsoft, Facebook, LinkedIn, Amazon, and more to invest in clean energy tech | VentureBeat | Business",2,2015-11-30
1200,European Patent Office fires up lawyers over claims of cosy love-in with Microsoft. Redmond's patent paperwork 'prioritized'.,1,2015-11-30
1201,"The newly formed Breakthrough Energy Coalition includes some of the world's most prominent tech and business titans, including Microsoft founder Bill Gates; Facebook founder and CEO Mark Zuckerberg; Virgin Group founder Richard Branson; Amazon founder and CEO Jeff Bezos,",0,2015-12-01
1202,"Microsoft Outperforms Google, Tencent, Intel And Qualcomm In Image Recognition Competition",13,2015-12-11
1203,Microsoft Lumia 950 XL Price in UK,1,2015-12-14
1204,Sell Old iPads to Microsoft for $200! | Current News | Bangla Newspaper | English Newspaper | Hot News,1,2015-12-15
1205,Lumia 650 To Be The Last 5 inch Lumia Of Microsoft,1,2015-12-17
1206,Microsoft Office 2007 İndir  Download (Full / Gezginler / Türkçe Sürüm),1,2015-12-17
1207,Latest Technology Microsoft Azure Launched By HCL CDC,1,2015-12-18
1208,Microsoft Dynamic CRM systems and software in Australia,1,2015-12-18
1209,"Microsoft Move To Revoke Trust In 20 Root Certificates Could Wreak Havoc On Sites: ""Tens of thousands of secure websites might start to display certificate errors to their visitors in January [2016], when Microsoft plans to stop trusting 20 CAs (certificate authorities) from around the world.""",167,2015-12-20
1210,Microsoft introduce a smartphone Which can be Used Like a Personal Computer,1,2015-12-20
1211,"Microsoft conveys first ""Redstone"" review construct to Windows 10 Insiders - The Best English Web Magazine",1,2015-12-20
1212,Microsoft Releases New Windows 10 App Updates,1,2015-12-21
1213,Microsoft Has Your Encryption Key If You Use Windows 10,46,2015-12-29
1214,Forecasting China's Smog: Both IBM and Microsoft are vying to tap the fast-growing market for forecasting air quality in the world's top carbon emitters.,6,2015-12-29
1215,Microsoft Corp said on Wednesday it will begin warning users of its Outlook.com email service when the company suspects that a government has been trying to hack into their accounts.,8488,2015-12-30
1216,Microsoft failed to warn victims of Chinese email hack: former employees,24,2015-12-30
1217,Exclusive: Microsoft to warn email users of suspected hacking by governments,13,2015-12-30
1218,"Microsoft pledges to tell email customers of state-sponsored hacking in future: Microsoft experts concluded several years ago that Chinese authorities had hacked into more than a thousand Hotmail email accounts, targeting international leaders of China's Tibetan and Uighur minorities in particular",1,2016-01-02
1219,China regulator queries Microsoft on findings in anti-trust probe,1,2016-01-05
1220,Microsoft failed to warn victims of Chinese email hack: former employees,0,2016-01-06
1221,"Microsoft has revealed details about the data it is tracking via its new operating system (OS), Windows 10.",51,2016-01-07
1222,"The Microsoft Scandal: President Obama has been spying on us and our children for years. Many of the 2016 running candidates have revealed information about this, as well as Bill Clinton.",1,2016-01-06
1223,"The Microsoft Scandal: President Obama has been spying on us and our children for years. Many of the 2016 running candidates have revealed information about this, as well as Bill Clinton",1,2016-01-06
1224,"Facebook, Google, Microsoft, Twitter and Yahoo join to criticise the Snooper’s Charter - US Internet companies warn that harmful legal moves by the UK will have global impact.",33,2016-01-08
1225,"Apple, Google, Microsoft Attack UK Government’s Hacking Plans.This legislation will set a precedent “which, if followed by other countries, could endanger the privacy and security of users in the UK and elsewhere.",32,2016-01-08
1226,Microsoft Will Abandon Windows 8 Completely Next Week,0,2016-01-09
1227,"Microsoft has finally ended support for Internet Explorer 8, 9 and 10 | News | Lifestyle",5,2016-01-12
1228,"Microsoft CEO selling his home for $3.48 million in Seattle,USA | Realestatecoulisse.com",1,2016-01-12
1229,Microsoft Surface Book,1,2016-01-12
1230,Microsoft Surface Book,1,2016-01-12
1231,Google and Microsoft Spend $1 billion every year for charity,1,2016-01-13
1232,"According to Human Rights lawyers, Thai ""prosecutors love Microsoft as they give them all the information they ask for.""",197,2016-01-19
1233,Microsoft vows to give $1bn cloud services to non-profits,0,2016-01-20
1234,Microsoft co-founder's yacht tears up protected coral reef in Cayman Islands. Paul Allen’s 330ft vessel destroys 80% of reef in protected zone,3612,2016-01-28
1235,Microsoft cofounder's yacht allegedly destroyed a coral reef,0,2016-01-28
1236,"Microsoft Stocks Jump As Cloud Computing, Surface Divisions Continue To Grow",1,2016-01-30
1237,Microsoft co-founder and ocean conservationist Paul Allen's yacht destroyed 80% of a coral reef,1,2016-01-31
1238,Microsoft testing underwater data center,13,2016-02-01
1239,Microsoft Office 2012 Professional Plus Licence Key,1,2016-02-01
1240,Microsoft tests underwater data centre,4,2016-02-02
1241,Microsoft ‘buys UK AI firm SwiftKey' - BBC News,1,2016-02-02
1242,Why Is Microsoft Drowning Its Servers?,1,2016-02-06
1243,"Bihar welder’s son, studying in IIT, lands Rs 1.02 cr Microsoft job",0,2016-02-06
1244,GoPro and Microsoft ink patent licensing deal,1,2016-02-08
1245,Vladimir Putin's Internet advisor wants to tax Apple and ban Microsoft Windows | Russia,50,2016-02-09
1246,Microsoft Windows 10 Spyware Powers Of Control,12,2016-02-11
1247,"Microsoft Continues to Use Software Patents to Extort/Blackmail Even More Companies That Use Linux, Forcing/Coercing Them Into Preinstalling Microsoft",1,2016-02-14
1248,Microsoft vs Java,1,2016-02-15
1249,Updategate: Windows 10 is resetting default apps back to Microsoft stock,1,2016-02-16
1250,Huawei tablet rivals Microsoft Surface,0,2016-02-24
1251,"Microsoft takes Apple’s side in iPhone dispute with FBI: ""We do not believe that courts should seek to resolve issues of 21st Century technology with a law that was written in the era of the adding machine""",1,2016-02-25
1252,Microsoft CEO In Tel Aviv: “No Doubt Israeli Human Capital Will Change The World”,2,2016-02-25
1253,Microsoft 'wholeheartedly' supports Apple in FBI encryption case,1,2016-02-26
1254,Microsoft CEO Satya Nadella Meets With Israeli Prime Minister,0,2016-02-26
1255,"Microsoft to unify PC and Xbox One platforms, ending fixed console hardware",14,2016-03-01
1256,Today's pre-order launch of the Microsoft HoloLens Development Edition also comes with news,1,2016-03-01
1257,"Microsoft to unify PC and Xbox One platforms, ending fixed console hardware",1,2016-03-01
1258,Microsoft ERP Software,1,2016-03-03
1259,Bill Gates reportedly talked Microsoft out of bidding $8 billion for Slack,29,2016-03-04
1260,"Microsoft Surface Book review: power, style and portability",1,2016-03-07
1261,Robot Pepper offers the Microsoft services to be helpful in stores,1,2016-03-08
1262,Microsoft Dynamics Demo,1,2016-03-11
1263,The top 5 inventions seen at Microsoft Israel R&D’s 25th anniversary event,0,2016-03-14
1264,Snowden: “I Used Free And Open Source Software Like Debian And TOR. I Didn’t Trust Microsoft”,1,2016-03-21
1265,Billionaire Microsoft co-founder Paul Allen donates $100 million for ‘frontiers of bioscience’ research,17,2016-03-24
1266,Microsoft terminates its Tay AI chatbot after she turns into a Nazi,8,2016-03-24
1267,Microsoft is deleting its AI chatbot's incredibly racist tweets,5,2016-03-24
1268,"Microsoft AI goes rogue on twitter. ""Supports genocide""",57,2016-03-24
1269,"After racist tweets, Microsoft muzzles teen chat bot Tay",0,2016-03-25
1270,Microsoft 'deeply sorry' for racist and sexist tweets by AI chatbot | Technology,8,2016-03-26
1271,Microsoft terminates its Tay AI chatbot after she turns into a Nazi,1,2016-03-26
1272,Microsoft deletes 'teen girl' AI after it became a Hitler-loving sex robot within 24 hours,1,2016-03-26
1273,Romania Jails Ex-Minister Over Microsoft Licenses,9,2016-03-27
1274,Microsoft Live Help | 0x80041015 | Code 3000 | 0x80004005,1,2016-03-29
1275,Windows 10 : Microsoft bows to the Chinese government,1,2016-03-29
1276,Microsoft accidentally revives Teen AI chatbot Tay,4,2016-03-30
1277,Microsoft Dynamics CRM 2016,1,2016-03-30
1278,Microsoft Tells Possible Yahoo Buyers It Would Consider Backing Bids With Big Bucks,1,2016-03-30
1279,Call us Microsoft office-@-888-352-9606-@-phone number microsoft office Customer support number microsoft office number support............Helpdeskii microsoft office 888*352*9606**office tech support phone number Outlook 365 tech support here.,1,2016-03-31
1280,"Four of the biggest tech companies on the planet — Apple, Google, Microsoft and Amazon — all officially pledged their support for the Environmental Protection Agency's embattled Clean Power Plan on Friday, calling for carbon emissions from power plants to be reduced.",1,2016-04-01
1281,Download Windows 10 ISO Images Direct From Microsoft,1,2016-04-13
1282,Microsoft sues US government over secret data requests,141,2016-04-14
1283,Microsoft sues U.S. government over data requests,1,2016-04-15
1284,Researchers Crack Microsoft and Google’s Shortened URLs to Spy on People,1,2016-04-15
1285,"Microsoft, Apple dig in for long data-privacy fight with US",1,2016-04-15
1286,Breaking News: Seniors Given a Crash Course on Microsoft Word (Seniors News – 3) – Age With Charm,1,2016-04-16
1287,Sony PlayStation 4 Vs. Microsoft Xbox One - The Newage Console Wars,1,2016-04-15
1288,Computers & Technology :: Comparing the Microsoft Xbox 360 Kinect With the Nintendo Wii,1,2016-04-16
1289,Microsoft helps small businesses to become more productive,1,2016-04-21
1290,Microsoft Windows hurt by PC sales slump,0,2016-04-21
1291,Microsoft and Google Agree to Drop Mutual Complaints,1,2016-04-23
1292,"Google And Microsoft Settle Patent Infringement Feuds, Agree To Not File Future Cases With Regulators",1,2016-04-23
1293,Xbox live 3 month and 2100 Microsoft points,1,2016-04-26
1294,Former Senior Vice President at Microsoft reveals Bill Gates's worst decisions as CEO,2,2016-04-27
1295,Twist Bioscience Announces Microsoft Purchase of its Synthetic DNA for Digital Data Storage Research,3,2016-04-29
1296,"WIJ NEDERLANDERS WORDEN GENEGEERD DOOR APPLE, GOOGLE, MICROSOFT EN AMAZON",1,2016-04-28
1297,iPad Pro 9.7 vs. Microsoft Surface Pro 4,1,2016-04-29
1298,Microsoft Unveils New Automation Service Flow,1,2016-04-30
1299,Google and Microsoft have made a pact to protect surveillance capitalism,45,2016-05-02
1300,"Google, Microsoft, and Yahoo passwords were reportedly hacked and should be changed immediately.",35,2016-05-05
1301,Microsoft Dynamics CRM Solutions,1,2016-05-05
1302,Microsoft Research combats VR nausea with inexpensive LED arrays,1,2016-05-05
1303,Microsoft announces the cost of the Windows 10 upgrade.,1,2016-05-06
1304,Microsoft Research anticipates the future with pre-sensing touchscreen prototype,1,2016-05-09
1305,Microsoft gives up on its Chinese web portal - Company's search engine Bing also flopped in China,2,2016-05-10
1306,Microsoft is giving up on its Chinese web portal,0,2016-05-10
1307,Indian state Andhra Pradesh to team up with Microsoft and use machine learning to curb high school dropouts in public schools,3,2016-05-11
1308,"China Discreetly Interrogates Apple, Cisco, and Microsoft About Security",6,2016-05-17
1309,"Apple, Microsoft, Google, Cisco, Oracle hold the most cash: Moody’s report",1,2016-05-21
1310,Microsoft taps startups to improve Internet access worldwide,0,2016-05-24
1311,Microsoft to crack down on content promoting extremist acts [on some of its consumer services.],0,2016-05-24
1312,Microsoft has dealt a massive blow to its phone business—and Finland,42,2016-05-25
1313,Microsoft unethically forcing millions of computers to install Windows 10,5,2016-05-26
1314,"Microsoft, Facebook to lay massive undersea cable",9,2016-05-27
1315,"Facebook, Twitter, YouTube, Microsoft back EU hate speech rules",11,2016-05-31
1316,"Facebook, Twitter, YouTube, Microsoft back EU hate speech rules",3,2016-05-31
1317,"Facebook, Twitter, Google, and Microsoft agree to EU hate speech rules",3,2016-05-31
1318,"Facebook, Twitter, Microsoft and YouTube adopt EU hate speech rules",36,2016-06-01
1319,"Microsoft sells patents to Xiaomi, builds 'long-term partnership'",23,2016-05-31
1320,Microsoft releases first update for Windows Holographic,1,2016-06-01
1321,Increasing the Impact of Microsoft Intranet,1,2016-06-02
1322,"Twitter, Facebook, YouTube and Microsoft sign EU pledge to combat online hate",4,2016-06-03
