,title,score,created
1323,"Last week a whole cadre of social-media sites — including Facebook, Twitter, YouTube, and Microsoft — locked arms with the EU’s European Commission and signed a code promising to suppress “hate speech” wherever it appears.",4,2016-06-07
1324,Alert !! Microsoft is tracking down pirated Windows 7 and 8 users,1,2016-06-07
1325,Microsoft Opens Third Research And Development Center In Israel,3,2016-06-07
1326,Petition to have the EFF investigate Microsoft for malicious practices regarding Windows 10,1,2016-06-08
1327,"CloudOffice, Microsoft Office, CloudCompliance, server hosted virtual desktops",1,2016-06-10
1328,Microsoft to buy LinkedIn for $26.2 billion,15,2016-06-13
1329,Microsoft Buy LinkedIn For $26.2 Billion - News Mats,1,2016-06-13
1330,Microsoft to buy Linkedin for $26bn Cash,1,2016-06-13
1331,Microsoft to Acquire LinkedIn for $26.2 Billion,1,2016-06-13
1332,Microsoft Acquires LinkedIn: A $26 Billion Investment With An Eye on $315 Billion Market,1,2016-06-14
1333,"Microsoft said that it will acquire LinkedIn for an agreed deal sum of $26.2 billion, inclusive of LinkedIn’s net cash. After the acquisition, LinkedIn will retain its distinct ‪#‎brand‬, ‪#‎culture‬ and ‪#‎independence‬, according to a joint statement.",1,2016-06-14
1334,Why Microsoft Likes LinkedIn,1,2016-06-15
1335,The First Big Company to Say It’s Serving the Legal Marijuana Trade? Microsoft.,23,2016-06-16
1336,Microsoft HoloLens Developers Imagine the Future of Holographic Computing,1,2016-06-16
1337,Microsoft Makes a Marijuana Play: the company better known for instigating a mind-expanding number of PowerPoint presentations has thrown in with a Los Angeles start-up to offer software that helps governments monitor sales and commerce in states where pot is sold legally,50,2016-06-17
1338,Microsoft Partners With Cannabis Company,1,2016-06-17
1339,Microsoft could really overtake Apple with this computer,1,2016-06-20
1340,Microsoft shows how bad Chrome is for your laptop's battery -,1,2016-06-20
1341,Microsoft To Halt Surface 3 Production By December,1,2016-06-27
1342,"Microsoft has agreed to pay a Californian woman $10,000 (£7,500) after an automatic Windows 10 update left her computer unusable.",4,2016-06-27
1343,Opera says it crushes Microsoft in browser battery wars,1,2016-07-02
1344,"Monsanto, Microsoft to invest in agricultural technology in Brazil",2,2016-07-04
1345,"India’s top court ordered Google, Yahoo, and Microsoft to ban ads for pre-birth gender tests",1292,2016-07-06
1346,"India's Supreme Court tells Google, Yahoo and Microsoft to stop hosting sex selection ads",14,2016-07-06
1347,Top manager Kevin Turner (Chief Operating Officer) has left Microsoft,1,2016-07-07
1348,"An Indian city is getting futuristic pod taxis to beat traffic blues: Gurgaon, a suburb of New Delhi and home to India headquarters of MNC's like Google, Microsoft and Apple, is about to get driverless electric pods to alleviate traffic woes",229,2016-07-14
1349,Microsoft Stores 200MB of Data on Strands of DNA,88,2016-07-14
1350,"The US government cannot force Microsoft to give authorities access to the firm's servers located in other countries, a court has ruled.",71,2016-07-14
1351,Microsoft wins landmark US appeal over emails stored in Ireland,98,2016-07-14
1352,Microsoft Wins Case to Protect Customer's Private Information Overseas,0,2016-07-15
1353,Major win for Microsoft in 'free for all' data case - BBC News,23,2016-07-18
1354,Microsoft unable to hit the deadline to reach 1 billion devices for Windows 10,5,2016-07-19
1355,Tips on how to Create a Resume Template with Microsoft Word,1,2016-07-19
1356,[Update] Microsoft responds to allegations that Windows 10 collects 'excessive personal data',3,2016-07-21
1357,France tells Microsoft to stop collecting user data,1,2016-07-22
1358,"Microsoft to Cut 2,850 More Jobs in Exit From Phone Business",63,2016-07-28
1359,Windows 10: Microsoft gives users their last chance to upgrade before massive price hike,5,2016-07-29
1360,help microsoft outlook 1-855-416-9995,1,2016-07-29
1361,"Microsoft cuts 3,000 jobs in smartphone division",0,2016-07-30
1362,Windows 10 Anniversary Update: Microsoft rolls out latest edition wooo.,0,2016-08-02
1363,"Microsoft, Sony, and other companies still use illegal warranty-void-if-removed stickers",1,2016-08-07
1364,Microsoft Office 365 for Your Business,1,2016-08-08
1365,Microsoft reduces Windows 10 roll-back grace period,1,2016-08-08
1366,"Space tour guide, a job of the future - What may seem like a job in the realm of science fiction will soon be a reality, according to a new UK report from Microsoft and The Future Laboratory.",3,2016-08-08
1367,"Researchers crack Microsoft feature, say encryption backdoors similarly crackable",11,2016-08-10
1368,"Microsoft inadvertently demonstrates the intrinsic security problem of including a universal backdoor in its software by accidentally leaking its ""golden key""",92,2016-08-12
1369,"Microsoft acquires game-streaming site, will integrate features into its games",3,2016-08-12
1370,"MIT, Microsoft Research create a tattoo that can control your phone",1,2016-08-15
1371,Microsoft Has Broken Millions Of Webcams With Windows 10 Anniversary,1,2016-08-20
1372,"Eighty Silicon Valley companies including Google, Apple and Microsoft sent Dutch Prime Minister Rutte a letter in which they warn for the 'worsening of the Dutch financial climate'",1,2016-08-29
1373,Microsoft apologizes for 'Daesh' (ISIS) translating into 'Saudi Arabia' on Bing,6,2016-08-30
1374,"Kingdom of Fury Microsoft Bing translates Daesh to Saudi Arabia, sparking angry calls for boycott",0,2016-08-31
1375,Microsoft testing blue light reduction feature for Windows 10,11,2016-09-01
1376,Microsoft gets support from US companies,1,2016-09-04
1377,Microsoft gets support in gag order lawsuit from U.S. companies,1,2016-09-04
1378,Microsoft to close Skype's UK office,1,2016-09-17
1379,Microsoft will ‘solve’ cancer within the next 10 years by treating it like a computer virus...,234,2016-09-20
1380,"Google, Microsoft and Yahoo to block ads for selecting the sex of babies in India",0,2016-09-20
1381,"Google, Yahoo, and Microsoft have agreed to block ads for pre-birth gender tests in India",0,2016-09-21
1382,Microsoft is now blocking laptops from installing Linux,20,2016-09-22
1383,Microsoft vow to 'solve' cancer within the decade by 'reprogramming' diseased cells,1,2016-09-22
1384,Microsoft vows to 'solve' cancer within the decade by reprogramming diseased cells,1,2016-09-22
1385,Bill Gates And Microsoft Team Dream Of Solving Cancer Within The Next Decade,1,2016-09-23
1386,Skype can be used for ID check By Utilizing Aadhaar database: Microsoft,1,2016-09-25
1387,Report: Moscow to Ditch Microsoft Products for Local Offerings,16,2016-09-28
1388,"Microsoft commits to 50% renewable energy for data centres by 2018 | has actually powered its global operations, including manufacturing, on 100% clean energy sources since 2014.",13,2016-09-28
1389,Moscow will replace Microsoft Outlook with a state-run email system,11,2016-09-28
1390,Microsoft: Developers will not be forced to support 4k accuracy in their games!,1,2016-09-29
1391,Putin bans Microsoft products from Russia.,24,2016-09-30
1392,Putin Bans Bill Gates and Microsoft from Russia,4,2016-09-30
1393,Microsoft says the Daily Mail should not use its age guessing app to judge child refugees coming to Britain,348,2016-10-19
1394,Microsoft builds world’s first human-like speech recognition system,1,2016-10-19
1395,Microsoft made speech recognition software that's as accurate as humans,1,2016-10-19
1396,Microsoft to show code in Brazil to calm fears about spy 'back doors',2,2016-10-20
1397,"Microsoft shares jump as Cloud, Office lead profits",1,2016-10-21
1398,Microsoft Surface Studio UNBOXING REVIEW SPECS,1,2016-10-26
1399,Introduce Microsoft Surface Studio // Microsoft Surface Studio (Live-Demonstration),1,2016-10-27
1400,Windows 10 Live Event: 10 Inovasi Baru Microsoft,1,2016-10-27
1401,"Microsoft Surface Studio: Màn hình 28-inch, Intel Core i7 - Bài giảng t...",1,2016-10-27
1402,3 Moves Microsoft Is Making to Help Xbox One Beat PlayStation 4,1,2016-10-28
1403,@blessedd77 : https://t.co/LmXCcIfzKg - Ebook Templates For Microsoft Word & Open Office,1,2016-10-31
1404,Technology - Introducing Microsoft Surface Studio,1,2016-11-01
1405,​Apple just handed Microsoft the keys to the kingdom,1,2016-11-01
1406,"Microsoft Corp said that a hacking group linked to the Russian government and U.S. political hacks was behind recent cyber attacks that exploited a newly discovered Windows security flaw. A patch to protect Windows against the newly discovered threat will be released on Nov. 8, Election Day.",19,2016-11-02
1407,"In battle with U.S., Putin's newest target is Microsoft",3,2016-11-02
1408,Microsoft: Hackers try to exploit Windows bug,1,2016-11-02
1409,Tech: How Microsoft Wants to Change the Way You Work,1,2016-11-03
1410,Google melindra Microsoft divulgando falha de segurança.,1,2016-11-04
1411,Ex-Microsoft CEO Steve Ballmer on why he laughed at the iPhone,1,2016-11-05
1412,"Microsoft Offices by PDM International, Suzhou – China",1,2016-11-09
1413,Japanese are confused by Microsoft browser. Declining Microsoft traces the track of IBM and GM,1,2016-11-09
1414,The Microsoft Surface Book is still the best Windows laptop you can buy,1,2016-11-10
1415,Russia Starts Microsoft Antivirus Investigation After Kaspersky Complaint,25,2016-11-12
1416,"Microsoft Forces Windows Defender on Its Users, Had Disabled Third-Party Security Apps: Kaspersky",1,2016-11-14
1417,@ka_kameliatod : https://t.co/mdMkgeH6uC - Ebook Templates For Microsoft Word & Open Office,1,2016-11-16
1418,Microsoft Cache Liberates Your Clipboard,1,2016-11-16
1419,HP And Microsoft Soon To Launch New Window 10 Phone For Consumer’s use,1,2016-11-20
1420,HP And Microsoft Soon To Launch New Window 10 Phone For Consumer’s use,1,2016-11-21
1421,Just Talk To Our Microsoft Technical Support Number Experts @ 1-844-554-7236,1,2016-11-22
1422,How Blind Spots Sink Leaders: 2 Remedies from Microsoft and Rovio To Sustain Your Leadership Edge,1,2016-11-23
1423,Microsoft is working on new Surface Phone with Qualcomm Snapdragon 830 Processor - Gadgets World,1,2016-11-25
1424,Microsoft Is Developing Its Own Quantum Computer,1,2016-11-26
1425,"Microsoft Monday: Solitaire On iOS, Mannequin Challenge Using HoloLens, The 'Ultimate Mobile Device'",1,2016-11-28
1426,"The Microsoft Surface Studio Better Be Reliable, Because It's Difficult And Expensive To Repair",1,2016-11-29
1427,Xbox One to Launch Next Generation of Gaming in China By Microsoft,1,2016-12-02
1428,Microsoft expands its accessibility efforts on Windows 10,1,2016-12-02
1429,IIT-Kanpur student gets Rs 1.5-crore offer from Microsoft - Times of India,0,2016-12-04
1430,Microsoft Highlights Real People Making A Difference To Capture The Holiday Spirit,1,2016-12-05
1431,"Facebook, Microsoft, Twitter and YouTube to work together to create a new database of extremist records",1,2016-12-06
1432,"Facebook, Twitter, Google and Microsoft team up to stop terrorist content",1,2016-12-05
1433,"Facebook, Microsoft, Twitter, and YouTube team up to stop terrorist propaganda",1,2016-12-05
1434,23-year-old Nigerian turned down Microsoft offer to start his own business,1,2016-12-07
1435,Future Tech: Seventeen Microsoft Researchers On The Technology of 2017 And 2027,1,2016-12-07
1436,Finally Microsoft Acquires LinkedIn in $26.2 billion deal,1,2016-12-08
1437,How to Protect a Microsoft Word Document with Password,1,2016-12-14
1438,No one wants to help Donald Trump build a registry of Muslims: Tech giants Microsoft and IBM have said they would refuse to help create a registry of Muslim Americans under Trump's presidency,30072,2016-12-18
1439,Microsoft launches intelligent network for eyecare,1,2016-12-19
1440,Microsoft wins $927 million Pentagon contract: statement,1,2016-12-20
1441,Microsoft can reach $1 tn market value,1,2016-12-27
1442,Microsoft is no longer selling any Lumia Windows phones on its US store,1,2016-12-31
1443,New In Sales & Purchase Setup in Microsoft NAV,1,2017-01-03
1444,ways To Make repair Works To A Microsoft Windows Cell Phone Screen,1,2017-01-04
1445,Web Client Enhancements in Microsoft Dynamics NAV 2017,1,2017-01-05
1446,"Apple is NOT the only tech company kowtowing to China’s censors. LinkedIn, Evernote, Microsoft, have to do the same.",1,2017-01-06
1447,Perfect Use Of Microsoft NAV As An App in Azure,1,2017-01-06
1448,FUCK MICROSOFT AND STEVE JOBS,1,2017-01-06
1449,Best Enhancements for Microsoft Dynamics CRM,1,2017-01-11
1450,"Moderators who had to view child abuse content sue Microsoft, claiming PTSD",1,2017-01-12
1451,Microsoft Dynamics 365 for Operation Benefits,1,2017-01-12
1452,Microsoft staff 'suffering from PTSD' - BBC News,0,2017-01-12
1453,Microsoft Windows 7 is slowly getting old and Support will be discontinued in three years,1,2017-01-15
1454,"Microsoft Says, Windows 10 Game Mode Will Improve Gaming Experience",1,2017-01-15
1455,Microsoft bringing 'Game Mode' to enhance PC gaming experience,1,2017-01-16
1456,Microsoft Dynamics 365 Field Service Automation Webinar,1,2017-01-18
1457,Licensing Options in Microsoft Dynamics CRM,1,2017-01-18
1458,How To Print A Document From Microsoft Word,1,2017-01-19
1459,Surface Phone talks surge throughout the web. Is the Microsoft handset almost here.,1,2017-01-19
1460,Microsoft launches ‘Azure Analysis Services’,1,2017-01-20
1461,Plug-Ins for Microsoft CRM and Their Use,1,2017-01-20
1462,Microsoft may cut 700 jobs this month Report,1,2017-01-21
1463,"Microsoft köper Donya Labs, Amra tar in 80 miljoner och veckans hetaste nyheter.",1,2017-01-21
1464,"Bulan Depan, Microsoft Cabut Dukungan Windows 10 Versi Awal",1,2017-01-22
1465,Brexit: Microsoft is latest major company to threaten to pull business from the UK,54,2017-01-24
1466,What's With Job Queues In Microsoft NAV ?,1,2017-01-24
1467,We're not quitting the UK: Microsoft quashes Brexit fake news,0,2017-01-24
1468,Microsoft to continue to invest over US$1b a year on cyber security,19,2017-01-26
1469,Privacy International: Microsoft is helping Thailand's military government spy on web users,7,2017-01-27
1470,Cloud helps Microsoft log strong second quarter growth,1,2017-01-27
1471,C360 CTI For Microsoft Dynamics CRM,1,2017-01-28
1472,Microsoft Dynamics 365 Project Service Automation - Webinar,1,2017-01-30
1473,Microsoft NAV 2017 For Smart Business,1,2017-01-30
1474,"Amazon, Microsoft and Expedia have backed a legal challenge against Trump's travel ban",102,2017-01-31
1475,"Microsoft, Amazon and Expedia to support lawsuit against Trump immigration order",3016,2017-02-02
1476,"Google, Apple, Facebook and Microsoft draft a joint letter opposing Trump’s travel ban",641,2017-02-03
1477,Microsoft asks for exceptions process in Trump's immigration ban,10,2017-02-03
1478,Why Business Should Have Microsoft CRM,1,2017-02-06
1479,Microsoft NAV 2017 Financial Enhancements,1,2017-02-06
1480,"Apple, Facebook, Microsoft & 94 Other U.S. Tech Companies Oppose President Trump’s Immigration Ban",1,2017-02-06
1481,Microsoft SharePoint App for Windows 10 Mobile,1,2017-02-07
1482,Microsoft Dynamics CRM Features for a CTO,1,2017-02-07
1483,Why Microsoft NAV 2017,1,2017-02-08
1484,Navigation Search in Microsoft Dynamics 365 for Operations,1,2017-02-08
1485,"Microsoft Kicked in $250,000 for Trump's Big Party Before Speaking Out Against Muslim Ban",0,2017-02-08
1486,Microsoft lawsuit vs. secret government searches moves ahead,9,2017-02-09
1487,Telephone Microsoft Dynamics Integration Dubai,1,2017-02-10
1488,"Microsoft must look like everyone, every organisation: Nadella",1,2017-02-12
1489,Microsoft Becomes First Tech Giant to Enter Cannabis Industry,1,2017-02-12
1490,@ralicap1 : https://t.co/vhcW5pc3LL - Ebook Templates For Microsoft Word & Open Office,1,2017-02-13
1491,Developer Preview for Microsoft Dynamics NAV,1,2017-02-13
1492,"Microsoft President Brad Smith on Tuesday pressed the world's governments to form an international body to protect civilians from state-sponsored hacking, saying recent high-profile attacks showed a need for global norms to police government activity in cyberspace",1058,2017-02-14
1493,"Microsoft office setup 2010, 2013, 2016, 365 online office com setup not download",1,2017-02-14
1494,Microsoft seeks ‘Digital Geneva Convention’ on cybercrimes,1,2017-02-15
1495,"What Microsoft, McDonald’s and more brands used from Envato",1,2017-02-17
1496,Microsoft Support Number Australia (1-800-875-393),1,2017-02-18
1497,Google-Microsoft to take initiative against online piracy,2,2017-02-20
1498,Flipkart to use Microsoft cloud to boost e-tail sales,1,2017-02-20
1499,Microsoft and Sonos Will Increase Prices Thanks To Brexit,1,2017-02-20
1500,"America a land of immigrants, says Microsoft CEO",1,2017-02-22
1501,Microsoft Phone Number Australia @ 1-800-875-393,1,2017-02-23
1502,Microsoft Office Training Orlando | 407-880-8447,1,2017-02-26
1503,Business Challenges Solution - Microsoft NAV 2017,1,2017-02-28
1504,"Microsoft, JPMorgan to unveil virtual currency-based systems",1,2017-03-01
1505,"Microsoft House office by DEGW, Milan – Italy",1,2017-03-03
1506,"﻿ Microsoft Penulis Situs , Template Dan berbeda Sumber Daya",1,2017-03-03
1507,Microsoft Help Number Australia 1-800-875-393,1,2017-03-06
1508,"Xbox, Skype, Outlook, and more affected by Microsoft Account issues",1,2017-03-07
1509,CIA turns every Microsoft Windows computer into spyware,1,2017-03-07
1510,"Apple, Samsung and Microsoft react to Wikileaks' CIA dump - BBC News",5,2017-03-08
1511,Microsoft 'Working On' Hotmail Crash Fix,1,2017-03-09
1512,Microsoft Admits Forcing More Users Onto Windows 10,139,2017-03-17
1513,Microsoft (OneDrive/Outlook/etc) services unavailable...,0,2017-03-21
1514,Calgary Microsoft Cloud Services Provider,1,2017-03-22
1515,"CEO Apple, Tim Cook Dapat Surface Pro dari Microsoft",1,2017-03-22
1516,@ralicap1 : https://t.co/vhcW5pc3LL - Ebook Templates For Microsoft Word & Open Office,1,2017-03-23
1517,@blessedd77 : https://t.co/LmXCcIxb8Q - Ebook Templates For Microsoft Word & Open Office,1,2017-03-26
1518,Microsoft delivers secure China-only cut of Windows 10,7,2017-03-26
1519,@ka_kameliatod : https://t.co/mdMkgeH6uC - Ebook Templates For Microsoft Word & Open Office,1,2017-04-02
1520,"In response to laptop ban on flights,Emirates loans out Microsoft Surface tablets",1,2017-04-07
1521,Hackers attacking Microsoft Word users with zero-day bug,1,2017-04-10
1522,How to Get Microsoft Contact Number Australia ( Toll - free - 1-800-875-393),1,2017-04-11
1523,"Flipkart acquires eBay India, raises mega fund from Microsoft, Tencent - News Nation",1,2017-04-11
1524,Microsoft says it has received at least 1000 surveillance requests from US govt in 1H 2016,724,2017-04-15
1525,Microsoft quietly issued patches for NSA's hacking tools,1,2017-04-15
1526,The NSA Leaked Windows Hacks Patched By Microsoft Already!,0,2017-04-15
1527,Microsoft chính thức dừng hỗ trợ hàng loạt smartphone,1,2017-04-16
1528,Microsoft finally says goodbye to Windows Vista (greenapplenews.com),1,2017-04-16
1529,Microsoft biannual transparency report – US foreign intelligence surveillance requests more than doubled,1,2017-04-17
1530,Microsoft đưa xe đua Porsche lên thế giới ảo,1,2017-04-24
1531,Teenager behind Microsoft and Sony hacks jailed for two years,38,2017-04-25
1532,"Microsoft Office by Studio BA, Herzliya – Israel",1,2017-04-25
1533,"Iran-linked hackers used Microsoft Word flaw against Israeli targets, security firm says",5,2017-04-27
1534,"Apple, Google, Microsoft và cuộc chiến máy tính giá rẻ",1,2017-04-30
1535,Dubai becomes first city to get its own Microsoft font,0,2017-05-01
1536,Hackers used Microsoft Word bug 'for months',15,2017-05-02
1537,"Đây là laptop Surface 13,5 inch chạy Windows 10 S của Microsoft?",1,2017-05-02
1538,Microsoft and Apple takes step after Google’s success in US Schools,1,2017-05-03
1539,Microsoft admits Bing has failed on it's own merits. Tries to get schools to force Bing use on Children.,3,2017-05-04
1540,Microsoft released Surface Laptop. Read what Microsoft added to beat ChromeBook.,1,2017-05-05
1541,"Microsoft Patents Technology to Block Pirated Content, Track Repeat Offenders",17,2017-05-05
1542,Vì sao Apple không thể xem nhẹ Surface Laptop của Microsoft?,1,2017-05-09
1543,"Microsoft Dynamics AX, NAV and GP Integrations Services in India.",1,2017-05-11
1544,KMSpico Download For Windows 10 And MicroSoft Office 2013 Pro Plus Activator,1,2017-05-11
1545,How to Remove Browser Hijacker from Microsoft Edge call 1888-311-3841,1,2017-05-11
1546,WannaCrypt ransomware: Microsoft issues emergency patch for Windows XP - Microsoft takes unusual step of providing direct support to unupported systems as targets in 74 countries - including vast swathes of UK hospitals - have been impacted by ransomware attack across the globe,4789,2017-05-13
1547,Security Researcher And Microsoft Worked To Stop Spread Of Cyberattack,11,2017-05-13
1548,Microsoft patches Windows XP to fight 'WannaCrypt' attacks,7,2017-05-13
1549,Gặp nữ kỹ sư Microsoft xinh đẹp chế tạo chiếc vòng đeo mang đến hy vọng cho các bệnh nhân Parkinson,1,2017-05-14
1550,CHOICE Humanitarian partners with Microsoft Edge to launch Accent digital literacy tool,1,2017-05-14
1551,"Microsoft criticizes governments for stockpiling cyber weapons, says attack is 'wake-up call'",3944,2017-05-14
1552,Microsoft president blasts NSA for its role in 'WannaCry' computer ransom attack,389,2017-05-15
1553,"Microsoft: Governments to blame for cyberattack - Microsoft has hit out at governments for ""stockpiling vulnerabilities"", blaming them for the ""widespread damage"" caused by the latest cyberattack.",120,2017-05-15
1554,"Ransomware attack 'like having a Tomahawk missile stolen', says Microsoft boss",85,2017-05-16
1555,Protect Against WannaCry: Microsoft Issues Patch for Unsupported Windows,1,2017-05-16
1556,Microsoft Releases Patches for WannaCry Ransomware,1,2017-05-17
1557,@ka_kameliatod : https://t.co/mdMkgeH6uC - Ebook Templates For Microsoft Word & Open Office,1,2017-05-17
1558,Wikileaks releases Vault 7 -Athena - Which provides remote beacon and loader capabilities on target computers running the Microsoft Windows operating system,7,2017-05-19
1559,WikiLeaks’ series of #Vault7 leaks was released Friday detailing malware that provides remote beacon and loader capabilities on target computers using several Microsoft Windows operating systems,1,2017-05-19
1560,Microsoft says this Chinese ‘gaming service’ company is hacking Xbox accounts,6,2017-05-23
1561,Microsoft made a version of Windows 10 for the Chinese government,26,2017-05-23
1562,Microsoft Complaints: Chinese ‘Gaming Service’ Firm Hacking Xbox Accounts,1,2017-05-24
1563,"Microsoft ra máy tính bảng Surface Pro mới, pin lên tới 13,5 tiếng",1,2017-05-24
1564,"New Microsoft MS17-010 Vulnerability Ransomware 'EternalRocks' Discovered, DoomsDay Worm",6,2017-05-24
1565,Microsoft CEO tech sector needs to prevent ‘1984’ future,1,2017-05-26
1566,"Microsoft Outlook is suffering a global outage, with Australia the worst hit",11,2017-05-31
1567,Microsoft billionaire unveils huge 'Stratolaunch' aircraft with two cockpits and a wingspan longer than a FOOTBALL FIELD that is designed to launch satellites into orbit,5,2017-06-01
1568,Microsoft will PAY you to switch from Google to Bing from TODAY,1,2017-06-01
1569,World’s biggest ever airplane unveiled by Microsoft co-founder,32,2017-06-02
1570,Windows 10 blunder - If you get this update from Microsoft DON'T install it,1,2017-06-02
1571,First ever project to have Microsoft bow down to it,1,2017-06-02
1572,Kaspersky files antitrust complaints against Microsoft in Europe,8,2017-06-06
1573,"Windows firewall dodged by 'hot-patching' spies using Intel AMT, says Microsoft",4,2017-06-08
1574,"Bị Apple copy lại chính xác công thức của mình, Microsoft đã có cách đáp trả không thể khôi hài và thông minh hơn",1,2017-06-09
1575,Extreme manual for more older Office applications: Microsoft cheat sheets,1,2017-06-10
1576,"Microsoft unveils powerful Xbox One X, global launch on Nov 7 : Features, News",1,2017-06-12
1577,Microsoft unveils new features to insiders for their windows 10 creator fall update on build 16215,1,2017-06-12
1578,Rò rỉ hình ảnh máy tính bảng có thể gập lại của Microsoft,1,2017-06-13
1579,WannaCry attacks prompt Microsoft to release Windows updates for older versions | Technology,7,2017-06-14
1580,New Windows XP Security Patches Released by Microsoft Releases,1,2017-06-14
1581,Microsoft AI first to reach perfect Ms Pac-Man score,8,2017-06-15
1582,@blessedd77 : https://t.co/LmXCcIxb8Q - Ebook Templates For Microsoft Word & Open Office,1,2017-06-14
1583,"All about money - Here’s how Apple, Google, Microsoft make money",11,2017-06-16
1584,Microsoft phát hành bản cập nhật mới ‘vá lỗi’ Windows XP,1,2017-06-16
1585,Bàn phím mới của Microsoft tích hợp cảm biến vân tay,1,2017-06-17
1586,Microsoft and Accenture Unveil Global ID System for Refugees,7,2017-06-19
1587,SketchUp Viewer Microsoft HoloLens brings mixed reality of life in Architecture and Design,1,2017-06-20
1588,Microsoft Phone Number Australia @ 1-800-875-393 (Toll-Free) 24 x 7,1,2017-06-22
1589,Apple tạo ra iPad vì Steve Jobs “ghét” một giám đốc của Microsoft,1,2017-06-21
1590,"Telangana: Largest realty scam in Telangana worth Rs 15,000 crore; Google, Microsoft also affected",1,2017-06-26
1591,"Facebook, Twitter, YouTube and Microsoft form anti-terrorism forum",2,2017-06-27
1592,'Petya' Ransomware Hits At Least 65 Countries; Microsoft Traces It To Tax Software,8,2017-06-28
