,title,score,created
532,Microsoft accused of handing NSA access to encrypted messages,1,2013-07-13
533,About.com: Windows 8 Versions of Classic Microsoft Games,0,2013-07-14
534,"AOL, Google, Microsoft, Yahoo agree on industry code to combat piracy, counterfeiting",1,2013-07-15
535,Microsoft Word Free Download,1,2013-07-15
536,NSA surveillance: a timeline of false Skype & Microsoft claims and their actual private gov't dealings,1,2013-07-15
537,Microsoft calls for the US Attorney General to start upholding the Constitution,1578,2013-07-16
538,Microsoft wants US to let it speak more freely about NSA data sharing,4,2013-07-17
539,Microsoft Tells The Obama Administration: 'The Constitution Is Suffering' Under PRISM,2,2013-07-17
540,Microsoft to US Attorney General: ‘Uphold the constitution' over NSA data requests,1,2013-07-17
541,"Close to two-dozen technology firms, including AOL, Apple, Facebook, Google, Microsoft, and Yahoo, have signed a letter to the U.S. government urging greater transparency in the wake of the National Security Agency's PRISM spying scandal.",0,2013-07-19
542,Learn about Microsoft Gold Certified Partner myGPcloud.com and their hosted Dynamics GP accounting platform.,1,2013-07-23
543,"comScore's Top 50 U.S. Web Properties in June - Google, Yahoo, Microsoft, Facebook, AOL & others in the List",1,2013-07-25
544,Microsoft Office for Mac promotion code available only at MigenBlog,1,2013-08-01
545,BBC News - Microsoft made to rename Skydrive,0,2013-08-01
546,Microsoft office 2010,1,2013-08-01
547,"Russian ‘SOPA’ Anti-Piracy Body Under Investigation For Software Piracy -- ""Pirated software from Adobe, Microsoft, Corel and Autodesk was found on their machines""",401,2013-08-03
548,Microsoft Office Comes to Android Mobile Phone,1,2013-08-03
549,"Информация о про internet explorer 8, 9, 10, 11, 12. Internet Explorer - всегда первый. Новости от Microsoft",1,2013-08-05
550,"Microsoft Indian guy raped janitor, then claiming the victim forced him to have sex with her",2,2013-08-06
551,"Mise en forme Excel cours et exercice | Cours, Exercices et QCM Sur Microsoft Excel",1,2013-08-06
552,Microsoft Excel Training Courses,1,2013-08-07
553,UK teen crowned world Microsoft Word 2007 champion. A student at Sawtry Community College in Cambridgeshire has become world champion at using Microsoft Word 2007.,0,2013-08-07
554,"Snowden: ""Google, Facebook, Microsoft, Yahoo, Apple, and the rest of our internet titans must ask themselves why they aren't fighting for our interests the same way""",2669,2013-08-09
555,Plane Crash Killls Microsoft Ex VP,1,2013-08-09
556,Microsoft by the Numbers,2,2013-08-14
557,Free Xbox Live - Free Microsoft Points!,1,2013-08-17
558,"Microsoft announced today that it is has launched a new Bing Homepage App for Facebook, and is kicking off a contest (part of a partnership with Discovery) for photographers to get their photos feature on the search engine’s homepage.",1,2013-08-20
559,"Report: Microsoft Bribe Investigation Extends to Russia, Pakistan",9,2013-08-22
560,"German govt leak: Windows 8 contains backdoor to Microsoft, NSA, China",2,2013-08-23
561,Ballmer Announces Retirement From Microsoft,1,2013-08-23
562,Steven Ballmer leaves Microsoft,0,2013-08-23
563,India-born executive could be next Microsoft CEO,4,2013-08-24
564,Steve Ballmer Microsoft CEO Has Officially Announced his Retirement,0,2013-08-26
565,Information That You Should Find Out Regarding Microsoft Project Software,24,2013-08-27
566,Steve Ballmer Microsoft Legend to step down as CEO,0,2013-08-27
567,"US won’t let Microsoft, Google reveal more data on FISA orders",444,2013-08-30
568,Google and Microsoft sue U.S government,2,2013-08-30
569,Standing Together for Greater Transparency - Microsoft and Google team up to fight US gov,1,2013-08-30
570,Microsoft and Google to sue over US surveillance requests; escalating legal battle with gov’t as firms want to be allowed to publish information about US demands under FISA,61,2013-08-31
571,NSA Surveillance: Google and Microsoft fail to U.S. Government,1,2013-08-31
572,"Microsoft, Google to sue US government over right to reveal more information on surveillance requests.",0,2013-09-01
573,Microsoft to acquire Nokia,97,2013-09-02
574,Microsoft buy Nokia's handset business for $7.2 billion,7,2013-09-03
575,Microsoft to buy Nokia for 5.44 billion euros (7.7 billion usd),6,2013-09-03
576,NOKIA PATENT MOVE MAY MEAN BIG PAYOFF POST MICROSOFT,1,2013-09-03
577,Nokia's handset business bought by Microsoft for €5.44bn,0,2013-09-04
578,Microsoft lync training| conference call service| Video conferencing,1,2013-09-06
579,Microsoft and Yahoo voice alarm over NSA's assault on internet encryption,1,2013-09-06
580,Blackberry drools as Microsoft acquires Nokia,1,2013-09-05
581,Microsoft and Yahoo voice alarm over NSA's assault on internet encryption | World news,1,2013-09-07
582,Developers force Microsoft to release Windows 8.1 early,3,2013-09-10
583,"Google, Microsoft, Facebook and Yahoo file motions to reveal NSA data requests",1,2013-09-10
584,Nokia opens its gates to Microsoft,1,2013-09-12
585,"MSPA (Microsoft Paint Adventures) Hacked, Showing Hatred Towards American Society, Government, and Military",0,2013-09-12
586,"Amazing Secrets, Using Microsoft...",1,2013-09-14
587,Microsoft seeks to increase value in stock by buying back $40bn of shares,6,2013-09-18
588,"Microsoft, Nokia, Oracle & al. argue to European Commission, that open source software's null price constitutes ""predatory pricing""",13,2013-09-19
589,Nokia’s Former Chief to Collect $25.5 Million From Microsoft Deal,2,2013-09-19
590,Microsoft – Among the Largest and the Best,0,2013-09-19
591,"Microsoft too slow on phones, admits boss Steve Ballmer",1,2013-09-24
592,"Microsoft Office 2013, Office 2010, Office 2007, Windows 8, Windows 7 Download Online Shop",0,2013-09-27
593,Microsoft joins existing appwinkels,0,2013-09-28
594,"Ex-Microsoft privacy chief: I don't trust Microsoft after NSA revelations, says he was unaware of Prism data-sharing program when he worked there",2813,2013-09-30
595,Former Microsoft Privacy Chief Says He No Longer Trusts The Company - HotHardware,4,2013-10-01
596,"Apple, Google, Microsoft, and others back NSA and FBI transparency bills",3,2013-09-30
597,Delta buys Microsoft Surface 2 for pilots to save $13M in fuel,2,2013-10-01
598,Exclusive: Microsoft investors push for chairman Gates to step down,4,2013-10-02
599,Major Microsoft Investors Want Bill Gates Out as Chairman,3,2013-10-02
600,"Co-founder of Microsoft, Bill Gates asked to step down as Chairman",1,2013-10-03
601,Microsoft investors push for chairman Gates to step down,0,2013-10-04
602,"Protests against a plan to split a southern Indian state entered a fourth day, leaving about 21 million people without electricity as outages threatened to affect technology companies like Google Inc. (GOOG) and Microsoft (MSFT) Corp.",4,2013-10-10
603,Microsoft covers Brit who penetrated Windows 8.1 with GOLD,0,2013-10-09
604,Microsoft handed the NSA access to encrypted messages | World news,173,2013-10-11
605,Manny360: 9-year-old Boy Emerges Nigeria's Youngest Microsoft Certified Professional,1,2013-10-11
606,"Google, Microsoft, Facebook and Yahoo have made a last minute plea to the New Zealand Government not to pass new spy legislation that they say could present them with a ""serious legal conflict""",56,2013-10-14
607,Microsoft Asked by EU Privacy Watchdogs to ‘Improve’ Policies,2,2013-10-14
608,Brazilian government to ditch Microsoft in favour of bespoke email system,335,2013-10-15
609,"New Zealand PRISM law will not exempt Google, Microsoft, Facebook and Yahoo",5,2013-10-16
610,Microsoft Yanks Windows RT 8.1 Update “Temporarily” Following Discovery Of A “Situation”,2,2013-10-19
611,Like Millions around the world! Do you really HATE Microsoft SKYPE? Here is a list of 7 Fantastic Free Online Instant Messengers,1,2013-10-20
612,Microsoft pulls Windows update to fix problems,0,2013-10-22
613,Get Microsoft Promo Code,1,2013-10-22
614,"Google, Microsoft Threaten End to Cookie Tracking",211,2013-10-29
615,"Six leading technology companies - Facebook, Google, Apple, Yahoo, Microsoft and AOL - call for new restraints on NSA",11,2013-10-31
616,"New Zealand Dismisses Concerns of Goggle, Yahoo, Facebook, Microsoft with New Telecommunications Bill",2,2013-11-05
617,Microsoft warns users of hacker attacks,4,2013-11-06
618,Microsoft offers quick fix for Zero-Day vulnerability,1,2013-11-07
619,Microsoft trata de quitarle usuarios a Gmail,1,2013-11-10
620,Microsoft Sharepoint Developer in Trivandrum RM ESI Technopark Jobs,0,2013-11-12
621,"Facebook and Microsoft help fund rightwing lobby network, report finds",8,2013-11-14
622,Microsoft Admits Its Datacenters Are Wide Open To NSA Attacks,481,2013-11-15
623,"Microsoft, Skype, and Xbox Being Used To Spy",16,2013-11-15
624,"Philanthropist and Microsoft co-founder Bill Gates called on Norway's $800 billion oil fund, one of the biggest investors in the world, to spend more in the poorest countries, gaining the prime minister's support with his proposal.",12,2013-11-15
625,"Watch this: EU MEP Rips into Microsoft, Google and Facebook Legal Representatives at the NSA Mass Surveillance Inquiry",1,2013-11-17
626,Google and Microsoft agree measures to block abuse images,3,2013-11-17
627,Hundreds of Chinese workers protest after Microsoft Nokia deal,5,2013-11-20
628,Hundreds of workers shouted slogans outside a Nokia factory in southern China to protest against what they called unfair compensation after the company sold its mobile telephones business to Microsoft Corp,1,2013-11-20
629,Nokia shareholders embrace $7.2B Microsoft deal,0,2013-11-20
630,Microsoft makes arrangements for better hardware development,2,2013-11-20
631,Smartwatch by Microsoft has transparent Aluminum,3,2013-11-22
632,Microsoft to win EU okay for $7.3 billion Nokia deal,3,2013-11-23
633,Surface Pro by Microsoft gets down by $100,0,2013-11-23
634,Microsoft launch Anti Google Merchandise Near Holiday Season,0,2013-11-23
635,Microsoft Sells More Than 1 Million Xbox Ones In The First 24 Hours,1,2013-11-24
636,Microsoft informs to introduce a new tiny and a cheaper tablet soon,0,2013-11-25
637,"Microsoft, HURTING after NSA backdooring, will now harden own pipe",145,2013-11-28
638,"Microsoft is moving toward a major new effort to encrypt its Internet traffic amid fears that the National Security Agency may have broken into its global communications links, said people familiar with the emerging plans.",11,2013-11-28
639,Microsoft 4Afrika Internship Jobs - .@Phuzemthonjeni,1,2013-11-28
640,"Frech Court Orders Google, Microsoft & Yahoo to Make Pirate Sites Disappear",4,2013-11-29
641,Give the gift of education with Microsoft Excel Training With Certificate,0,2013-11-30
642,U.S. approves Microsoft purchase of Nokia's mobile business,0,2013-12-03
643,Microsoft researchers have designed a Smart Bra,2,2013-12-04
644,Brussels agreement with Microsoft-Nokia deal,1,2013-12-04
645,Microsoft likens government snooping to cyber attacks,50,2013-12-05
646,Microsoft moves to assure international business customers on spying,6,2013-12-05
647,Microsoft likens government snooping to cyber attacks,2,2013-12-05
648,Microsoft brands governments a 'persistent threat' alongside malware and cyber attacks,283,2013-12-06
649,New York Time Reports Microsoft Office Killing Google Docs,0,2013-12-06
650,UK citizen sues Microsoft over Prism private data leak to NSA,1713,2013-12-06
651,"AT&T wants to silence a shareholder proposal that asks for it to disclose the government requests it receives for customer information, rejecting a step that Google, Microsoft and other Internet companies have already taken.",10,2013-12-07
652,Microsoft allies with Bango to connect apps via billing,1,2013-12-06
653,Microsoft company battles back against NSA ‘snooping’,1,2013-12-08
654,"Apple, Google, Microsoft, Facebook, Yahoo, LinkedIn, Twitter and AO have united to demand sweeping changes to US surveillance laws and an international ban on bulk collection of data",4312,2013-12-09
655,"Apple, AOL, Facebook, Google, Twitter, LinkedIn, Yahoo and Microsoft whose combined value is $1.4 trillion have addressed Washington in an open letter to demand a radical overhaul of surveillance laws, a ban of bulk data collection and for the US to lead the way in restoring trust in the internet.",21,2013-12-09
656,"Google, Microsoft, Apple Lead Campaign to Limit Government Surveillance",8,2013-12-09
657,Microsoft launches social networking app Socl,1,2013-12-10
658,Microsoft may finally bring back full Start menu with Windows 8.2,0,2013-12-10
659,White House to tap Microsoft exec to fix HealthCare.gov,1,2013-12-18
660,Microsoft needs to do just one more thing to sell me on Xbox One,0,2013-12-18
661,Microsoft: Former manager and a friend charged with insider trading.,3,2013-12-20
662,Microsoft expects CEO appointment early 2014,5,2013-12-23
663,Skype twitter account hacked by Syrian Electronic Army. Tweets that Microsoft is selling user data to governments.,324,2014-01-01
664,"""Don't use Microsoft emails (hotmail, outlook). They are monitoring your accounts and selling the data to the government""",26,2014-01-02
665,Skype's twitter account hacked by Syrian Electronic Army protesting the fact Microsoft sells data to the government.,2,2014-01-02
666,"Bill Gates world's richest person again. Microsoft founder regains top position from Mexican telecoms magnate Carlos Slim, with estimated fortune of $78.5bn.",573,2014-01-02
667,How to reduce Microsoft Security Essentials load on your system,1,2014-01-04
668,"How the NSA Almost Killed the Internet: Google, Facebook, Microsoft, and the other tech titans have had to fight for their lives against their own government. An exclusive look inside their year from hell—and why the Internet will never be the same.",477,2014-01-07
669,Microsoft Dynamics CRM implementation in Gurgaon,1,2014-01-07
670,"China has lifted its longtime ban on video game consoles, opening a lucrative new market for manufacturers including Sony, Nintendo and Microsoft",10,2014-01-08
671,Microsoft Announces 2014 CEO - Acceptance Speech & New Company Direction,1,2014-01-08
672,Syrian Electronic Army Hacks Microsoft Twitter Account,1,2014-01-11
673,Syrian Electronic Army Hacks Microsoft Twitter Account,0,2014-01-11
674,"Microsoft CEO search twists and turns have cost Ballmer, Gates billions",0,2014-01-11
675,Anti-Piracy Boss Jailed Two Years for Drug Trafficking: President of the Lithuanian Anti-Piracy Association LANVA was caught following a sting operation in 2012. The former anti-piracy boss is now unlikely to serve as an expert witness in a Microsoft court case against a local BitTorrent site,4,2014-01-12
676,Microsoft hacked by Syrian Electronic Army again,1,2014-01-11
677,Microsoft reportedly planning Windows 9 release in April 2015,1,2014-01-12
678,Microsoft Ending Anti-Virus Protection for Windows XP,1,2014-01-16
679,Microsoft is prepared to hand over Skype users' data to Russia,10,2014-01-17
680,"Fine! We'll keep updating WinXP's malware sniffer after April, says Microsoft",7,2014-01-16
681,How To Get Microsoft Office Student Discount,1,2014-01-18
682,"It has been exactly two years since Arfa Karim, a Pakistani child prodigy and world's youngest Microsoft Certified Professional, left us.",0,2014-01-19
683,Get free Xbox live gold subscription at Microsoft Office 365,0,2014-01-20
684,Smartwatch by Microsoft has transparent Aluminum,0,2014-01-21
685,Microsoft calls for new international laws on government data access,3,2014-01-22
686,Get free Xbox live gold subscription at Microsoft Office 365,1,2014-01-22
687,Get free Xbox live gold subscription at Microsoft Office 365,0,2014-01-23
688,Get Promo Code For Microsoft Office,1,2014-01-24
689,Microsoft to rename Skydrive after infringement!,2,2014-01-27
690,Microsoft renames SkyDrive to OneDrive - Cyber Kendra,1,2014-01-27
691,Microsoft declared ownership for Nokia Phones,0,2014-01-27
692,"U.S. Relaxes Some Data Disclosure Rules; Google, Microsoft, Yahoo and Facebook to drop their respective lawsuits before the nation’s secret surveillance court",11,2014-01-27
693,Microsoft rules out ‘back door’ access to MPs’ electronic communications | Officials assured that US agencies do not have unauthorised entry to Australian parliamentary IT operating systems,1,2014-01-28
694,"Larry King to Help Form Israel’s Silicon Valley Chambers of Commerce - Companies such as Intel, IBM, Microsoft and Yahoo have established offices around the Technion, recruiting students and turning the area into a “second silicon valley.”",1,2014-01-27
695,UK government plans switch to open source from Microsoft Office suite. Cabinet Office minister Francis Maude plans to standardise on open formats to cut costs on Office suite and break 'oligopoly' of IT suppliers,295,2014-01-29
696,Get free Xbox live gold subscription at Microsoft Office 365,0,2014-01-29
697,Smartwatch by Microsoft has transparent Aluminum,0,2014-01-29
698,Angola will face Imagine Cup Contest developed by microsoft,1,2014-01-29
699,"Microsoft ready to name Satya Nadella new CEO, report says. Also, board may decide to replace Bill Gates as chairman.",0,2014-01-30
700,Bill Gates Stepping Down as Chairman of Microsoft,0,2014-01-30
701,"Microsoft, Facebook, Google and Yahoo release US surveillance requests",1,2014-02-03
702,"""Microsoft names Satya Nadella CEO"" (BUSINESS INSIDER)",68,2014-02-04
703,"Web companies Facebook, Microsoft, Yahoo and Google give first look at secret government data requests 'FISA'",58,2014-02-04
704,Microsoft names their new CEO,1,2014-02-04
705,"Microsoft announces Indian-origin cloud chief Satya Nadella new CEO , AniNews.in",1,2014-02-05
706,Satya Nadella is the New Chairman of Microsoft Company,0,2014-02-05
707,Satya's first Interview as the CEO of Microsoft,1,2014-02-06
708,"Goggle, Facebook, Microsoft Recuited the First anti-NSA lobbyist",1,2014-02-08
709,Smartwatch by Microsoft has transparent Aluminum,0,2014-02-08
710,Microsoft and Hotmail merger in 1998 is dubbed a disaster,0,2014-02-11
711,Bing censoring Chinese language search results for users in the US in the same way it filters results in mainland China - English and Chinese language queries for terms such as ‘Dalai Lama’ return radically different results on Microsoft search engine,1026,2014-02-11
712,Microsoft denies censoring results in the ‘uncensored’ version of Chinese-language Bing,0,2014-02-12
713,Microsoft denies censoring results in the ‘uncensored’ version of Chinese-language Bing,2,2014-02-13
714,Jason Holtman leaves Microsoft,1,2014-02-15
715,The Other MIT: Microsoft CEO's Alma Mater in India,1,2014-02-18
716,Microsoft OneDrive available Worldwide,1,2014-02-19
717,MICROSOFT OFFICE 2013,1,2014-02-21
718,New CEO Microsoft wants culture change,1,2014-02-21
719,Best Microsoft Store Coupon Codes,1,2014-02-22
720,“Microsoft wants to share in Dailymotion ‘,1,2014-02-25
721,Microsoft doubts about using the name Nokia,1,2014-02-26
722,Microsoft Office 2010 Product Key Generator,0,2014-02-27
723,GCHQ identified Kinect as possible snooping tool; Microsoft denies all knowledge,165,2014-02-28
724,Microsoft has responded to fresh claims published in The Guardian this morning that UK spies contemplated using Kinect for surveillance.,10,2014-02-28
725,Microsoft Office 2013 Product Key Generator,0,2014-02-27
726,It’s Official: Microsoft Is Going Down | Teckler,1,2014-03-03
727,MICROSOFT POINTS GENERADOR,1,2014-03-02
728,Microsoft reveals standalone OneDrive for Business cloud storage plans,1,2014-03-04
729,Microsoft Office 2011 MAC Key Generator,0,2014-03-04
730,Microsoft Office 2011 MAC Product Key Generator,0,2014-03-04
731,Microsoft Office 2011 MAC Key Generator,0,2014-03-04
732,Microsoft Office 2011 MAC Product Key Generator,1,2014-03-10
733,Microsoft Fights Against UK Government's Move Towards Open-Source Office Suites,0,2014-03-11
734,Next Microsoft Office for Mac update slated for this year,1,2014-03-12
735,Microsoft Office 2011 MAC Product Key Generator,0,2014-03-11
736,"Microsoft plunges into mobile war, Google exits",1,2014-03-13
737,Microsoft Office 2013 Product Key Generator,0,2014-03-13
738,"US Companies Stashing $1.95 Trillion In Profits Overseas; tech companies such as Microsoft, Apple and IBM among the worst offenders.",1691,2014-03-15
739,Microsoft provides Window-Eyes screen reader to Office users for free,0,2014-03-14
740,Microsoft to launch low-cost Windows tablets,0,2014-03-16
741,Bill Gates: Microsoft also wanted to buy WhatsApp,1,2014-03-17
742,Indian managers demand $573m in Nokia-Microsoft factory selloff deal,0,2014-03-17
743,Microsoft Office 2013 Professional Plus x32 / x64 / x86 Pre Activated Download,1,2014-03-18
744,"It's Been Exactly 29 Years Since Earth Had a Colder-Than-Average Month. The last cooler-than-average month (based on a 1961 to 1990 average) on a global level was February of 1985, the year the first version of Microsoft Windows was released and the first Back to the Future film hit theaters.",13,2014-03-19
745,Highly Compressed Microsoft Windows 7 Full Activated Genuine Version Free Download,1,2014-03-19
746,Microsoft employee arrested for leaking copies of Windows 8,1,2014-03-20
747,Ex-Microsoft employee arrested for leaking copies of Windows 8 - Cyber Kendra,1,2014-03-20
748,Microsoft sells your Information to FBI; Syrian Electronic Army leaks Invoices,3538,2014-03-21
749,Microsoft Defends Its Right To Read Your Emails,102,2014-03-21
750,Microsoft sells your Information to FBI; Syrian Electronic Army leaks Invoices - Cyber Kendra,1,2014-03-21
751,Microsoft defends its right to read your email,3,2014-03-21
752,"Microsoft Selling User Data to FBI, Syrian Electronic Army Released Invoices",1,2014-03-21
753,Becoming Microsoft CEO beyond wildest dreams: Satya Nadella,0,2014-03-22
754,Microsoft is defending its right to break into customers' accounts and read their emails.,1275,2014-03-23
755,"Busted: BSA Steals Photo For ""Snitch On a Pirate"" Campaign | The Business Software Alliance, a trade group representing Adobe, Apple and Microsoft, has been caught using a ""stolen"" photo in one of their anti-piracy campaigns.",484,2014-03-22
756,Nokia takeover by Microsoft nearly round,1,2014-03-24
757,Microsoft Expects to Close Nokia Deal in April - Cyber Kendra,1,2014-03-24
758,Microsoft to rebrand 'Windows Azure' as 'Microsoft Azure',0,2014-03-25
759,Microsoft Word Is Under A Hack Attack: Do Not Open Documents Named '.RTF',1596,2014-03-26
760,How to Create Hotmail or Microsoft Account | Learn Social Media Basics,1,2014-03-26
761,Vulnerability on Microsoft Word Could Allow Remote Code Execution,1,2014-03-26
762,Cortana: Microsoft Virtual Assistant For Windows 8.1 - Cyber Kendra,1,2014-04-02
763,Microsoft Plans to bring Windows to robots,1,2014-04-02
764,"Microsoft to offer Windows for free on phones, tablets",1,2014-04-03
765,"Microsoft to offer Windows for free on phones, tablets",1,2014-04-02
766,Microsoft Will Soon Bring Back The Start Menu In Windows 8.1 - Cyber Kendra,1,2014-04-04
767,Dutch government pays millions to extend Microsoft XP support,2,2014-04-07
768,"Techwellwish: Microsoft Slips In Fortunes Most Admired Firms List, Apple Tops",1,2014-04-07
769,RIP Windows XP - Microsoft Says Goodbye and Good Riddance to Creaking OS,0,2014-04-08
770,Microsoft says goodbye to Windows XP operating system,0,2014-04-08
771,"IRS tastes its own medicine, will pay Microsoft millions for Windows XP support",1,2014-04-13
772,MICROSOFT OFFICE 2010 PRO PLUS CLAVE DEL PRODUCTO GENERADOR,1,2014-04-20
773,"Free Course Offered By Microsoft Academy ""HTML5 + CSS3 + JavaScript""",1,2014-04-22
774,Microsoft has developed a competitor to Apple's Siri.,0,2014-04-23
775,A look back at iconic Nokia phones .Rumors are coming that Nokia is going to dead and Microsoft mobile in substitute of It.But here is the collection of Nokia Iconic phones.It leads me to Past.Some Nokia phones among these I never seen even,1,2014-04-25
776,Microsoft coming up with special device for price and tech savvies,1,2014-04-25
777,Microsoft Is Challenging The US Government’s Use Of Search Warrants To Access Data Stored Abroad,14,2014-04-26
778,U.S. judge rules search warrants extend to overseas email accounts (Microsoft & Google),12,2014-04-25
779,US judge rules US digital search warrants apply to foreign-based data centers and other nations must comply (Azure looking less lovely as Microsoft ordered to hand over e-mails held in Dublin).,64,2014-04-28
780,"A US judge orders Microsoft to hand over a customer's emails, even though the data is held on a server in Ireland.",6,2014-04-28
781,Microsoft warns of Internet Explorer security gap,1,2014-04-28
782,After Satya Nadella(CEO Microsoft)Finnish technology giant Nokia on Tuesday named India-born Rajeev Suri as its chief executive officer (CEO),1,2014-04-30
783,Internet Explorer security bug fix released by Microsoft,7,2014-05-01
784,Microsoft Tells IE Users about Zero-Day Bug,1,2014-05-01
785,Microsoft Security Essential Update Free Download,1,2014-05-01
786,"Popular login services have a security hole, but Facebook and Microsoft can't fix it",1,2014-05-02
787,"Facebook, Google, Microsoft, Apple Routinely Notify Users On Government Request - Cyber Kendra",1,2014-05-02
788,"Microsoft avslutar stöd för XP, nu vad nästa?",1,2014-05-02
789,Microsoft Fixes IE Bug-Windows XP Included,1,2014-05-03
790,"Amazon, Facebook, Google, Microsoft, Twitter Defending Net Neutrality!",1,2014-05-07
791,Microsoft Windows Build Developers Conference Dubai 2014,1,2014-05-12
792,Microsoft Windows Phone 8.1 Update Offers Cortana,1,2014-05-12
793,Microsoft Highlights Several New Features for Windows and Windows Phone 8.1,1,2014-05-13
794,"Microsoft slashes Xbox price, frees up Netflix and other popular apps",1,2014-05-13
