,title,score,created
0,"Apple, the world's most profitable firm, has a secretive new structure allowing it to continue avoiding billions in taxes, Paradise Papers show. They sidestepped a 2013 crackdown by actively shopping around for a tax haven, landing $252bn on the Channel Island of Jersey.",105813,2017-11-06
1,"Shouting ‘pay your taxes,’ activists occupy Apple retail stores across France",47138,2017-12-02
2,"Apple sold $4.2 billion of product in New Zealand, paid $0 local taxes. “Their tax department is even more innovative than their product designers.”",45822,2017-03-21
3,"Apple co-founder Steve Wozniak says the NSA whistleblower “gave up his own life . . . to help the rest of us"".",40412,2015-05-26
4,"Apple blocking ads that follow users around web is 'sabotage', says industry: New iOS 11 and macOS High Sierra will stop ads following Safari users, prompting open letter claiming Apple is destroying internet’s economic model",39023,2017-09-18
5,Saudi journalist recorded his own torture and murder on Apple Watch,35516,2018-10-13
6,Apple pledges to stop mining raw materials and use 100% reusable material,35275,2017-04-19
7,Apple and Samsung fined for deliberately slowing down phones,33439,2018-10-24
8,"Apple recovered 2,204 pounds of gold from broken iPhones last year",30160,2016-04-16
9,Apple wants the FBI to reveal how it hacked the San Bernardino killer's iPhone,30093,2016-03-29
10,"No. 1 paid utility in Apple's App Store steals browser history, sends it to Chinese server",29273,2018-09-07
11,Apple hit with $118m ‘back tax’ payment in Japan,26536,2016-09-16
12,Apple: 'FBI could force us to turn on iPhone cameras and microphones',22419,2016-03-10
13,"'Intentional' event redirects cloud traffic from Apple, Google & others through Russia: Internet traffic coming into and out of Apple, Facebook, Google, Microsoft, and other companies was briefly redirected through a Russian provider on Wednesday, in what appears to have been a deliberate move.",20737,2017-12-14
14,Apple hit with class action suit in Israel for deliberately slowing older iPhones,18398,2017-12-25
15,"'Complete control': Apple accused of overpricing, restricting device repairs",14504,2018-10-21
16,Apple CEO Tim Cook promises to investigate the 'abhorrent' Saudi Arabian app that allows men to track women,11863,2019-02-13
17,An app which tracked US drone strikes through text notifications and maps has been removed from the App Store by Apple due to “excessively crude or objectionable content”,8443,2015-09-29
18,"France will tax Google, Apple, Facebook, and Amazon starting Jan. 1",7716,2018-12-17
19,"Apple is failing to protect workers in Chinese factories, according to an undercover BBC investigation. Exhausted workers were filmed falling asleep on their 12-hour shifts at a Shanghai factory. One employee had to work 18 days in a row despite repeated requests for a day off.",7477,2014-12-18
20,"French prosecutors have launched a probe over allegations of ""planned obsolescence"" in Apple's iPhone. Under French law it is a crime to intentionally shorten lifespan of a product with the aim of making customers replace it.",7179,2018-01-08
21,Apple pays France €500 million to cover a decade of back taxes,6850,2019-02-06
22,Apple may be on the hook for $8 billion in taxes as a result of a European Commission investigation.,6751,2016-01-15
23,"Tech giants including Google, Apple and Amazon will for first time face rules governing their commercial relations with smaller businesses under law proposed by EU...new rules will require them to be more transparent about how they rank search results and why they delist some services.",6258,2018-04-29
24,"Apple is cutting down on how many cookies advertisers can force on to your devices, with changes coming to iPhones, iPads and Macs. The advertisers, naturally, are not happy",6245,2017-09-20
25,Europe hits Apple with $14.6 billion tax bill,5969,2016-08-30
26,Apple 'should repay Ireland 13bn euros' European Commission rules,5960,2016-08-30
27,"Facebook reportedly gave personal data to 60 companies including Apple, Amazon and Samsung",5367,2018-06-04
28,Spotify files EU antitrust complaint against Apple,4434,2019-03-13
29,"Apple, Google, Microsoft, Facebook, Yahoo, LinkedIn, Twitter and AO have united to demand sweeping changes to US surveillance laws and an international ban on bulk collection of data",4316,2013-12-09
30,Apple and Samsung are both under investigation by the Italian government over planned obsolescence - Italy’s antitrust organization wants to know if the two companies are intentionally slowing down their phones,4129,2018-01-19
31,Apple agrees to pay Ireland $15.4 billion in back taxes to appease EU,4121,2017-12-04
32,Apple gave Uber's app 'unprecedented' access to a secret backdoor that can record iPhone screens,3143,2017-10-06
33,Trump tells Apple to make products in U.S. to avoid China tariffs,2982,2018-09-08
34,EU says Ireland's Apple complaint will only be dropped if it recovers the full $16 billion in unpaid taxes,2929,2018-02-27
35,"Chinese spy chips are found in hardware used by Apple, Amazon, Bloomberg says; Apple, AWS say no way",2878,2018-10-04
36,"Apple could be on the hook for $19 billion in taxes, and the Obama administration is livid",2874,2016-08-24
37,"Facebook is reportedly under criminal investigation over deals that gave Apple, Amazon, and other companies access to user data",2847,2019-03-13
38,Russia demands that Apple display annexed Crimea as Russian territory on its maps,2792,2019-02-06
39,"Snowden: ""Google, Facebook, Microsoft, Yahoo, Apple, and the rest of our internet titans must ask themselves why they aren't fighting for our interests the same way""",2677,2013-08-09
40,"Chinese iCloud Users Warned The Government Could Access Their Data. Apple has agreed to store iCloud data in China, allowing country's authorities to bypass the US court system when seeking information on its users.",2583,2018-02-24
41,"Huawei cloning Apple parts, rewarding employees for tech theft",2584,2019-02-18
42,"Leaked NSA presentation claims that NSA has ""direct access"" to servers at Google, Apple, Facebook, Skype, Yahoo, and many others",2483,2013-06-07
43,"Apple loses tablet copyright appeal against Samsung
| Reuters",2440,2012-10-18
44,Apple CEO Tim Cook challenges Obama with impassioned stand on privacy,2318,2015-02-13
45,Apple denounces neo-Nazis as Spotify bans ‘white power’ tracks,2270,2017-08-17
46,"Apple has prevented the Telegram messaging service from updating globally ever since Russia ordered Apple to remove the service from its stores, Telegram's CEO and founder said on Thursday.",2122,2018-05-31
47,Apple admits giving governments access to thousands of iPhones and other devices,2100,2018-12-26
48,Poland asks US to import apples banned by Russia,2072,2014-08-10
49,"Apple CEO Tim Cook slams US decision to withdraw from climate deal, says he tried to convince Trump otherwise",1953,2017-06-01
50,Apple ordered to pay $533 million for patent infringement,1941,2015-02-25
51,The EU is taking Ireland to its highest court over its failure to make Apple pay tax,1912,2017-10-04
52,Apple Inc and its main contract manufacturing Foxconn agreed to tackle violations of conditions among the 1.2 million workers assembling iPhones and iPads in a landmark decision that could change the way Western companies do business in China.,1903,2012-03-30
53,Apple confirms it uses Google's cloud for iCloud,1890,2018-02-26
54,Apple removes VPN apps from the App Store in China,1858,2017-07-29
55,"EU hits Qualcomm with €1 billion [US$1.2 billion] fine for paying Apple so that the iPhone maker only used its chips, blocking rivals such as Intel",1831,2018-01-24
56,China forced Apple to remove New York Times app in China because NYT had an article about Chinese Propaganda Video,1777,2017-01-05
57,Apple faces billions in fines in tax avoidance probe,1756,2014-09-29
58,French lawsuit launched against Apple for alleged crime of slowing down iPhones,1741,2017-12-28
59,Australian regulator sues Apple alleging iPhone 'bricking': Australia's consumer watchdog is alleging [Apple] used a software update to disable iPhones which had cracked screens fixed by third parties.,1732,2017-04-06
60,"Quebec Drops Ban on Selling Ugly Fruit - Minister of Agriculture announces “ugly fruit” can now be sold in stores across the province. Perfectly shaped apples & potatoes will share shelf space with double-pronged carrots, misshapen pears, crooked cucumbers & hideously disfigured eggplants.",1737,2016-08-01
61,An Australian court has fined Apple A$9m (£5m; $6.5m) for refusing to fix iPhones and iPads that had been serviced by third parties. The nation's consumer watchdog took the tech giant to court last year. Apple admitted that it misled 275 people about their rights to repairs and replacements.,1700,2018-06-19
62,"US Companies Stashing $1.95 Trillion In Profits Overseas; tech companies such as Microsoft, Apple and IBM among the worst offenders.",1695,2014-03-15
63,Apple Keeps Losing Legal Battles to an Italian Company Called ‘Steve Jobs’,1665,2017-12-28
64,Apple loses Samsung patent case in Japan,1652,2012-08-31
65,Apple is under fire for moving iCloud data to China,1547,2018-03-03
66,Chemicals killing smartphone chip factory workers: Samsung and Apple factories accused,1517,2014-04-24
67,"US accused of ‘acting like a tax haven’ for threatening retaliation against Brussels’ anti-trust investigations into Apple, Amazon and Starbucks",1507,2016-08-25
68,"Apple investing in 27,000 acre mangrove forest in Colombia to combat climate change.",1508,2018-09-15
69,"Apple chief executive Tim Cook says the European Commission ruling that Apple should pay billions of euros in back taxes to the Republic of Ireland is ""maddening"" and ""political"".",1431,2016-09-01
70,"Apple, Microsoft, Google and other US firms to commit $140bn to address climate change",1422,2015-07-27
71,Apple Continues To Insist Only It Can Use An Apple In A Logo; Threatens Small German Cafe,1386,2011-10-25
72,"Apple 'deeply offended' by conclusion of BBC's undercover investigation in Chinese factories; declines to comment but sends mass email to about 5,000 UK staff.",1368,2014-12-19
73,Italy fines Apple over misleading tax conduct,1318,2015-12-30
74,Apple asks Facebook to remove its spyware-like Onavo VPN from the App Store,1287,2018-08-23
75,"Hackers are using Reddit to control 17,000 Apple computers",1248,2014-10-03
76,Apple could be ordered to pay billions of euros in back taxes in theRepublic of Ireland by European Union competition officials,1249,2016-08-29
77,EU reminds Apple it still has to repay €13bn in taxes after Apple announces it will pay $38bn in US taxes,1237,2018-01-19
78,European Union regulators who slapped Apple Inc. with a 13 billion-euro ($14.6 billion) tax bill are examining allegations that Ikea dodged at least 1 billion euros in taxes over the past six years.,1105,2016-09-18
79,Apple to pay £136 million in back taxes after UK audit,1105,2018-01-16
80,"Tim Berners-Lee, creator of the world wide web, warns that we need to defend the web, or else it could break up into fragmented islands, led by Apple, Facebook and Google.",1090,2010-11-22
81,We’re the ICIJ staff who worked on the Paradise Papers investigation. We’re here to answer your questions about the Paradise Papers! AUA,1086,2017-12-21
82,Apple factory conditions lead to '90 per cent of workforce taken to hospital',1077,2018-01-17
83,Alphabet- Google's parent company- has surpassed Apple as the world's most valuable company after its latest earnings report.,1071,2016-02-01
84,Google to warn Gmail users of ‘government backed attacks’ in new warnings as tech industry backs Apple in privacy fight,1070,2016-03-25
85,Monument To Apple's Jobs Removed In Russia After CEO Comes Out,1050,2014-11-03
86,"Hong Kong now has more super-rich people than any other city. It has overtaken the Big Apple to become the top destination for the planet's wealthiest people. The number of ultra-high-net-worth individuals residing in the Asian financial hub rose by almost a third in 2017 to 10,000.",1032,2018-09-06
87,Was Apple security ‘flaw’ actually an NSA backdoor?,1018,2014-02-24
88,Danish man wins landmark case against Apple after five-year battle,1011,2016-12-11
89,"The EU's ruling that Apple Inc must pay a huge tax bill to Ireland was clearly based on facts and existing rules and was not a decision aimed against the United States, European Commission President Jean-Claude Juncker said on Sunday.",981,2016-09-04
90,"Mr. Cook, where is the Censorship Red Line for Apple? Why have you removed news apps and VPNs from the Chinese app store? I am Sunday Yokubaitis, the president of Golden Frog (VyprVPN), a company fighting for a free and open Internet. AMA!",964,2017-09-14
91,The NSA Reportedly Has Total Access To The Apple iPhone,920,2013-12-30
92,Apple will start paying $16 billion in back taxes to Ireland,879,2018-04-25
93,Child labour uncovered in Apple's supply chain,854,2013-01-25
94,"The G20, a group of the world’s richest economies, have for the first time endorsed a plan to curb widely used tax avoidance strategies that allow some multinational corporations such as Apple and Starbucks to pay only a pittance in income taxes.",821,2013-07-20
95,"Chinese Companies Ask Employees To Boycott Apple, Offer Incentives To Buy Huawei Products",816,2018-12-26
96,"Foxconn, the world’s biggest electronics contract manufacturer and a key Apple supplier, said on Saturday it was looking into reports that hundreds of its temporary workers took to the streets last week demanding unpaid wages from recruitment agencies.",779,2018-12-16
97,Apple no longer has exclusive rights to the “iPhone” name in China,770,2016-05-03
98,"Apple's fine-print reveals a secret program to spy on Iphone users and generate ""trust scores""",761,2018-09-22
99,Hackers threaten to wipe 200 million iCloud accounts unless Apple pays ransom,752,2017-03-22
100,"Russia wants Apple, SAP to cooperate against foreign spying: Russia has proposed that Apple Inc and SAP hand the government access to their source code to make sure their widely used products are not tools for spying on state institutions.",683,2014-07-30
101,"RIM, Nokia and Apple added backdoors to their mobile software which the Indian Military's intelligence service then used to spy on the US-China Economic and Security Review Commission. The backdoors were added in exchange for Indian market presence",673,2012-01-09
102,"Our biggest gadget makers—including HP and Apple—may get their raw ingredients from genocidal militias in Congo. A new movement has begun to trace rare metals to the “conflict mines” they come from, and it won its first major victory this week.",664,2010-07-16
103,"Google, Apple, Facebook and Microsoft draft a joint letter opposing Trump’s travel ban",636,2017-02-03
104,"Europe plans special tax for Google, Apple, Facebook, and Amazon",638,2018-03-05
105,"Facebook, Apple confirm they were targets of Supermicro malware attack",635,2018-10-05
106,"Apple loses bid to ban protests by French tax campaign group - Attac had staged a sit-in at Apple's flagship Paris store on December 2nd, blocking access for several hours in protest at what they claimed was ""massive tax evasion"" by the US tech giant.",625,2018-02-25
107,Chinese state media has branded Apple Inc's iPhone a threat to national security because of the smartphone's ability to track and time-stamp user locations.,623,2014-07-12
108,Apple Tries to Trademark the Word 'Startup',585,2013-08-28
109,"Roomba maker may share maps of users' homes with Google, Amazon or Apple",554,2017-07-27
110,Amazon overtakes Apple and Google to be named world's most valuable brand,526,2018-01-31
111,"A French court threw out a complaint by Apple demanding a ban on protests at its stores by the tax campaign group Attac. Attac had staged a sit-in at it's flagship Paris store on December 2, blocking access for several hours to protest ""massive tax evasion"" by Apple",524,2018-02-23
112,Apple warns UK surveillance bill would 'spark serious international conflicts',487,2015-12-22
113,"Apple and Google Just Attended a Confidential Spy Summit in a Remote English Mansion | The three-day conference included current or former spy chiefs from seven countries, including the US and UK, plus academics and journalists to discuss government surveillance in the aftermath of Snowden’s leaks",473,2015-05-22
114,"Apple, Google and Microsoft have denounced the Australian government’s decision to pass an anti-encryption law that they claim undermines cybersecurity and human rights.",457,2018-12-11
115,Apple and Microsoft's CEOs were pictured at dinner with Brazil's far-right president in Davos,418,2019-01-23
116,WikiLeaks releases ‘Dark Matter’ #Vault7 revealing CIA attacks on Apple products,420,2017-03-23
117,"FOXCONN: Yes, Our CEO Called Our Employees ""Animals"", But He Didn't Mean it as an Insult - 
A clarification & apology from Apple's iPhone-maker",401,2012-01-22
118,Apple and Google Urged to Dump Saudi App That Lets Men Track Women,381,2019-02-14
119,"The 'Human Costs' of an iPad -- ""Oddly, it is Apple's own internal reports that reveal most of these problems to Western observers, but attempts to correct the issues and improve the fortunes of laborers have a tendency to clash with the company's own insistence on low costs and high volume.""",361,2012-01-26
120,2 Indian Engineers Sued Apple For Copying Their Patent Technology & Won.,336,2015-10-15
121,The EU is now going after Amazon after slapping Google and Apple with giant fines,318,2018-09-19
122,Apple Watch banned from UK cabinet meetings over Russian hacking fears,314,2016-10-10
123,"EU launches attack against corporate tax avoidance: The EU has taken steps to curb tax avoidance by global corporations. In recent months, criticism in the budget-strapped bloc has mounted over tax loopholes exploited by companies such as Apple, Google and others.",308,2014-06-21
124,"Apple confirms its culture of censorship and joins Bank of America, Paypal, Mastercard, Visa, Amazon and others to be Boycotted! Freedom of Information prevails!",292,2010-12-21
125,"South Korea moving to tax Google, Apple, Amazon",288,2018-08-02
126,"South Korea says concerned about U.S. decision on some Apple models. The move was vehemently criticized by the South Korean media as ""protectionism.",286,2013-08-05
127,Apple censors Pride watch face in Russia,288,2018-09-04
128,Apple Reportedly Blocked Police iPhone Hacking Tool and Nobody Knows How,280,2018-10-25
129,"Apple executive shot dead by UP cops, his family asks ‘was he a terrorist’ | Hindustan Times",266,2018-09-29
130,"Microsoft, Apple (and others) summonsed to explain high prices in Australia",261,2013-02-11
131,"European Commision to accuse Ireland of giving illegal state aid to Apple, fines could be €Billions | 9to5Mac",245,2014-09-28
132,"An Indian city is getting futuristic pod taxis to beat traffic blues: Gurgaon, a suburb of New Delhi and home to India headquarters of MNC's like Google, Microsoft and Apple, is about to get driverless electric pods to alleviate traffic woes",238,2016-07-14
133,Major blow to Apple as one of its key patents is invalidated. The patent helped it win a 1 billion dollar judgement against Samsung,229,2012-12-20
134,"Drone-Tracking App Gets No Traction From Apple: For the third time in a month, Apple has rejected a proposed app that tracks American drone strikes. The company says the app is ""objectionable and crude""; the developer says he wants to encourage more dialogue about drone attacks.",227,2012-08-30
135,"Russian mobile operators say 'nyet!' to Apple, 'da!' to Samsung: All three top carriers have discontinued iPhone",224,2013-07-18
136,Apple's App Store infected with malware in China,219,2015-09-21
137,Apple to pay $2 million for misleading Aussies over 4G iPad,216,2012-06-08
138,"Congo mines no longer in grip of warlords and militias, Enough Project finds 2010 US law requiring companies like Apple and Intel to prove products are conflct-free has worked",220,2014-06-11
139,"Giovanni Gambino Warns ISIS: The Big Apple is Off Limits, Thanks to Sicilian Mafia",214,2015-11-23
140,Apple's Tim Cook and IBM's Ginni Rometty think Facebook should see greater regulation in the wake of data breach,210,2018-03-26
141,"UK surveillance bill could bring 'very dire consequences', warns Apple chief | ‘Any back door is a back door for everyone,’ says Tim Cook of proposals to allow authorities to track citizens’ internet use without requiring warrant",211,2015-11-09
142,"It's not just Apple and Ikea, China also fakes these stores: Disney, Nike, D&G, McDonald's, Starbucks and more",208,2011-08-01
143,Sweatshops have gone digital.  NGO study reveals excessive work hours and draconian rules for workers in factories in China making components for Apple,200,2011-05-01
144,Apple pays Ireland first tranche of disputed taxes,198,2018-05-19
145,Apple and Samsung fined in Italy for slowing down their phones,196,2018-10-26
146,"EU opens in-depth probes into tax rulings on Apple, Starbucks, Fiat unit",199,2014-06-11
147,"Australia made third highest number of requests for Apple data in the world - In the first half of 2018 Australian authorities made 2,375 requests, more than China, Singapore or the UK",203,2018-12-24
148,"Facebook and Apple urge Donald Trump not to pull out of Paris Agreement: Twenty-five US companies including Apple, Facebook and Google have signed a letter imploring Mr Trump not to exit the 2015 Paris climate accord",196,2017-06-01
149,Starbucks and Fiat Chrysler's tax avoidance deals to be ruled illegal | Companies face multimillion-euro repayment bills after EC’s 15-month investigation. Rulings on Amazon and Apple will follow,195,2015-10-21
150,Apple chief calls for laws to tackle 'shadow economy' of data firms,188,2019-01-17
151,Italy's anti-trust watchdog said on Wednesday (Oct 24) it was fining Apple Inc. and Samsung Electronics Co Ltd 5 million euros (US$5.7 million) each following complaints they used software updates to slow down their mobile phones.,177,2018-10-24
152,Apple has lost its position as the second-biggest smartphone maker in the world,177,2017-09-07
153,Europe bans American apples for containing a possibly carcinogenic chemical and group asks U.S to examine them,178,2014-04-26
154,UK Judge: Apple must run ads saying Samsung DIDN'T copy the iPad,173,2012-07-19
155,"Apple, Google urged to remove app that lets Saudi men track wives",169,2019-02-13
156,"Apple removes several apps, including Skype, in China",163,2017-11-21
157,Google faces legal action over alleged secret iPhone tracking: 10 million UK iPhone users could have grounds to sue Google after it sidestepped Apple security settings to monitor web habits,164,2013-01-27
158,"The world’s most widely used insecticides harm the ability of bumblebees to pollinate apple trees, scientists have discovered. The finding has important implications for agriculture and the natural world, say the researchers, as many food crops and wildflowers rely on bee pollination to reproduce.",156,2015-11-18
159,'We are like robots': Apple investigates Chinese factory using forced student labour - Supplier under fire after vocational degrees were withheld unless students undertook factory work,156,2018-10-30
160,Bricked iPhones with 'Error 53' just cost Apple $6.7 million in Australia,157,2018-06-21
161,Apple halts sale of iPhone 7 and 8 in Germany,152,2018-12-23
162,"Apple takes strong privacy stance in new report, publishes rare “warrant canary”: “Apple has never received an order under Section 215 of the USA Patriot Act.”",154,2013-11-05
163,Apple Nicked Billions in Tax from Australia,150,2014-03-22
164,"Apple, Samsung and Sony face child labour claims",152,2016-01-18
165,Apple faces lawsuit claiming it hid the iPhone XS notch and lied about screen size,143,2018-12-15
166,"Apple slugged in Australia by new tax laws after a 5.5 billion dollar tax discrepancy - ""the cloak of invisibility is no longer acceptable""",144,2013-02-06
167,"Russia’s Investigative Committee has reportedly bought Chinese surveillance equipment allowing it to hack into thousands of cell phone models, including Apple & Android devices",146,2018-08-16
168,"Beyond Foxconn: More Dirt on the Factories Making Your iPhone - Troubling new findings cast doubt on Apple's highly publicized promise to improve  conditions in its overseas factories. Using surveys, onsite visits, undercover investigations, & face-to-face interviews, 10 factories were evaluated.",144,2012-07-19
169,"Norway says no to Apple regarding high precision photo of Oslo City to be used in Apple's map solution. U.S Embassy: ""Please reconsider"".",143,2013-08-12
170,"Putting Foxconn's Wage Rises in Context: Anti-Apple Protests Have Nothing To Do With It, China is Running Out Of Underemployed Farmers",143,2012-02-20
171,"A new study shows that the most widely used insecticides in the world—neonicotinoids—turn bumblebees into more bumbling pollinators, leading to lower yields for apples and perhaps other plants that they visit.",138,2015-11-19
172,Apple is no longer worlds most profitable tech company.,142,2017-07-07
173,"U.S. Companies Are Stashing $2.1 Trillion Overseas to Avoid Taxes. Microsoft Corp., Apple Inc., Google Inc. and five other tech firms now account for more than a fifth of the $2.10 trillion in profits that U.S. companies are holding overseas.",137,2015-03-07
174,Apple loses $US62b in minutes as shares crash on disappointing results,140,2015-07-21
175,"Facebook, Microsoft, Apple Make Year-End Lobbying Push to Curb NSA Spying",131,2014-11-14
176,EU court rejects U.S. intervention in Apple's Irish $15 billion tax case,128,2017-12-15
177,'Even worse than Foxconn': Apple rocked by child labour claims,129,2013-10-10
